index,published,keyword,domain,language,valid,title,description,url,image,archive,content,quote,de,en,la,added
fdb5c7852a462413759d5807d429f72a,2026-06-08T09:00:00Z,'wildfire',www.cbc.ca,en,0.9,"Why your next home insurance premium could depend on laser scans, not past fires",Actuaries and insurance experts say wildfires are not following historical patterns and are behaving in unexpected ways. Insurers are turning to predictive models to assess risk.,https://www.cbc.ca/news/canada/nova-scotia/wildfire-risk-new-techniques-insurance-uninsurable-9.7194081,"https://i.cbc.ca/ais/1.6898603,1780684539768/full/max/0/default.jpg?im=Crop%2Crect%3D%28529%2C1157%2C2471%2C1389%29%3BResize%3D620",,"When Tricia Murray rebuilt her home in Hammonds Plains, N.S., after the devastating 2023 wildfires, she expected her insurance premiums to soar.
Her original house was purchased in 2017 for $253,000… [+2490 chars]",,"Warum Ihre nächste Hausratversicherungsprämie von Laserscans und nicht von vergangenen Bränden abhängen könnte. Versicherungsmathematiker und Versicherungsexperten sagen, dass Waldbrände nicht den historischen Mustern folgen und sich auf unerwartete Weise verhalten. Versicherer greifen zur Risikobewertung auf Vorhersagemodelle zurück.","Why your next home insurance premium could depend on laser scans, not past fires. Actuaries and insurance experts say wildfires are not following historical patterns and are behaving in unexpected ways. Insurers are turning to predictive models to assess risk.","Cur proximo tuo premium assecurationis domus laseris scans, non ignibus praeteritis pendere potuit. Actuaria et assecurationis periti dicunt incendia ignium non sequentes exemplaria historica et vias inopinatas gerere. Insurers convertuntur ad exempla predictive aestimandi periculum.",2026-06-10 07:17:27+00:00
b188b858d0c0f584e1a2777ddff47821,2026-06-08T19:53:00Z,'wildfire',www.prnewswire.com,en,0.9,Applications Now Open for PG&E and California Fire Foundation Wildfire Preparedness Grants,"More than $1 million in grants, public education, and outreach funded in 2026; Applications Accepted June 8 through July 8 OAKLAND, Calif., June 8, 2026 /PRNewswire/ -- With peak wildfire season approaching across Northern and Central California, Pacific Gas …",https://www.prnewswire.com/news-releases/applications-now-open-for-pge-and-california-fire-foundation-wildfire-preparedness-grants-302794366.html,https://mmx.prnewswire.com/media/MS626951/Pacific_Gas_and_Electric_Logo.jpg?id=OA2691931&p=facebook,http://web.archive.org/web/20260609044825/https://www.prnewswire.com/news-releases/applications-now-open-for-pge-and-california-fire-foundation-wildfire-preparedness-grants-302794366.html,"More than $1 million in grants, public education, and outreach funded in 2026; Applications Accepted June 8 through July 8
OAKLAND, Calif., June 8, 2026 /PRNewswire/ -- With peak wildfire season app… [+5424 chars]",,"Bewerbungen für Wildfire Preparedness Grants von PG&E und der California Fire Foundation sind jetzt möglich. Mehr als 1 Million US-Dollar an Zuschüssen, öffentlicher Bildung und Öffentlichkeitsarbeit im Jahr 2026; Bewerbungen werden vom 8. Juni bis 8. Juli entgegengenommen. OAKLAND, Kalifornien, 8. Juni 2026 /PRNewswire/ -- Während die Hauptsaison der Waldbrände in Nord- und Zentralkalifornien naht, ist Pacific Gas …","Applications Now Open for PG&E and California Fire Foundation Wildfire Preparedness Grants. More than $1 million in grants, public education, and outreach funded in 2026; Applications Accepted June 8 through July 8 OAKLAND, Calif., June 8, 2026 /PRNewswire/ -- With peak wildfire season approaching across Northern and Central California, Pacific Gas …","Applications Now Open for PG&E and California Fire Foundation Wildfire Preparedness Grants. Plus quam $1 decies centena millia in concessionibus, educatione publica, et proiectione in anno 2026; Applicationes receptae per 8 iulii 8 iulii OAKLAND, Calif., die 8 iunii 2026 / PRNewswire/ -- Ignium incendium apicum per septentrionalem et Centralem Californiam, Pacificum Gas … appropinquantem.",2026-06-10 07:17:27+00:00
2b20cf0df6ed672b22bc3f7ae0f7128d,2026-06-06T23:54:34Z,'wildfire victims',punchng.com,en,0.3,"The constitution at gunpoint: Tinubu, Aiyedatiwa, Ogbomoso and the Owo verdict","The Owo massacre verdict brings justice for victims, but global terror affiliates now threaten Nigeria’s South-West. Learn how the constitution is at gunpo

Read More: https://punchng.com/the-constitution-at-gunpoint-tinubu-aiyedatiwa-ogbomoso-and-the-owo-ver…",https://punchng.com/the-constitution-at-gunpoint-tinubu-aiyedatiwa-ogbomoso-and-the-owo-verdict/,https://cdn.punchng.com/wp-content/uploads/2025/08/10213404/Kunle-Somorin.jpg,,"The reverberation of the gavel that fell in the Abuja Federal High Court on Wednesday, June 3, 2026, carried far beyond the courtroom walls.
It signalled not merely the conclusion of a harrowing cri… [+9300 chars]",,"Die Verfassung mit vorgehaltener Waffe: Tinubu, Aiyedatiwa, Ogbomoso und das Owo-Urteil. Das Urteil zum Owo-Massaker bringt Gerechtigkeit für die Opfer, doch globale Terrororganisationen bedrohen jetzt den Südwesten Nigerias. Erfahren Sie, wie die Verfassung bei Gunpo ist

Weiterlesen: https://punchng.com/the-constitution-at-gunpoint-tinubu-aiyedatiwa-ogbomoso-and-the-owo-ver…","The constitution at gunpoint: Tinubu, Aiyedatiwa, Ogbomoso and the Owo verdict. The Owo massacre verdict brings justice for victims, but global terror affiliates now threaten Nigeria’s South-West. Learn how the constitution is at gunpo

Read More: https://punchng.com/the-constitution-at-gunpoint-tinubu-aiyedatiwa-ogbomoso-and-the-owo-ver…","Constitutio ad gunpunctum: Tinubu, Aiyedatiwa, Ogbomoso et Owo iudicium. Iudicium Owo caedes victimas iustitias affert, sed terror globalis Socius Nigeriae Meridionalis-Occidens nunc comminatur. Disce quomodo constitutio est apud gunpo

Lege More: https://punchng.com/the-constitution-at-gunpoint-tinubu-aiyedatiwa-ogbomoso-and-the-owo-ver...",2026-06-10 11:48:31+00:00
b08ed5405c951a0ed989a1666c75746c,2026-06-07T12:34:12Z,'wildfire',consent.yahoo.com,en,0.9,"In Brazil’s Cerrado region, Indigenous fire practices reshape wildfire strategy",,https://consent.yahoo.com/v2/collectConsent?sessionId=1_cc-session_f67cf61f-3469-45e7-86b4-6afb57ecae20,,,"If you click 'Accept all', we and our partners, including 247 who are part of the IAB Transparency &amp; Consent Framework, will also store and / or access information on a device (in other words, us… [+1046 chars]",,In der brasilianischen Region Cerrado verändern indigene Brandpraktiken die Waldbrandstrategie. Keiner,"In Brazil’s Cerrado region, Indigenous fire practices reshape wildfire strategy. None",In regione Brasiliae Cerrado exercitia ignis Indigenae belli ferum reformabit. Nullus,2026-06-10 11:48:31+00:00
5d9adfdf940072dd8a4631995843f62e,2026-06-08T09:00:00Z,'wildfire area',www.cbc.ca,en,0.9,Truro encampment cleanup underway; shelter warns it will happen again,"People living in the woods off William Barnhill Drive have left the area as the Town of Truro prepares to spend up to $50,000 to clean up a site officials say is a wildfire risk and has been linked to local theft..",https://www.cbc.ca/news/canada/nova-scotia/truro-encampment-william-barnhill-2026-9.7223664,"https://i.cbc.ca/ais/6a3f2baf-9981-4d5b-8fbc-5c6326851377,1780595820785/full/max/0/default.jpg?im=Crop%2Crect%3D%280%2C535%2C5712%2C3213%29%3BResize%3D620",,"People living in the woods off William Barnhill Drive have left the area as the Town of Truro prepares to spend up to $50,000 to clean up a site officials say is a wildfire risk and has been linked t… [+3078 chars]",,"Aufräumarbeiten im Truro-Lager sind im Gange; Tierheim warnt davor, dass es wieder passieren wird. Menschen, die in den Wäldern am William Barnhill Drive leben, haben das Gebiet verlassen, während die Stadt Truro sich darauf vorbereitet, bis zu 50.000 US-Dollar für die Säuberung eines Geländes auszugeben, von dem Beamte sagen, dass es ein Waldbrandrisiko darstellt und mit lokalen Diebstählen in Verbindung gebracht wird.","Truro encampment cleanup underway; shelter warns it will happen again. People living in the woods off William Barnhill Drive have left the area as the Town of Truro prepares to spend up to $50,000 to clean up a site officials say is a wildfire risk and has been linked to local theft..","Truro castrametatus Tersibus comparatis; culum admonet venturum esse. Homines in silvis habitantes off William Barnhill Coegi aream reliquerunt sicut oppidum Truro parat consumere ad $50,000, ut magistratus locum purgare dicunt periculum incendium esse et cum furto locali coniunctum.",2026-06-10 11:48:31+00:00
6e77e3ed050b6b77cfa15c90eb10bd56,2026-06-08T13:45:00Z,'wildfire disaster',www.globenewswire.com,en,0.9,"Watch Duty, the Wildfire Alert Nonprofit Trusted During the LA Fires, Now Covers Major Flooding Nationwide","The free nonprofit app known as a primary information source for wildfire-impacted families across 50 states, now covers flooding, the most deadly natural disaster in the United States The free nonprofit app known as a primary information source for wildfire-…",https://www.globenewswire.com/news-release/2026/06/08/3308218/0/en/Watch-Duty-the-Wildfire-Alert-Nonprofit-Trusted-During-the-LA-Fires-Now-Covers-Major-Flooding-Nationwide.html,https://ml.globenewswire.com/Resource/Download/8f6d5b6a-55fd-4bb4-a234-297a34562fb5,http://web.archive.org/web/20260608174402/https://www.globenewswire.com/news-release/2026/06/08/3308218/0/en/watch-duty-the-wildfire-alert-nonprofit-trusted-during-the-la-fires-now-covers-major-flooding-nationwide.html,"San Francisco, CA, June 08, 2026 (GLOBE NEWSWIRE) -- Watch Duty, the nonprofit known for reliable wildfire alerts, today launched flood coverage across the United States, marking the organization's f… [+2975 chars]",,"Watch Duty, die gemeinnützige Organisation zur Warnung vor Waldbränden, der während der Brände in Los Angeles vertraut wurde, deckt jetzt schwere Überschwemmungen im ganzen Land ab. Die kostenlose gemeinnützige App, die als Hauptinformationsquelle für von Waldbränden betroffene Familien in 50 Bundesstaaten bekannt ist, deckt jetzt Überschwemmungen ab, die tödlichste Naturkatastrophe in den Vereinigten Staaten.","Watch Duty, the Wildfire Alert Nonprofit Trusted During the LA Fires, Now Covers Major Flooding Nationwide. The free nonprofit app known as a primary information source for wildfire-impacted families across 50 states, now covers flooding, the most deadly natural disaster in the United States The free nonprofit app known as a primary information source for wildfire-…","Vigilate Officium, INCAENDIUM erecti Non prodest confidere in LA Fires, Nunc maiorem inundationem Nationum operit. Liberum app non quaestuosum notum ut fons primariae informationis pro familias ignium impingente per 50 civitates, nunc inundationem tegit, calamitatem funestissimam naturalem in Civitatibus Foederatis Americae gratuitam app notionem non proficuam ut primarium informationum fontem pro ignium ferum-...",2026-06-10 11:48:31+00:00
759f0a40a5c46e94ec5e321ac922ed68,2026-06-02T21:43:06Z,'wildfire',www.kpbs.org,en,0.9,California chooses its next insurance watchdog amid wildfire crisis,Californians finish voting Tuesday for who they think can best tackle one of the toughest jobs in the state: insurance commissioner.,https://www.kpbs.org/news/politics/2026/06/02/california-chooses-its-next-insurance-watchdog-amid-wildfire-crisis,https://cdn.kpbs.org/dims4/default/58af414/2147483647/strip/true/crop/2000x1050+0+181/resize/1200x630!/quality/90/?url=http%3A%2F%2Fkpbs-brightspot.s3.us-west-2.amazonaws.com%2F92%2F13%2F62f1cc574c569ddbd6bdc8ba19a9%2F010825-eaton-fire-ap-cm-03.jpg,http://web.archive.org/web/20260603094840/https://www.kpbs.org/news/politics/2026/06/02/california-chooses-its-next-insurance-watchdog-amid-wildfire-crisis,"This story was originally published by CalMatters. Sign up for their newsletters.
Californians finish voting Tuesday for who they think can best tackle one of the toughest jobs in the state: insuran… [+3222 chars]",,"Kalifornien wählt seinen nächsten Versicherungswächter inmitten der Waldbrandkrise. Die Kalifornier beenden am Dienstag ihre Abstimmung darüber, wer ihrer Meinung nach einen der schwierigsten Jobs im Staat am besten bewältigen kann: Versicherungskommissar.",California chooses its next insurance watchdog amid wildfire crisis. Californians finish voting Tuesday for who they think can best tackle one of the toughest jobs in the state: insurance commissioner.,California proximum assecurationis vigilem inter ignem ferum discrimen eligit. Californianes suffragii Martis perficiendi sunt qui putant unum ex durissimis negotiis posse occupari in re publica: commissarium assecurationis.,2026-06-10 17:34:53+00:00
6bd87700901bc2fa2f003ae4712a3219,2026-06-01T00:01:44Z,'wildfire heat',alltoc.com,en,0.9,Why were 2025 wildfires so costly? #science,2025 wildfires hit harder despite low global burned area A new analysis of global wildfire activity in 2025 found the world experienced some of the most destructive and deadly fire events in recent history even as overall burned area approached record lows. T…,https://alltoc.com/science/why-were-2025-wildfires-so-costly,https://alltoc.com/cdn/1048/og.png,,"2025 wildfires hit harder despite low global burned area
A new analysis of global wildfire activity in 2025 found the world experienced some of the most destructive and deadly fire events in recent … [+1406 chars]",,"Warum waren die Waldbrände im Jahr 2025 so kostspielig? #Wissenschaft. Waldbrände im Jahr 2025 sind trotz der geringen verbrannten Fläche weltweit stärker betroffen. Eine neue Analyse der globalen Waldbrandaktivität im Jahr 2025 ergab, dass die Welt einige der verheerendsten und tödlichsten Feuerereignisse in der jüngeren Geschichte erlebte, obwohl sich die Gesamtfläche der verbrannten Fläche einem Rekordtief näherte. T…",Why were 2025 wildfires so costly? #science. 2025 wildfires hit harder despite low global burned area A new analysis of global wildfire activity in 2025 found the world experienced some of the most destructive and deadly fire events in recent history even as overall burned area approached record lows. T…,"Cur 2025 ignes tam pretiosos? #scientia. 2025 Ignes feris duriores quamvis humilem globalem aream incenderunt, Nova analysis activitatis ignis globalis anno MMXXV mundum invenit expertum quosdam ignis eventus perniciosissimi et funestissimi in recenti historia etiam ut altiore areae ustae accessus recordum sequitur. T…",2026-06-10 22:21:03+00:00
f9bae24c35f5e01924cd309a7e0a55f5,2026-06-05T14:00:00Z,'forest fire',journals.plos.org,en,0.8,Thermal transformation of organic matter and impacts on water quality in fire-affected Jarrah Forest,Fire in forested catchments significantly alters organic matter fluxes by generating dissolved organic matter (DOM) different from that generated under non-fire conditions. Elucidating the composition of DOM is key to understanding its persistence in the post…,https://journals.plos.org/water/article?id=10.1371/journal.pwat.0000561,https://journals.plos.org/water/article/figure/image?id=10.1371/journal.pwat.0000561.g005&size=inline,,"Abstract
Fire in forested catchments significantly alters organic matter fluxes by generating dissolved organic matter (DOM) different from that generated under non-fire conditions. Elucidating the … [+57808 chars]",,"Thermische Umwandlung organischer Stoffe und Auswirkungen auf die Wasserqualität im vom Feuer betroffenen Jarrah-Wald. Brände in bewaldeten Einzugsgebieten verändern den Fluss organischer Stoffe erheblich, indem sie gelöste organische Stoffe (DOM) erzeugen, die sich von denen unterscheiden, die unter Nichtfeuerbedingungen entstehen. Die Aufklärung der Zusammensetzung von DOM ist der Schlüssel zum Verständnis seiner Beständigkeit im Beitrag …",Thermal transformation of organic matter and impacts on water quality in fire-affected Jarrah Forest. Fire in forested catchments significantly alters organic matter fluxes by generating dissolved organic matter (DOM) different from that generated under non-fire conditions. Elucidating the composition of DOM is key to understanding its persistence in the post…,Transmutatio scelerisque materiae organicae et impetus in qualitatem aquae in igne affecto Jarrah Forest. Ignis in aucupationibus sylvestribus signanter variat fluxiones materiae organicae generans materiam organicam dissolutam ab illa generata sub conditionibus non ignitis. Illustrans compositionem DOM clavem ad cognoscendam eius pervicaciam in postibus...,2026-06-12 08:01:37+00:00
