index,published,keyword,domain,language,valid,title,description,url,image,archive,content,quote,de,en,la,added
763fd23c7315ae7e5abc4c79715c7127,2026-03-03T01:50:03Z,'wildfire',www.siskiyou.news,en,0.9,Urgent Call to Shift Wildfire Management Practices to Protect Public Health and Safety in Siskiyou County,"Post Views: 294 Public Letter for disclosure/publishing – March 1, 2026 Dear Members of the Board of Supervisors, Sheriff LaRue, and Concerned Officials: I am writing as a resident and advocate for wildfire prevention in Siskiyou County CA to bring attention …",https://www.siskiyou.news/2026/03/02/urgent-call-to-shift-wildfire-management-practices-to-protect-public-health-and-safety-in-siskiyou-county/,https://www.siskiyou.news/wp-content/uploads/2026/03/Bill-on-fire-line-3-1-e1772501315993.jpg,,"Public Letter for disclosure/publishing – March 1, 2026
Dear Members of the Board of Supervisors, Sheriff LaRue, and Concerned Officials:
I am writing as a resident and advocate for wildfire preven… [+4129 chars]",,"Dringender Aufruf zur Änderung der Waldbrandmanagementpraktiken zum Schutz der öffentlichen Gesundheit und Sicherheit im Kreis Siskiyou. Aufrufe des Beitrags: 294 Öffentlicher Brief zur Offenlegung/Veröffentlichung – 1. März 2026 Liebe Mitglieder des Aufsichtsrats, Sheriff LaRue und betroffene Beamte: Ich schreibe als Anwohner und Verfechter der Waldbrandprävention im Siskiyou County, Kalifornien, um Aufmerksamkeit zu erregen …","Urgent Call to Shift Wildfire Management Practices to Protect Public Health and Safety in Siskiyou County. Post Views: 294 Public Letter for disclosure/publishing – March 1, 2026 Dear Members of the Board of Supervisors, Sheriff LaRue, and Concerned Officials: I am writing as a resident and advocate for wildfire prevention in Siskiyou County CA to bring attention …","Urgente voca ad Shift INCAENDIUM Management Exercitia ad tuendam publicam salutem et incolumitatem in Siskiyou Comitatus. Post Sententias: 294 Litterae publicae aperiendae/enuntiandae - 1 Martii 2026 Dilecti Socii Tabulae Supervisores, Vicecomitis LaRue, ac Officiales versantes: incola et advocatus incendium introductum in Siskiyou comitatu CA scribo ne operam ...",2026-03-04 04:51:41+00:00
71d437e949a4e079ede4b14122af5993,2026-03-03T19:29:53Z,'bushfire',www.abc.net.au,en,0.9,"Aged care bushfire evacuation plans are unrealistic, union warns","The vast majority of aged care facilities would be unable to evacuate in the case of a bushfire, according to the Australian Workers Union.",https://www.abc.net.au/news/2026-03-04/fire-evacuation-aged-care-nursing-homes-united-workers-union/106346780,https://live-production.wcms.abc-cdn.net.au/77df892438a8d6e95a7dccdc24d13b58?impolicy=wcms_watermark_news&cropH=1080&cropW=1920&xPos=0&yPos=0&width=862&height=485&imformat=generic,,"Australian aged care homes are inadequately prepared to evacuate in a bushfire, according to a union representing aged care workers.
In January, more than 30 residents and staff at Natimuk Aged Care… [+6198 chars]",,"Pläne zur Evakuierung von Buschbränden in der Altenpflege sind unrealistisch, warnt die Gewerkschaft. Nach Angaben der Australian Workers Union wäre die überwiegende Mehrheit der Altenpflegeeinrichtungen im Falle eines Buschfeuers nicht in der Lage, ihre Häuser zu evakuieren.","Aged care bushfire evacuation plans are unrealistic, union warns. The vast majority of aged care facilities would be unable to evacuate in the case of a bushfire, according to the Australian Workers Union.","Anus cura decedere bushfire consilia unio unio unrealistica esse monet. Magna pars aetatis curarum facilitatum in casu fruticis decedere non posset, secundum Unionem operarios Australiae.",2026-03-05 09:01:19+00:00
e3a3d16125fe1f76d821f03cef1b6832,2026-03-03T04:57:02Z,'wildfire',cleantechnica.com,en,0.9,New Berkshire Hathaway CEO Ignores Financial Risks of Fossil Fuels in First Letter to Shareholders,"OMAHA, Nebraska — In his first letter to shareholders as Berkshire Hathaway CEO, Greg Abel acknowledged that rising electricity demand and more frequent wildfires will impact the delivery of affordable and reliable energy to customers. He also noted that “the…",https://cleantechnica.com/2026/03/02/new-berkshire-hathaway-ceo-ignores-financial-risks-of-fossil-fuels-in-first-letter-to-shareholders/,https://cleantechnica.com/wp-content/uploads/2023/04/Fossil-Fuels-Coal-CleanTechnica-Watermark.png,,"Support CleanTechnica's work through a Substack subscription or on Stripe.
OMAHA, Nebraska  In his first letter to shareholders as Berkshire Hathaway CEO, Greg Abel acknowledged that rising electric… [+2402 chars]",,"Der CEO von New Berkshire Hathaway ignoriert im ersten Brief an die Aktionäre die finanziellen Risiken fossiler Brennstoffe. OMAHA, Nebraska – In seinem ersten Brief an die Aktionäre als CEO von Berkshire Hathaway räumte Greg Abel ein, dass der steigende Strombedarf und häufigere Waldbrände die Versorgung der Kunden mit erschwinglicher und zuverlässiger Energie beeinträchtigen werden. Er bemerkte auch, dass „die…“","New Berkshire Hathaway CEO Ignores Financial Risks of Fossil Fuels in First Letter to Shareholders. OMAHA, Nebraska — In his first letter to shareholders as Berkshire Hathaway CEO, Greg Abel acknowledged that rising electricity demand and more frequent wildfires will impact the delivery of affordable and reliable energy to customers. He also noted that “the…","Novi Berk Hathaway CEO Neglecta Financial Pericula Fossilia Fuels in Prima Epistula ad Socios. OMAHA, Nebraska – In prima epistula ad socios Berk Hathaway CEO, Greg Abel agnovit electricitatem ortu exigere ac frequentiores incendia incussurum esse traditio parabilis ac certa industria clientibus. Etiam notandum est quod “…",2026-03-06 04:52:39+00:00
