index,published,keyword,domain,language,valid,title,description,url,image,archive,content,quote,de,en,la,added
6b1c46ef99ae84d855367f83d537fb43,2026-03-05T23:18:00Z,'wildfire house',news.sky.com,en,0.3,'You brought hell on yourselves': Panic and fear as Israeli rhetoric raises spectre of all-out war,Hundreds of thousands of people have left their homes in the Lebanese capital after Israel's military issued an evacuation order on several districts - - and the words of a cabinet minister and military chief are amplifying people's fear.,https://news.sky.com/story/panic-on-the-streets-of-beirut-as-israeli-rhetoric-sparks-fears-of-all-out-war-13515928,https://e3.365dm.com/26/03/1600x900/skynews-lebanon-beirut_7183471.jpg?20260305190118,,"The news spread like wildfire and within minutes, the streets of Beirut were gripped with panic.
We saw residents stuffing themselves into cars - or trying to leave on foot with whatever they could … [+2836 chars]",,"„Ihr habt die Hölle über euch gebracht“: Panik und Angst, während israelische Rhetorik das Gespenst eines umfassenden Krieges heraufbeschwört. Hunderttausende Menschen haben ihre Häuser in der libanesischen Hauptstadt verlassen, nachdem das israelische Militär einen Evakuierungsbefehl für mehrere Bezirke erlassen hatte – und die Worte eines Kabinettsministers und eines Militärchefs verstärken die Angst der Menschen.",'You brought hell on yourselves': Panic and fear as Israeli rhetoric raises spectre of all-out war. Hundreds of thousands of people have left their homes in the Lebanese capital after Israel's military issued an evacuation order on several districts - - and the words of a cabinet minister and military chief are amplifying people's fear.,"'Terrores vos inferni': 'Terror et metus, sicut rhetorica Israelis spectrum omnium belli erigit'. Centum milia hominum domos suas in urbe Lebanese reliquerunt postquam militum Israelis ordo in plures regiones evacuationem edidit - - et verba cubiculi ministri et principes militum timorem populi augent.",2026-03-14 08:53:33+00:00
b75b2f5cd40e0eda43b275ad8eb87f66,2026-03-12T17:33:40Z,'wildfire',theconversation.com,en,0.9,How governments can help Indigenous communities disproportionately impacted by wildfires,"Wildfires disproportionately impact Indigenous communities. Over the last four decades, 42 per cent of wildfire evacuations across Canada have been of Indigenous communities.",https://theconversation.com/how-governments-can-help-indigenous-communities-disproportionately-impacted-by-wildfires-275198,https://images.theconversation.com/files/719139/original/file-20260218-64-3x7wld.jpg?ixlib=rb-4.1.0&rect=0%2C312%2C3746%2C1873&q=45&auto=format&w=1356&h=668&fit=crop,http://web.archive.org/web/20260313131441/https://theconversation.com/how-governments-can-help-indigenous-communities-disproportionately-impacted-by-wildfires-275198,"Nearly every summer over the past decade, the story has been the same across many parts of Canada: wildfires rage out of control and skies are filled with smoke. Communities are often forced to evacu… [+7539 chars]",,"Wie Regierungen indigenen Gemeinschaften helfen können, die überproportional von Waldbränden betroffen sind. Waldbrände wirken sich unverhältnismäßig stark auf indigene Gemeinschaften aus. In den letzten vier Jahrzehnten entfielen 42 Prozent der Waldbrandevakuierungen in ganz Kanada auf indigene Gemeinschaften.","How governments can help Indigenous communities disproportionately impacted by wildfires. Wildfires disproportionately impact Indigenous communities. Over the last four decades, 42 per cent of wildfire evacuations across Canada have been of Indigenous communities.","Imperia quomodo possunt adiuvari communitates Indigenae ab incendiis feris proportionaliter impactis. Ignes incendia improportionabiliter irruunt in communitates Indigenae. Plus quattuor decenniis, 42 centesimae evacuationum ignis effervorum trans Canadam communitates Indigenae fuerunt.",2026-03-14 08:53:33+00:00
e3c896e28306bb5e744bb9a1026d0993,2026-03-12T22:06:37Z,'wildfire',www.cbc.ca,en,0.9,Canmore residents working to reduce wildfire risk across neighbourhoods,"After watching the 2024 Jasper wildfire, a Canmore resident helped launch a neighbourhood effort to reduce wildfire risk. The program is growing, but experts say the town remains vulnerable unless more homes take part.",https://www.cbc.ca/news/canada/calgary/canmore-firesmart-neighbourhoods-9.7126475,"https://i.cbc.ca/ais/40db1c69-4d74-4a48-9d20-9a99a15a36cf,1773348989460/full/max/0/default.jpg?im=Crop%2Crect%3D%280%2C45%2C640%2C360%29%3BResize%3D620",,"Simon Bagshaw first moved to Canmore in 2014 and remembers sitting on his porch, admiring the pine trees surrounding his home.
Now, he sees something different.
Every time I look at the forest now,… [+4339 chars]",,"Einwohner von Canmore arbeiten daran, das Risiko von Waldbränden in allen Stadtteilen zu verringern. Nachdem er den Waldbrand in Jasper im Jahr 2024 beobachtet hatte, half ein Bewohner von Canmore dabei, eine Nachbarschaftsinitiative zur Reduzierung der Waldbrandgefahr zu starten. Das Programm wächst, aber Experten sagen, dass die Stadt weiterhin gefährdet bleibt, wenn nicht mehr Häuser teilnehmen.","Canmore residents working to reduce wildfire risk across neighbourhoods. After watching the 2024 Jasper wildfire, a Canmore resident helped launch a neighbourhood effort to reduce wildfire risk. The program is growing, but experts say the town remains vulnerable unless more homes take part.","Canmore habitant laborantes ut ignem ferum per vicinos periculum reducerent. Post 2024 ignem ignem ferum spectans, Canmore incola adiuvit conatus vicinitatem deducere ad periculum incendium redigendum. Propositum crescit, sed periti dicunt oppidum vulnerabiles manere nisi plures domos intersint.",2026-03-14 08:53:33+00:00
679b5d5aad776f7e14f9556b9ec7df36,2026-03-11T15:37:00Z,'wildfire',www.thestar.com.my,en,0.9,Firefighters struggle to combat spreading Puncak Jalil hillside wildfire,"KUALA LUMPUR: A hillside fire in Puncak Jalil, Seri Kembangan has spread to a larger area since it was first detected earlier on Wednesday (March 11) evening. Read full story",https://www.thestar.com.my/news/nation/2026/03/11/firefighters-struggle-to-combat-spreading-puncak-jalil-hillside-wildfire,https://apicms.thestar.com.my/uploads/images/2026/03/11/3808635.jpeg,,"KUALA LUMPUR: A hillside fire in Puncak Jalil, Seri Kembangan has spread to a larger area since it was first detected earlier on Wednesday (March 11) evening.
Selangor Fire and Rescue Department ass… [+1450 chars]",,"Feuerwehrleute kämpfen gegen den sich ausbreitenden Waldbrand am Hang von Puncak Jalil. KUALA LUMPUR: Ein Hangfeuer in Puncak Jalil, Seri Kembangan, hat sich seit seiner ersten Entdeckung am Mittwochabend (11. März) auf ein größeres Gebiet ausgeweitet. Lesen Sie die ganze Geschichte","Firefighters struggle to combat spreading Puncak Jalil hillside wildfire. KUALA LUMPUR: A hillside fire in Puncak Jalil, Seri Kembangan has spread to a larger area since it was first detected earlier on Wednesday (March 11) evening. Read full story","Firefighters pugnare ad pugnam extendere Puncak Jalil clivum ignem ferum. KUALA LUMPUR: Ignis collis in Puncak Jalil, Seri Kembangan latiorem aream diffudit cum primum deprehensus est die Mercurii (XI Martii) vesperi. Read full story",2026-03-14 14:48:01+00:00
029d56284f8c5ff7e7ae04982e56316b,2026-03-11T23:25:52Z,'wildfire',www.foxweather.com,en,0.9,"‘Smokejumpers’ leap into wildfires from 3,000 feet to fight blazes","A smokejumper is a unique type of wildland firefighter that's trained to reach remote fires by parachuting from about 3,000 feet to attack a designated area, typically without road or trail access.",https://www.foxweather.com/earth-space/wildland-firefighters-leap-from-3000-feet-combat-spread-wildfires,https://nypost.com/wp-content/uploads/sites/2/2026/03/123332174.jpg?quality=75&strip=all&w=1200,,"Firefighters have plenty of ways to battle the spread of flames, but some first responders have a different approach to wildfire response.
A smokejumper is a unique type of wildland firefighter that… [+1815 chars]",,"„Smokejumper“ springen aus einer Höhe von 900 Metern in Waldbrände, um Brände zu bekämpfen. Ein Smokejumper ist eine einzigartige Art von Feuerwehrmann in der Wildnis, der darauf trainiert ist, entfernte Brände zu erreichen, indem er aus einer Höhe von etwa 900 Metern mit dem Fallschirm abspringt, um ein bestimmtes Gebiet anzugreifen, das normalerweise keinen Zugang zu Straßen oder Wegen hat.","‘Smokejumpers’ leap into wildfires from 3,000 feet to fight blazes. A smokejumper is a unique type of wildland firefighter that's trained to reach remote fires by parachuting from about 3,000 feet to attack a designated area, typically without road or trail access.","'Smokejumpers' in ignes feris ex 3,000 pedibus desiliit ad pugnandum flammas. Smokejumper singulare genus est fire pugnatoris truculenti qui ad remotos ignes pervenire docta parachus ab circiter 3,000 pedibus ad designatam regionem oppugnandam, nulla fere via vel accessu trahentium.",2026-03-14 14:48:01+00:00
98304c7efecf72136d530a18507fffb2,2026-03-06T20:09:55Z,'wildfire death',9to5toys.com,en,0.2,Friday Apple Books and audiobook deals from $2,"Today’s lineup of the best Apple Books deals is now ready to roll, including titles like Where Death Meets the Devil (Unabridged), The Central Park, Drift: Rachel Hatch, Book 1 (Unabridged), The Tropic of Serpents, Blowing the Bloody Doors Off, Leave It to Ps…",http://9to5toys.com/2026/03/06/friday-apple-books-and-audiobook-deals-from-2-2/,https://i0.wp.com/9to5toys.com/wp-content/uploads/sites/5/2026/03/Apple-Books-Mar-6.webp?resize=1200%2C628&quality=82&strip=all&ssl=1,,"Today’s lineup of the best Apple Books deals is now ready to roll, including titles like Where Death Meets the Devil (Unabridged), The Central Park, Drift: Rachel Hatch, Book 1 (Unabridged), The Trop… [+1214 chars]",,"Freitags Apple Books- und Hörbuchangebote ab 2 $. Das heutige Angebot der besten Angebote für Apple Books ist jetzt verfügbar, darunter Titel wie „Where Death Meets the Devil“ (ungekürzt), „The Central Park“, „Drift: Rachel Hatch“, „Buch 1“ (ungekürzt), „The Tropic of Serpents“, „Blowing the Bloody Doors Off“, „Leave It to Ps …“","Friday Apple Books and audiobook deals from $2. Today’s lineup of the best Apple Books deals is now ready to roll, including titles like Where Death Meets the Devil (Unabridged), The Central Park, Drift: Rachel Hatch, Book 1 (Unabridged), The Tropic of Serpents, Blowing the Bloody Doors Off, Leave It to Ps…","Lacus Veneris Libri et audiobook ab $2. Hodierna linea optimarum Apple Libri agit nunc paratus est evolvere, inter titulos similes Ubi Mors Meets Diabolus (Unabridged), Central Park, Drift: Rachel Hatch, Liber 1 (Unabridged), Tropicum Serpentium, Blowing Doors Sanguis Off, Dimitte Ps…",2026-03-19 05:04:03+00:00
c165e540d0fd4120e5a28ca8fb6578ab,2026-03-02T21:57:45Z,'wildfire death',comicbook.com,en,0.3,How Every Major A Knight of the Seven Kingdoms Character Dies in The Books,"Image via HBO

This article contains spoilers for A Knight of the Seven Kingdoms as well as The Tales of Dunk and Egg and Game of Thrones. The stories told within the Game of Thrones universe are filled with dramatic twists, betrayals, shocking deaths, and tr…",http://comicbook.com/tv-shows/list/how-every-major-a-knight-of-the-seven-kingdoms-character-dies-in-the-books/,"https://comicbook.com/wp-content/uploads/sites/4/2026/02/Dunk-Lyonel-Baratheon-and-Aerion-Targaryen-in-A-Knight-of-the-Seven-Kingdoms.jpg?resize=2000,1125",,This article contains spoilers for A Knight of the Seven Kingdoms as well as The Tales of Dunk and Egg and Game of Thrones. The stories told within the Game of Thrones universe are filled with dramat… [+7502 chars],,"Wie jeder bedeutende Charakter eines Ritters der Sieben Königreiche in den Büchern stirbt. Bild über HBO

Dieser Artikel enthält Spoiler für „A Knight of the Seven Kingdoms“ sowie „The Tales of Dunk and Egg“ und „Game of Thrones“. Die im Game of Thrones-Universum erzählten Geschichten sind voller dramatischer Wendungen, Verrat, schockierender Todesfälle und Schicksalsschlägen.","How Every Major A Knight of the Seven Kingdoms Character Dies in The Books. Image via HBO

This article contains spoilers for A Knight of the Seven Kingdoms as well as The Tales of Dunk and Egg and Game of Thrones. The stories told within the Game of Thrones universe are filled with dramatic twists, betrayals, shocking deaths, and tr…","Qualiter Omnis Major Eques Septem Regnorum Moribus Dies in Libris. Imago per HBO

Articulus iste praedones equiti septem regnorum continet necnon Narrationes Dunk et Egg et Ludus thronorum. Narrationes intra Ludum Thronorum universum narrantur scenicis nexibus, proditione, horrendis mortibus ac tr... repleti.",2026-03-19 05:04:03+00:00
57f115a0b62de42d7fa4960a7b32cd99,2026-03-03T20:34:23Z,'wildfire death',www.usmagazine.com,en,0.3,Jamie-Lynn Sigler Mourns ‘Magical’ James Van Der Beek After His Death,"Jamie-Lynn Sigler saw what she believed was a sign from James Van Der Beek following his death last month. “I am mourning along with the rest of the world. My dear friend James Van Der Beek passed away after a brave, beautiful, tireless fight against [colorec…",https://www.usmagazine.com/celebrity-news/news/jamie-lynn-sigler-mourns-magical-james-van-der-beek/,https://www.usmagazine.com/wp-content/uploads/2026/03/jamie-lynn-sigler-james-van-der-beek.jpg?crop=0px%2C0px%2C2000px%2C1051px&resize=1200%2C630&quality=86&strip=all,http://web.archive.org/web/20260304003943/https://www.usmagazine.com/celebrity-news/news/jamie-lynn-sigler-mourns-magical-james-van-der-beek/,"Jamie-Lynn Sigler saw what she believed was a sign from James Van Der Beek following his death last month.
“I am mourning along with the rest of the world. My dear friend James Van Der Beek passed a… [+3071 chars]",,"Jamie-Lynn Sigler trauert um den „magischen“ James Van Der Beek nach seinem Tod. Jamie-Lynn Sigler sah, was sie für ein Zeichen von James Van Der Beek nach seinem Tod im letzten Monat hielt. „Ich trauere zusammen mit dem Rest der Welt. Mein lieber Freund James Van Der Beek ist nach einem mutigen, schönen und unermüdlichen Kampf gegen [colorec…] gestorben.","Jamie-Lynn Sigler Mourns ‘Magical’ James Van Der Beek After His Death. Jamie-Lynn Sigler saw what she believed was a sign from James Van Der Beek following his death last month. “I am mourning along with the rest of the world. My dear friend James Van Der Beek passed away after a brave, beautiful, tireless fight against [colorec…","Jamie-Lynn Sigler Mourns 'Magical' James Van Der Beek Post eius mortem. Jamie-Lynn Sigler vidit id quod credidit signum fuisse Jacobo Van Der Beek sequentis ejus obitus ultimo mense. Luctus sum cum reliquo mundo, mi amice Iacobus Van Der Beek transivit post fortem, pulchram, indefessa pugna [colorec…",2026-03-19 05:04:03+00:00
0b06061dfbb51d892d7c8330552d2b6d,2026-03-18T03:24:02Z,'wildfire heat',www.nbcnews.com,en,0.9,"At least 1 dead as Nebraska wildfires scorch nearly 800,000 acres","As historic wildfires in Nebraska continued to roar amid a Western heat wave, Gov.",https://www.nbcnews.com/weather/wildfires/least-dead-nebraska-wildfires-scorch-nearly-acres-rcna264000,"https://media-cldnry.s-nbcnews.com/image/upload/t_nbcnews-fp-1200-630,f_auto,q_auto:best/rockcms/2026-03/260317-nebraska-wildfires-vsb-2320-92cdc4.jpg",,"As historic wildfires in Nebraska continued to roar amid a Western heat wave, Gov. Jim Pillen and incident commanders expressed hope Tuesday that they may soon turn a corner.
The state's four major … [+3708 chars]",,"Mindestens ein Toter, als Waldbrände in Nebraska fast 800.000 Hektar verbrennen. Während die historischen Waldbrände in Nebraska inmitten einer Hitzewelle im Westen weiter tobten, sagte Gouverneur","At least 1 dead as Nebraska wildfires scorch nearly 800,000 acres. As historic wildfires in Nebraska continued to roar amid a Western heat wave, Gov.","Saltem I mortuus ut Nebraska incendia incendia fere 800.000 iugera exurunt. Sicut incendia historica in Nebraska strepitant inter undam Occidentalem, Gov.",2026-03-19 05:04:03+00:00
50df76d90872149233cffd38252b683f,2026-03-13T19:12:23Z,'wildfire',www.insurancejournal.com,en,0.9,‘Nation’s First’ Smoke Damage Standards Bill Wending Through California Legislature,"A bill to create a statewide framework for handling wildfire smoke damage insurance claims is now making its way through California Legislature. The Smoke Damage Recovery Act, which primary backer Insurance Commissioner Ricardo Lara said stems from the recove…",https://www.insurancejournal.com/news/west/2026/03/13/861910.htm,https://www.insurancejournal.com/app/uploads/2025/01/2024-Pacific-Palisades-Fire-by-CalFire-scaled.jpg,,"A bill to create a statewide framework for handling wildfire smoke damage insurance claims is now making its way through California Legislature.
The Smoke Damage Recovery Act, which primary backer I… [+3421 chars]",,"„Nation’s First“-Gesetzentwurf zu Rauchschadensnormen geht durch kalifornisches Parlament. Ein Gesetzentwurf zur Schaffung eines landesweiten Rahmens für die Bearbeitung von Schadensersatzansprüchen gegen Waldbrandrauchschäden wird derzeit durch die kalifornische Gesetzgebung verabschiedet. Das Smoke Damage Recovery Act, das laut Versicherungskommissar Ricardo Lara, Hauptbefürworter, aus der Sanierung stammt …","‘Nation’s First’ Smoke Damage Standards Bill Wending Through California Legislature. A bill to create a statewide framework for handling wildfire smoke damage insurance claims is now making its way through California Legislature. The Smoke Damage Recovery Act, which primary backer Insurance Commissioner Ricardo Lara said stems from the recove…","'Prima Natio' Fumus Signa Bill Wending Per California Legislaturae. Libellum ad creandum compagem statewide ad fumum ferum tractandum damna assecurationis affirmat nunc per California Legislaturae iter faciens. Damnum Fumus Recuperatio Actus, quem Primus Commissarius Insurance Praesentis auctor Ricardo Lara dixit proficisci a receptaculo…",2026-03-19 09:02:46+00:00
62498e2d0cb052d984acc678bb3f5f28,2026-03-18T15:00:00Z,'wildfire weather',www.scientificamerican.com,en,0.9,Nebraska is battling its largest wildfires in history. Worse may be yet to come,"About 800,000 acres have burned because of these fires, with at least one person reported dead",https://www.scientificamerican.com/article/nebraska-is-battling-its-largest-wildfires-in-history-worse-may-be-yet-to/,https://static.scientificamerican.com/dam/m/2c684c0f11952e95/original/wildfire-aerial.jpeg?m=1773848619.277&w=1200,,"Swaths of Nebraska are engulfed in fire, with some 800,000 acres burned and at least one person killed. The wildfires, which are the “largest wildfires in our history,” according to a post on X by st… [+2053 chars]",,"Nebraska kämpft mit seinen größten Waldbränden in der Geschichte. Es könnte noch schlimmer kommen. Durch diese Brände brannten etwa 800.000 Hektar Land, wobei mindestens eine Person ums Leben kam","Nebraska is battling its largest wildfires in history. Worse may be yet to come. About 800,000 acres have burned because of these fires, with at least one person reported dead","Nebraska maximas incendia in historia certat. Asperiores sint sed veniam. Ab his ignibus circiter 800.000 iugera incensa sunt, una saltem mortua nuntiata",2026-03-19 15:06:57+00:00
7e98e155fdfe1f96b0d2341404f377e6,2026-03-05T21:13:15Z,'wildfire',pypi.org,en,0.9,agentevac 0.1.0,Agent-based wildfire evacuation simulator using SUMO and LLM-driven agents,https://pypi.org/project/agentevac/0.1.0/,,,"A required part of this site couldnt load. This may be due to a browser
 extension, network issues, or browser settings. Please check your
 connection, disable any ad blockers, or try using a diffe… [+12 chars]",,agentevac 0.1.0. Agentenbasierter Waldbrand-Evakuierungssimulator mit SUMO- und LLM-gesteuerten Agenten,agentevac 0.1.0. Agent-based wildfire evacuation simulator using SUMO and LLM-driven agents,agentevac 0.1.0. Agente-substructio ignem ferum evacuatione simulator utens SUMO et LLM-agentibus agitatae,2026-03-20 04:58:14+00:00
160fefebe3524cc75a8bcddc1da99274,2026-03-06T18:51:51Z,'wildfire',pypi.org,en,0.9,agentevac 0.2.1,Agent-based wildfire evacuation simulator using SUMO and LLM-driven agents,https://pypi.org/project/agentevac/0.2.1/,,,"A required part of this site couldnt load. This may be due to a browser
 extension, network issues, or browser settings. Please check your
 connection, disable any ad blockers, or try using a diffe… [+12 chars]",,agentevac 0.2.1. Agentenbasierter Waldbrand-Evakuierungssimulator mit SUMO- und LLM-gesteuerten Agenten,agentevac 0.2.1. Agent-based wildfire evacuation simulator using SUMO and LLM-driven agents,agentevac 0.2.1. Agente-substructio ignem ferum evacuatione simulator utens SUMO et LLM-agentibus agitatae,2026-03-20 04:58:14+00:00
fe76161709be0e76ae616b1ad08c47fd,2026-03-16T20:15:00Z,'wildfire',www.nextgov.com,en,0.9,"When disaster strikes, census data can help show who is in harm’s way","The agency’s updated OnTheMap for Emergency Management tool shows how population and workforce data can support rapid response and recovery operations during hurricanes, floods, wildfires and other natural disasters.",https://www.nextgov.com/digital-government/2026/03/when-disaster-strikes-census-data-can-help-show-who-harms-way/412147/,https://cdn.nextgov.com/media/img/cd/2026/03/16/GettyImages_2192316305/open-graph.jpg,,"When hurricanes approach the coast or wildfires tear through dry terrain, the first maps that most people see are the ones that track the danger itself. They show a storms path, the current fire peri… [+5967 chars]",,"Wenn eine Katastrophe eintritt, können Volkszählungsdaten dabei helfen, zu zeigen, wer in Gefahr ist. Das aktualisierte Tool „OnTheMap for Emergency Management“ der Agentur zeigt, wie Bevölkerungs- und Arbeitskräftedaten schnelle Reaktions- und Wiederherstellungsmaßnahmen bei Hurrikanen, Überschwemmungen, Waldbränden und anderen Naturkatastrophen unterstützen können.","When disaster strikes, census data can help show who is in harm’s way. The agency’s updated OnTheMap for Emergency Management tool shows how population and workforce data can support rapid response and recovery operations during hurricanes, floods, wildfires and other natural disasters.","Cum clade percusserit, census notitia iuvare potest ostendere qui in via laesa est. Renovata procuratio OnTheMap for Emergency Management instrumentum ostendit quomodo hominum notitia et vis laboris celerem responsionem et recuperationem operationum in tempestatibus, inundationibus, in incendiis et in aliis naturalibus calamitatibus sustinere possint.",2026-03-20 04:58:14+00:00
184dc3c5c32e397bd4ebeae9db57ab94,2026-03-16T13:59:02Z,'wildfire buildings',www.mercurynews.com,en,0.3,Even low-risk homes are caught up in California’s climate insurance crisis,The state’s insurer of last resort is meant for high fire risk properties but homeowners in areas unlikely to burn are now being forced into the plan.,https://www.mercurynews.com/2026/03/16/even-low-risk-homes-are-caught-up-in-californias-climate-insurance-crisis/,https://www.mercurynews.com/wp-content/uploads/2026/03/California_Wildfires_75668_5549f0-1.jpg?w=1024&h=682,,"By Todd Woody, Bloomberg
As another wildfire season looms, insurance companies have abandoned some California neighborhoods at lower risk of burning, forcing tens of thousands of homeowners to obtai… [+6227 chars]",,"Sogar Häuser mit geringem Risiko sind von der Klimaversicherungskrise in Kalifornien betroffen. Die staatliche Versicherung der letzten Instanz ist für Immobilien mit hohem Brandrisiko gedacht, aber Hausbesitzer in Gegenden, in denen es unwahrscheinlich ist, dass es brennt, werden jetzt in den Plan gezwungen.",Even low-risk homes are caught up in California’s climate insurance crisis. The state’s insurer of last resort is meant for high fire risk properties but homeowners in areas unlikely to burn are now being forced into the plan.,"Etiam domos periculosas capiuntur in discrimine climatis assecurationis Californiae. Insurator status ultimae rei destinatur pro magnis incendiis periculorum proprietatibus, sed homeowners in locis probabile incendere nunc in consilium coguntur.",2026-03-20 09:00:36+00:00
