index,url,valid,domain,title,description,image,published,archive,content,quote,language,keyword
https://www.abc.net.au/news/2025-03-01/wa-weather-forecast-for-autumn-predicts-warm-temperatures/104996558,https://www.abc.net.au/news/2025-03-01/wa-weather-forecast-for-autumn-predicts-warm-temperatures/104996558,0,www.abc.net.au,"After an extreme January and mild February, this is the autumn forecast for WA","The latest long-range forecast from the Bureau of Meteorology predicts a wetter than usual autumn in the north, a heightened bushfire risk in some coastal areas and warmer than average temperatures.",https://live-production.wcms.abc-cdn.net.au/dc4e159cfad84d1a7e19d0d48a325b95?impolicy=wcms_watermark_news&cropH=3494&cropW=6211&xPos=0&yPos=324&width=862&height=485&imformat=generic,2025-03-01T00:45:49Z,https://web.archive.org/web/20250302065411/https://www.abc.net.au/news/2025-03-01/wa-weather-forecast-for-autumn-predicts-warm-temperatures/104996558,"After a scorching summer and record-breaking temperatures in 2024, Western Australia is set for another warmer than usual autumn.
The latest long-range forecast from the Bureau of Meteorology predic… [+2525 chars]",,en,'bushfire'
https://www.japantimes.co.jp/news/2025/03/01/japan/iwate-wildfire-battle/,https://www.japantimes.co.jp/news/2025/03/01/japan/iwate-wildfire-battle/,0,www.japantimes.co.jp,Japan battles biggest wildfire in decades,"Flames are estimated to have spread over about 1,200 hectares in the forest of Ofunato in the northern region of Iwate since fire broke out on Wednesday.",https://www.japantimes.co.jp/japantimes/uploads/images/2025/03/01/454851.jpg?v=3.1,2025-03-01T03:06:00Z,http://archive.md/20250301150758/https://www.japantimes.co.jp/news/2025/03/01/japan/iwate-wildfire-battle/,"Japan was battling its largest wildfire in more than three decades on Saturday, one of several blazes that have killed one person and forced the evacuation of more than a thousand.
Flames are estima… [+1487 chars]",,en,'forest fire'
https://www.channelnewsasia.com/east-asia/japan-biggest-wildfire-ofunato-iwate-4969296,https://www.channelnewsasia.com/east-asia/japan-biggest-wildfire-ofunato-iwate-4969296,0,www.channelnewsasia.com,Japan battles biggest wildfire in decades,"One person has been killed, and over 1,000 residents in Ofunato, Iwate Prefecture have been evacuated, as of Friday (Feb 28).","https://dam.mediacorp.sg/image/upload/s--hW5Xx9Wd--/f_auto,q_auto/c_fill,g_auto,h_676,w_1200/v1/mediacorp/cna/image/2025/03/01/000_36yv3tb.jpg?itok=n0O69eJR",2025-03-01T04:25:00Z,,"TOKYO: Japan was battling its largest wildfire in more than three decades on Saturday (Mar 1), one of several blazes that have killed one person and forced the evacuation of more than a thousand.
Fl… [+1474 chars]",,en,'wildfire residents'
https://www.lewrockwell.com/2025/03/no_author/what-wildfire-illness-can-teach-us-about-treating-copd/,https://www.lewrockwell.com/2025/03/no_author/what-wildfire-illness-can-teach-us-about-treating-copd/,0,www.lewrockwell.com,What Wildfire Illness Can Teach Us About Treating COPD,"California just experienced a devastating set of wildfires that is on its way to becoming the costliest disaster in US history. As such, a significant national focus has been directed to the series of reprehensible errors and policies that gave rise to the di…",https://www.lewrockwell.com/wp-content/uploads/2025/02/1-5-620x378.webp,2025-03-01T05:01:00Z,,"California just experienced a devastating set of wildfires that is on its way to becoming the costliest disaster in US history. As such, a significant national focus has been directed to the series o… [+9758 chars]",,en,'wildfire disaster'
https://japantoday.com/category/national/more-people-ordered-to-evacuate-as-northeast-japan-wildfire-spreads,https://japantoday.com/category/national/more-people-ordered-to-evacuate-as-northeast-japan-wildfire-spreads,0,japantoday.com,More people ordered to evacuate as northeast Japan wildfire spreads,"Over a hundred more households in northeastern Japan were told to evacuate on Saturday as a wildfire that has been burning for four days continued to spread. The Iwate Prefecture government issued a new order for 333 people from 141 homes to evacuate, adding …",,2025-03-01T07:25:26Z,,"Over a hundred more households in northeastern Japan were told to evacuate on Saturday as a wildfire that has been burning for four days continued to spread.
The Iwate Prefecture government issued a… [+571 chars]",,en,'wildfire house'
https://www.dw.com/en/japan-fights-worst-wildfire-in-decades/a-71791934,https://www.dw.com/en/japan-fights-worst-wildfire-in-decades/a-71791934,0,www.dw.com,Japan fights worst wildfire in decades,The largest wildfire in Japan in more than 30 years is continuing to rage in the north of the country. At least one person is reported to have died in the blaze. A wildfire in the northern Japanese prefecture of Iwate has forced the evacuation of more than a …,https://static.dw.com/image/71782467_6.jpg,2025-03-01T10:10:00Z,http://archive.md/20250301144408/https://www.dw.com/en/japan-fights-worst-wildfire-in-decades/a-71791934,"A wildfire in the northern Japanese prefecture of Iwate has forced the evacuation of more than a thousand people and killed at least one, with some 2,500 firefighters from around the country battling… [+1530 chars]",,en,'wildfire'
https://www.bbc.com/news/articles/c17q59k52eno,https://www.bbc.com/news/articles/c17q59k52eno,0,www.bbc.com,Risk of wildfires 'very high' in parts of Scotland,The fire service said people should avoid lighting any fires outdoors between Saturday and Wednesday.,https://ichef.bbci.co.uk/news/1024/branded_news/97bc/live/2045adf0-f687-11ef-8c03-7dfdbeeb2526.jpg,2025-03-01T11:23:57Z,https://web.archive.org/web/20250301193340/https://www.bbc.com/news/articles/c17q59k52eno,"People in the north and east of Scotland have been urged not to light fires outdoors
A ""very high"" risk warning for wildfires has been issued for the north and east of Scotland over the coming days.… [+3266 chars]",,en,'wildfire'
http://deadline.com/2025/03/hollywood-workers-recovering-wildfires-1236260144/,http://deadline.com/2025/03/hollywood-workers-recovering-wildfires-1236260144/,0,deadline.com,"Hollywood Workers, Still Reeling From Five Years Of Economic Turmoil, Turn To Collective Action In Wake Of L.A. Wildfires","Seriina Covarrubias was baking herself a birthday cake in her Altadena home when the wildfire in Eaton Canyon broke out on the evening of January 7. Within an hour, she lost power and cell service as she and her husband raced to evacuate. “I knew we had to ge…",https://deadline.com/wp-content/uploads/2025/02/Hollywood.jpg?w=1024,2025-03-01T16:00:00Z,https://web.archive.org/web/20250301214208/https://deadline.com/2025/03/hollywood-workers-recovering-wildfires-1236260144/,"Seriina Covarrubias was baking herself a birthday cake in her Altadena home when the wildfire in Eaton Canyon broke out on the evening of January 7. Within an hour, she lost power and cell service as… [+10679 chars]",,en,'wildfire'
https://www.breitbart.com/entertainment/2025/03/01/200000-gift-bag-2025-oscar-nominees-includes-lipo-international-travel-wildfire-disaster-relief/,https://www.breitbart.com/entertainment/2025/03/01/200000-gift-bag-2025-oscar-nominees-includes-lipo-international-travel-wildfire-disaster-relief/,0,www.breitbart.com,"$200,000 Gift Bag for 2025 Oscar Nominees Includes Lipo, Luxury Travel, and Wildfire Disaster Relief","This year's swag bags for Oscar nominees are valued over $200,000, with dozens of gifts ranging from liposuction vouchers to international resort stays -- and in the wake of the historic Los Angeles wildfires, some of the freebies may help victims with repair…",https://media.breitbart.com/media/2025/03/AP25059861809610-640x335.jpg,2025-03-01T17:41:33Z,http://archive.md/20250301192427/https://www.breitbart.com/entertainment/2025/03/01/200000-gift-bag-2025-oscar-nominees-includes-lipo-international-travel-wildfire-disaster-relief/,"This year’s swag bags for Oscar nominees are valued over $200,000, with dozens of gifts ranging from liposuction vouchers to international resort stays — and in the wake of the historic Los Angeles w… [+3174 chars]",,en,'wildfire victims'
https://hiphopdx.com/news/madlib-wildfire-benefit-show-los-angeles-lineup,https://hiphopdx.com/news/madlib-wildfire-benefit-show-los-angeles-lineup,0,hiphopdx.com,"Madlib Taps The Alchemist, Mick Jenkins & More For Second Wildfire Benefit Show In L.A.",Madlib has recruited big names such as The Alchemist and Mick Jenkins for a second wildfire benefit concert in Los Angeles in April.,https://app.hiphopdx.com/wp-content/uploads/2025/02/madlib-taps-the-alchemist-mick-jenkins-for-second-wildfire-benefit-show-in-la.jpg?w=1200,2025-03-01T18:00:23Z,,"Los Angeles, CA - Madlib has assembled a heavyweight lineup of Hip Hop legends for his second Madlove benefit show aimed at helping those affected by the recent wildfires in Los Angeles and this one … [+2164 chars]",,en,'wildfire'
https://northern.starweekly.com.au/news/include-pets-in-your-bushfire-survival-plan/,https://northern.starweekly.com.au/news/include-pets-in-your-bushfire-survival-plan/,0,northern.starweekly.com.au,Include pets in your bushfire survival plan,"RSPCA Victoria and the CFA are urging residents to include pets in their bushfire survival plans, with significant fire activity...
The post Include pets in your bushfire survival plan appeared first on Northern.",https://northern.starweekly.com.au/wp-content/uploads/sites/5/2025/03/doggen_311124_01.jpg,2025-03-01T22:00:02Z,,"RSPCA Victoria and the CFA are urging residents to include pets in their bushfire survival plans, with significant fire activity already impacting the state this summer.
Making sure that you have be… [+2048 chars]",,en,'bushfire'
https://freerepublic.com/focus/f-news/4301416/posts,https://freerepublic.com/focus/f-news/4301416/posts,0,freerepublic.com,President Trump to sign executive order unleashing forest management after LA wildfires,"WASHINGTON ― President Donald Trump is expected to sign an executive order Saturday that looks to unleash forest management efforts following this year's devastating Los Angeles wildfires, according to a White House official. The order takes steps for quicker…",,2025-03-01T23:09:56Z,,"Skip to comments.
President Trump to sign executive order unleashing forest management after LA wildfiresMSN ^
 | March 1, 2025
 | Joey Garrison
Posted on 03/01/2025 3:09:56 PM PST by Twotone
WA… [+4227 chars]",,en,'wildfire'
https://www.abc.net.au/news/2025-03-02/australian-breastfeeding-association-launches-bushfire-project/104973040,https://www.abc.net.au/news/2025-03-02/australian-breastfeeding-association-launches-bushfire-project/104973040,0,www.abc.net.au,Mum rues leaving baby essentials behind in bushfire evacuation 'mad rush',Not sure what to pack for your baby during a disaster? The Australian Breastfeeding Association has prepared a guide.,https://live-production.wcms.abc-cdn.net.au/d3e63550516dddc6fd28d843e9cc7e17?impolicy=wcms_watermark_news&cropH=2583&cropW=4592&xPos=0&yPos=108&width=862&height=485&imformat=generic,2025-03-01T23:41:32Z,https://web.archive.org/web/20250305174656/https://www.abc.net.au/news/2025-03-02/australian-breastfeeding-association-launches-bushfire-project/104973040,"When it comes to knowing what to do in a natural disaster, many families might have an idea of where they will evacuate to and what they will pack.
But gathering supplies with a baby or toddler in t… [+5634 chars]",,en,'bushfire'
https://www.digitaljournal.com/world/thousands-flee-after-japans-biggest-wildfire-in-decades/article,https://www.digitaljournal.com/world/thousands-flee-after-japans-biggest-wildfire-in-decades/article,0,www.digitaljournal.com,Thousands flee after Japan’s biggest wildfire in decades,"Thousands of people evacuated from parts of northern Japan as the country’s largest wildfire in three decades raged unabated Sunday after killing at least one person, officials said. Around 2,000 people fled areas around the northern Japan city of Ofunato to …",https://www.digitaljournal.com/wp-content/uploads/2025/03/de5bb91869e2ae5e7a8fae80d9c83b86ab5aa4d0.jpg,2025-03-02T02:17:20Z,https://web.archive.org/web/20250302045648/https://www.digitaljournal.com/world/thousands-flee-after-japans-biggest-wildfire-in-decades/article,"A helicopter is pictured above the wildfire near Ofunato - Copyright JIJI Press/AFP/File STR
Thousands of people evacuated from parts of northern Japan as the country’s largest wildfire in three dec… [+1039 chars]",,en,'wildfire'
https://economictimes.indiatimes.com/news/international/global-trends/thousands-flee-after-japans-biggest-wildfire-in-decades/articleshow/118657578.cms,https://economictimes.indiatimes.com/news/international/global-trends/thousands-flee-after-japans-biggest-wildfire-in-decades/articleshow/118657578.cms,0,economictimes.indiatimes.com,Thousands flee after Japan's biggest wildfire in decades,"Thousands of people have been evacuated from areas around Ofunato in northern Japan due to the country's largest wildfire in three decades, which has killed at least one person. Over 80 buildings have been damaged, and around 1,700 firefighters are battling t…","https://img.etimg.com/thumb/msid-118657584,width-1200,height-630,imgsize-169350,overlay-economictimes/articleshow.jpg",2025-03-02T02:38:39Z,https://web.archive.org/web/20250302144455/https://economictimes.indiatimes.com/news/international/global-trends/thousands-flee-after-japans-biggest-wildfire-in-decades/articleshow/118657578.cms,"Artificial Intelligence(AI)
AI and Analytics based Business Strategy
By - Tanusree De, Managing Director- Accenture Technology Lead, Trustworthy AI Center of Excellence: ATCI
View Program",,en,'wildfire area'
https://www.channelnewsasia.com/east-asia/thousands-flee-after-japan-wildfire-around-ofunato-4970316,https://www.channelnewsasia.com/east-asia/thousands-flee-after-japan-wildfire-around-ofunato-4970316,0,www.channelnewsasia.com,Thousands flee after Japan's biggest wildfire in decades,"Around 2,000 people around the northern Japan city of Ofunato fled the fire which spread over 1,800ha, according to reports.","https://dam.mediacorp.sg/image/upload/s--FzjspY0Z--/f_auto,q_auto/c_fill,g_auto,h_676,w_1200/v1/mediacorp/cna/image/2025/03/02/000_36yr7aa.jpg?itok=fZazeTfO",2025-03-02T02:46:00Z,https://web.archive.org/web/20250302162627/https://www.channelnewsasia.com/east-asia/thousands-flee-after-japan-wildfire-around-ofunato-4970316,"TOKYO: Thousands of people have been evacuated from parts of northern Japan as the country's largest wildfire in three decades raged unabated on Sunday (Mar 2) after killing at least one person, offi… [+1006 chars]",,en,'wildfire'
https://www.ndtv.com/world-news/ofunato-wildfires-1-dead-thousands-evacuated-after-japans-biggest-wildfire-in-over-30-years-7827727,https://www.ndtv.com/world-news/ofunato-wildfires-1-dead-thousands-evacuated-after-japans-biggest-wildfire-in-over-30-years-7827727,0,www.ndtv.com,"1 Dead, Thousands Evacuated After Japan's Biggest Wildfire In Over 30 Years","Thousands of people evacuated from parts of northern Japan as the country&#039;s largest wildfire in three decades raged unabated Sunday after killing at least one person, officials said.",https://c.ndtvimg.com/2025-03/csiecl08_japan-wildifire_625x300_02_March_25.jpeg,2025-03-02T04:03:07Z,,"Tokyo: Thousands of people evacuated from parts of northern Japan as the country's largest wildfire in three decades raged unabated Sunday after killing at least one person, officials said. Around 2,… [+1182 chars]",,en,'wildfire smoke'
https://www.cbsnews.com/news/multiple-wildfires-carolinas-evacuations/,https://www.cbsnews.com/news/multiple-wildfires-carolinas-evacuations/,0,www.cbsnews.com,"Multiple wildfires erupt in the Carolinas, force evacuations",Brush fires that erupted amid dry and windy conditions caused officials in both North and South Carolina to order evacuations Saturday.,https://assets3.cbsnewsstatic.com/hub/i/r/2021/10/12/557764d7-3e6c-4fe9-8836-9fda6e6f5d00/thumbnail/1200x630/0055336953859ee7892609b4849aafdc/generic-fire.jpg?v=8de240724d7f6d8b5f54f62bb158c012,2025-03-02T04:45:12Z,,"Brush fires that erupted amid dry and windy conditions caused officials in both North and South Carolina to order evacuations Saturday. 
 A fire in North Carolina's Polk County was burning at least … [+1644 chars]",,en,'wildfire evacuation'
https://japantoday.com/category/national/thousands-flee-after-japan%27s-biggest-wildfire-in-decades,https://japantoday.com/category/national/thousands-flee-after-japan%27s-biggest-wildfire-in-decades,0,japantoday.com,Thousands flee as wildfire rages in Japan's northeast,"Thousands of people evacuated from parts of northern Japan as the country's largest wildfire in three decades raged unabated Sunday after killing at least one person, officials said. Around 2,000 people fled areas around the city of Ofunato in Iwate Prefectur…",,2025-03-02T07:32:31Z,,"Thousands of people evacuated from parts of northern Japan as the country's largest wildfire in three decades raged unabated Sunday after killing at least one person, officials said.
Around 2,000 pe… [+959 chars]",,en,'wildfire'
https://phys.org/news/2025-03-thousands-japan-biggest-wildfire-decades.html,https://phys.org/news/2025-03-thousands-japan-biggest-wildfire-decades.html,0,phys.org,Thousands flee after Japan's biggest wildfire in decades,"Thousands of people evacuated from parts of northern Japan as the country's largest wildfire in three decades raged unabated Sunday after killing at least one person, officials said.",https://scx2.b-cdn.net/gfx/news/2025/a-helicopter-is-pictur.jpg,2025-03-02T12:30:01Z,https://web.archive.org/web/20250306220755/https://phys.org/news/2025-03-thousands-japan-biggest-wildfire-decades.html,"Thousands of people evacuated from parts of northern Japan as the country's largest wildfire in three decades raged unabated Sunday after killing at least one person, officials said.
Around 2,000 pe… [+1370 chars]",,en,'wildfire'
https://www.foxnews.com/politics/newsom-declares-state-emergency-fast-track-wildfire-measures-after-trump-attacks-over-previous-blazes,https://www.foxnews.com/politics/newsom-declares-state-emergency-fast-track-wildfire-measures-after-trump-attacks-over-previous-blazes,0,www.foxnews.com,Newsom declares state of emergency to 'fast-track' wildfire measures after Trump attacks over previous blazes,California Gov. Gavin Newsom declared a state of emergency on Saturday in a bid to remove red tape blocking funding for wildfire relief efforts.,https://static.foxnews.com/foxnews.com/content/uploads/2025/01/newsom-trump-eo.jpg,2025-03-02T12:59:54Z,,"California Gov. Gavin Newsom declared a state of emergency on Saturday in a bid to fast-track wildfire prevention projects.
Newsom announced the move after President Donald Trump blasted the governo… [+2333 chars]",,en,'wildfire relief'
https://www.denverpost.com/2025/03/02/colorado-wildfire-risk-forest-service-job-cuts-impact-firefighting/,https://www.denverpost.com/2025/03/02/colorado-wildfire-risk-forest-service-job-cuts-impact-firefighting/,0,www.denverpost.com,"Forest Service cuts exacerbate wildfire threats in Colorado, fire officials say: “We’re decreasing our ability to respond.”","Colorado, like many other states in the West, relies on federal firefighting teams to battle large-scale fires across its federal public lands, which cover about a third of the state.",https://www.denverpost.com/wp-content/uploads/2020/10/TDP-L-CAMERON_PEAK_FIRE_465.jpg?w=1024&h=683,2025-03-02T13:00:44Z,http://archive.md/20250302164724/https://www.denverpost.com/2025/03/02/colorado-wildfire-risk-forest-service-job-cuts-impact-firefighting/,"When Dan Gibbs put on his firefighting gear and responded to the Cameron Peak Fire as it ripped through more than 326 square miles of northern Colorado in 2020, his 15-member attack crew was not staf… [+13485 chars]",,en,'forest fire'
https://theconversation.com/wildfire-season-is-changing-in-canada-posing-even-greater-risks-to-the-nations-communities-and-ecosystems-248323,https://theconversation.com/wildfire-season-is-changing-in-canada-posing-even-greater-risks-to-the-nations-communities-and-ecosystems-248323,0,theconversation.com,Wildfire season is changing in Canada — posing even greater risks to the nation’s communities and ecosystems,"By pinpointing Canada’s most vulnerable regions, targeted wildfire prevention strategies can be carried out.",https://images.theconversation.com/files/651801/original/file-20250226-32-yxi1v9.JPG?ixlib=rb-4.1.0&rect=0%2C1046%2C6276%2C3138&q=45&auto=format&w=1356&h=668&fit=crop,2025-03-02T13:49:19Z,https://web.archive.org/web/20250304011432/https://theconversation.com/wildfire-season-is-changing-in-canada-posing-even-greater-risks-to-the-nations-communities-and-ecosystems-248323,"Wildfire season in Canada has historically spanned from late April to August with the most damaging of these fires typically burning in June and July. But in recent years, weve seen a significant cha… [+6065 chars]",,en,'wildfire'
https://nypost.com/2025/03/02/us-news/gavin-newsom-moves-to-clear-flammable-brush-from-california-forests-after-trumps-criticism-over-wildfire-policies/,https://nypost.com/2025/03/02/us-news/gavin-newsom-moves-to-clear-flammable-brush-from-california-forests-after-trumps-criticism-over-wildfire-policies/,0,nypost.com,Newsom moves to clear flammable brush from California forests after Trump’s criticism over wildfire policies,California Gov. Gavin Newsom tapped into his emergency powers Saturday to relax environmental regulations so that the state can speed up wildfire prevention projects.,https://nypost.com/wp-content/uploads/sites/2/2025/03/99568817.jpg?quality=75&strip=all&w=1024,2025-03-02T15:46:56Z,http://archive.md/20250302232801/https://nypost.com/2025/03/02/us-news/gavin-newsom-moves-to-clear-flammable-brush-from-california-forests-after-trumps-criticism-over-wildfire-policies/,"California Gov. Gavin Newsom tapped into his emergency powers Saturday to roll back environmental regulations so that the state can speed up wildfire prevention projects, including clearing flammable… [+3059 chars]",,en,'forest fire'
https://www.nbcnews.com/weather/wildfires/south-carolina-governor-declares-state-emergency-raging-wildfires-prom-rcna194395,https://www.nbcnews.com/weather/wildfires/south-carolina-governor-declares-state-emergency-raging-wildfires-prom-rcna194395,0,www.nbcnews.com,South Carolina governor declares state of emergency as raging wildfires prompt mass evacuations,A mass of wildfires burning across South Carolina prompted Gov.,"https://media-cldnry.s-nbcnews.com/image/upload/t_nbcnews-fp-1200-630,f_auto,q_auto:best/rockcms/2025-03/250302-south-carolina-wildfire-vl-1106a-2b82ba.jpg",2025-03-02T17:22:22Z,http://archive.md/20250302183124/https://www.nbcnews.com/weather/wildfires/south-carolina-governor-declares-state-emergency-raging-wildfires-prom-rcna194395,"A mass of wildfires burning across South Carolina prompted Gov. Henry McMaster to declare a state of emergency Sunday, as firefighters battled a series of blazes that have already consumed approximat… [+2198 chars]",,en,'wildfire evacuation'
https://www.today.com/news/news/south-carolina-state-emergency-wildfires-rcna194402,https://www.today.com/news/news/south-carolina-state-emergency-wildfires-rcna194402,0,www.today.com,South Carolina governor declares state of emergency as raging wildfires prompt mass evacuations,A mass of wildfires burning across South Carolina prompted Gov.,"https://media-cldnry.s-nbcnews.com/image/upload/t_social_share_1200x630_center,f_auto,q_auto:best/rockcms/2025-03/250302-south-carolina-wildfire-vl-1106a-2b82ba.jpg",2025-03-02T17:31:34Z,,"A mass of wildfires burning across South Carolina prompted Gov. Henry McMaster to declare a state of emergency Sunday, as firefighters battled a series of blazes that have already consumed approximat… [+2277 chars]",,en,'wildfire'
https://www.ibtimes.com/horrifying-video-shows-plane-flying-billowing-smoke-wildfires-carolinas-3765038,https://www.ibtimes.com/horrifying-video-shows-plane-flying-billowing-smoke-wildfires-carolinas-3765038,0,www.ibtimes.com,Horrifying Video Shows Plane Flying Through Billowing Smoke as Wildfires Engulf the Carolinas,"A massive wildfire is engulfing parts of South Carolina, and video shows low-flying planes cruising through the billowing smoke in a desperate attempt to fight the blazes.",https://d.ibtimes.com/en/full/4584938/carolina-wildfires.png,2025-03-02T18:29:20Z,,"A massive wildfire is engulfing parts of North and South Carolina, and a video shows low-flying planes cruising through the billowing smoke in a desperate attempt to fight the blazes in South Carolin… [+1536 chars]",,en,'wildfire'
https://www.newsweek.com/south-north-carolina-wildfires-evacuation-orders-2038437,https://www.newsweek.com/south-north-carolina-wildfires-evacuation-orders-2038437,0,www.newsweek.com,Evacuation Orders in Place Amid Massive South Carolina Wildfires,"Evacuation orders expand as a 1,200-acre wildfire threatens Carolina communities while Gov. McMaster declares a State of Emergency.",https://d.newsweek.com/en/full/2598572/conway-firefighters.png,2025-03-02T19:29:01Z,,"Massive wildfires across the Carolinas have forced evacuations of multiple neighborhoods, particularly in the Carolina Forest area near Myrtle Beach, South Carolina, where a fire has grown to approxi… [+4489 chars]",,en,'wildfire'
