index,published,keyword,domain,language,valid,title,description,url,image,archive,content,quote,de,en,la,added
c9052eccab25796e7b00ba102145e6f5,2026-05-01T21:49:02Z,'wildfire',financialpost.com,en,0.9,Potential Public Safety Power Shutoff for Hughenden and Surrounding Area,"CALGARY, Alberta — AltaLink is monitoring extreme wildfire conditions forecast for Sunday, May 3, within the Municipal District of Provost No. 51 area. If extreme conditions remain, AltaLink may need to take the proactive measure to temporarily shut off two t…",https://financialpost.com/pmn/business-wire-news-releases-pmn/potential-public-safety-power-shutoff-for-hughenden-and-surrounding-area,,,"CALGARY, Alberta AltaLink is monitoring extreme wildfire conditions forecast for Sunday, May 3, within the Municipal District of Provost No. 51 area. If extreme conditions remain, AltaLink may need t… [+5023 chars]",,"Potenzielle Stromabschaltung für die öffentliche Sicherheit in Hughenden und Umgebung. CALGARY, Alberta – AltaLink überwacht die für Sonntag, den 3. Mai, prognostizierten extremen Waldbrandbedingungen im Gebiet Nr. 51 des Stadtbezirks Provost. Wenn weiterhin extreme Bedingungen herrschen, muss AltaLink möglicherweise proaktive Maßnahmen ergreifen und zwei T… vorübergehend abschalten.","Potential Public Safety Power Shutoff for Hughenden and Surrounding Area. CALGARY, Alberta — AltaLink is monitoring extreme wildfire conditions forecast for Sunday, May 3, within the Municipal District of Provost No. 51 area. If extreme conditions remain, AltaLink may need to take the proactive measure to temporarily shut off two t…","Potentia Publica Salutis Power Shutoff pro Hughenden et Area circumiacentium. CALGARY, Alberta — AltaLink est vigilantia extremae condiciones incendii incendii praecognoscere pro die Dominico, die 3 mensis Maii, intra Districtum Municipalem Praepositi N. 51 area. Si extremae conditiones manent, AltaLink necesse est accipere modum proactive ad tempus interclusa duo t…",2026-05-04 10:25:41+00:00
e8c7fd939a885c7a4b8e24b084f9fc8b,2026-05-03T02:58:59Z,'wildfire',nypost.com,en,0.9,Rare ‘ash devil’ spotted during SoCal wildfire,"A fast-moving vegetation fire in Phelan is now half contained after scorching roughly 19 acres, but it’s the unusual sight captured on video that’s turning heads.",https://nypost.com/2026/05/02/us-news/rare-ash-devil-spotted-during-socal-wildfire/,https://nypost.com/wp-content/uploads/sites/2/2026/05/firecomp-1.jpg?quality=75&strip=all&w=1200,,"A fast-moving vegetation fire in Phelan is now half contained after scorching roughly 19 acres, but its the unusual sight captured on video thats turning heads.
The Trinity Fire, which ignited in Sa… [+1974 chars]",,"Seltener „Ascheteufel“ während eines Waldbrands in Südkalifornien gesichtet. Ein sich schnell ausbreitender Vegetationsbrand in Phelan ist inzwischen zur Hälfte eingedämmt, nachdem er etwa 19 Hektar verbrannt hat, aber es ist der ungewöhnliche Anblick, der auf Video festgehalten wird und die Aufmerksamkeit erregt.","Rare ‘ash devil’ spotted during SoCal wildfire. A fast-moving vegetation fire in Phelan is now half contained after scorching roughly 19 acres, but it’s the unusual sight captured on video that’s turning heads.","Rare 'cinis diaboli maculosus in igne igneo SoCal. Ignis vegetationis velocissimi in Phelan dimidia iam contenta est postquam dure 19 iugera exusta est, sed visus insolitus captus est in capitibus video quod vertunt.",2026-05-04 10:25:41+00:00
fbe82c28d8ad9018945d225441e6fde1,2026-05-03T10:00:00Z,'wildfire residents',www.cbc.ca,en,0.9,'Build from the ashes’: Fort McMurray reflects on how community has changed since 2016 wildfire,"It's been 10 years since more than 2,500 homes were destroyed in the 2016 Horse River Wildfire. The community has rebuilt and fire officials have invested millions of dollars into fire prevention and planning. Many residents are ready to move on, while others…",https://www.cbc.ca/news/canada/edmonton/northern-alberta-fort-mcmurray-wildfire-anniversary-9.7185328,"https://i.cbc.ca/ais/1.3615039,1777689000831/full/max/0/default.jpg?im=Crop%2Crect%3D%280%2C189%2C3000%2C1687%29%3BResize%3D620",,"Ten years after fleeing her burning Fort McMurray neighbourhood through gridlocked traffic, Alexis Gale still finds herself packing a to-go bag as soon as the winter snow begins to melt.
For Gale, w… [+3728 chars]",,"„Aus der Asche bauen“: Fort McMurray denkt darüber nach, wie sich die Gemeinschaft seit dem Flächenbrand 2016 verändert hat. Es ist 10 Jahre her, dass beim Wildbrand in Horse River im Jahr 2016 mehr als 2.500 Häuser zerstört wurden. Die Gemeinde wurde wieder aufgebaut und die Feuerwehr hat Millionen von Dollar in die Brandverhütung und -planung investiert. Viele Bewohner sind bereit, weiterzuziehen, während andere…","'Build from the ashes’: Fort McMurray reflects on how community has changed since 2016 wildfire. It's been 10 years since more than 2,500 homes were destroyed in the 2016 Horse River Wildfire. The community has rebuilt and fire officials have invested millions of dollars into fire prevention and planning. Many residents are ready to move on, while others…","""Ex cinere aedificare"": Fort McMurray cogitat quomodo communitas post 2016 ignem ferum mutatum est. X annos fuit ex quo plus quam 2.500 domos in 2016 Equorum Flumen Wildfire deletae sunt. Communitas magistratuum decies centena milia dollariorum incendium praeventioni et consilio reaedificavit et ignem collocaverunt. Multi incolas ad proficiscendum parati sunt, alii…",2026-05-04 10:25:41+00:00
