index,published,keyword,domain,language,valid,title,description,url,image,archive,content,quote
a2565240edb3c332ce485bceda879dc7,2025-10-04T11:00:00Z,'wildfire evacuation',www.npr.org,en,0,'The Lost Bus' brings you on board for a terrifying wildfire evacuation,Matthew McConaughey and America Ferrera star in the true story of a bus driver and a schoolteacher who bring a bus full of children to safety during California's devastating 2018 Camp Fire.,https://www.npr.org/2025/10/04/nx-s1-5558148/the-lost-bus-review,https://npr.brightspotcdn.com/dims3/default/strip/false/crop/3401x1911+0+138/resize/1400/quality/100/format/jpeg/?url=http%3A%2F%2Fnpr-brightspot.s3.amazonaws.com%2Fa7%2Ff7%2F5697831f45478d75c5d69176d9cf%2Fthe-lost-bus-photo-0103.jpg,,"When I went to a screening of The Lost Bus at the Toronto International Film Festival last month, it was in a very big theater with a big screen and a big audience. The story of a bus driver and a sc… [+4434 chars]",
93b7c2b2296ce108ad0f2c31d635dd22,2025-10-04T19:55:31Z,'wildfire smoke',twistedsifter.com,en,0,Wildfire Smoke Can Travel Thousands Of Miles And Remain Dangerous According To New Paper,Wildfires are far more dangerous than previously believed.,http://twistedsifter.com/2025/10/wildfire-smoke-can-travel-thousands-of-miles-and-remain-dangerous-according-to-new-paper/,https://twistedsifter.com/wp-content/uploads/2025/09/Wildfires-1.jpg,,"Shutterstock
Wildfires can be absolutely devastating to the area where they burn. They destroy trees and other plants, kill countless wildlife animals, destroy homes, and can even kill those who liv… [+2371 chars]",
0686b8516c5a4c9f55bf9fa064138da0,2025-10-05T08:00:00Z,'wildfire hot',www.cbc.ca,en,0,Hikers can be citizen scientists in photo project documenting forest regrowth in Jasper,Hikers in Jasper National Park are being urged to help with a research project on the Old Fort Point trail. Three posts were installed along the hike so visitors can log photos to track tree regeneration following the 2024 wildfire.,https://www.cbc.ca/news/canada/edmonton/hikers-can-be-citizen-scientists-in-photo-project-documenting-forest-regrowth-in-jasper-1.7648369,https://i.cbc.ca/1.7648503.1759349016!/fileImage/httpImage/image.jpg_gen/derivatives/16x9_1180/jasper-photo-station.jpg?im=Resize%3D620,,"As visitors at Old Fort Point look out at the mosaic of burnt patches of forest from the Jasper wildfire, they see a vastly different landscape than they would have before July 2024. But that same ba… [+4207 chars]",
76ad367903ed557a8d9cd7842419054b,2025-10-05T12:02:41Z,'wildfire',financialpost.com,en,0,"Residents of fire-ravaged Saskatchewan village face housing squeeze, high prices","Brittany Holmgren has lived in her hometown her entire life. Denare Beach is where she’s enjoyed the outdoors with friends, got her first job and started a family — but it’s also where she lost nearly everything. In June, a wildfire tore through the northeast…",https://financialpost.com/pmn/residents-of-fire-ravaged-saskatchewan-village-face-housing-squeeze-high-prices,,,"Brittany Holmgren has lived in her hometown her entire life.
THIS CONTENT IS RESERVED FOR SUBSCRIBERS ONLY
Subscribe now to read the latest news in your city and across Canada.
<ul><li>Exclusive a… [+4956 chars]",
c51d2aebfc52bf676e8baefa12102ddf,2025-10-05T16:55:40Z,'forest fire',www.channelnewsasia.com,en,0,"Postecoglou under fire as Forest lose again, Palace's unbeaten run ends",NEWCASTLE :Newcastle United beat Nottingham Forest 2-0 to heap more pressure on Ange Postecoglou while Crystal Palace's club-record unbeaten run came to an end with defeat at Everton in the Premier League on Sunday. Bottom side Wolverhampton Wanderers were de…,https://www.channelnewsasia.com/sport/postecoglou-under-fire-forest-lose-again-palaces-unbeaten-run-ends-5385591,"https://dam.mediacorp.sg/image/upload/s--F00UptAx--/c_fill,g_auto,h_676,w_1200/fl_relative,g_south_east,l_mediacorp:cna:watermark:2024-04:reuters_1,w_0.1/f_auto,q_auto/v1/one-cms/core/2025-10-05T165540Z_1_LYNXNPEL940AN_RTROPTP_3_SOCCER-ENGLAND-NEW-NFO.JPG?itok=GEydZGSJ",,NEWCASTLE :Newcastle United beat Nottingham Forest 2-0 to heap more pressure on Ange Postecoglou while Crystal Palace's club-record unbeaten run came to an end with defeat at Everton in the Premier L… [+2886 chars],
c69f6fb510a3724d4ae653c3711592e1,2025-10-05T17:50:40Z,'wildfire',www.cbc.ca,en,0,"Evacuees from Lake George wildfire 'feeling desperate,' says Kings County mayor",The mayor of the Municipality of the County of Kings says these are hard days for people displaced by the Lake George wildfire. An update from the Kings County Emergency Coordination Centre on Sunday said 205 evacuees had registered with the Canadian Red Cros…,https://www.cbc.ca/news/canada/nova-scotia/evacuees-from-lake-george-wildfire-feeling-desperate-says-kings-county-mayor-1.7651652,https://i.cbc.ca/1.7649108.1759413388!/fileImage/httpImage/image.jpg_gen/derivatives/16x9_1180/lake-george-fire.jpg?im=Resize%3D620,,"The mayor of the Municipality of the County of Kings says these are hard days for people displaced by the Lake George wildfire.
An update from the Kings County Emergency Coordination Centre on Sunda… [+1659 chars]",
bd3dbd163f6d64d746c1c57ccee97d1d,2025-10-05T18:10:44Z,'wildfire',www.westernjournal.com,en,0,'Democrat Shutdown' Could Fan the Literal Flames of Wildfires: GOP Reps,"The USDA notes in its funding lapse plan that the Forest Service will need to “scale back hazardous fuels treatments like prescribed burns.""",https://www.westernjournal.com/democrat-shutdown-fan-literal-flames-wildfires-gop-reps/,https://www.westernjournal.com/wp-content/uploads/2025/10/Ben-Working-Feature-Image-2025-10-04T200058.418.jpg,,"As the government shutdown drags on, some GOP members of the House Agriculture Committee warn that reduced forest management could increase the risks of intense wildfires.
Government funding lapsed … [+3539 chars]",
4d30be31499716860b1328472ed664e4,2025-10-05T18:40:38Z,'bushfire',www.abc.net.au,en,0,Spring heatwave increases fire risk as scores of blazes burn in Queensland,"Temperatures could soar to almost 10 degrees above average this week, increasing the risk of bushfires that are already burning across the state.",https://www.abc.net.au/news/2025-10-06/spring-heatwave-hot-dry-weather-fire-danger-queensland/105853486,https://live-production.wcms.abc-cdn.net.au/8d09bcea05b27bcbb9e3a75264d837d7?impolicy=wcms_watermark_news&cropH=2813&cropW=5000&xPos=0&yPos=591&width=862&height=485&imformat=generic,,"Queensland is going to swelter through an unseasonal spring heatwave as more hot and dry conditions increase the risk of fires for much of the state this week.
Bureau of Meteorology senior forecaste… [+3066 chars]",
d34359eb09b54927fe9240178e9f740c,2025-10-06T06:22:01Z,'bushfire',www.abc.net.au,en,0,Rail line closed as fire burns near Pacific Highway,A Watch and Act alert is in place for a bushfire burning on the NSW Mid North Coast around 3 kilometres from the Pacific Highway.,https://www.abc.net.au/news/2025-10-06/collombatti-bushfire-extreme-fire-danger-pacific-highway/105855400,https://live-production.wcms.abc-cdn.net.au/d15bf9fd29848717e5055020f6daca11?impolicy=wcms_watermark_news&cropH=864&cropW=1536&xPos=0&yPos=592&width=862&height=485&imformat=generic,,"A Watch and Act alert has been issued for an out-of-control bushfire burning just west of the Pacific Highway at Collombatti, on the NSW Mid North Coast.
The Rural Fire Service (RFS) is telling resi… [+1883 chars]",
2e3b784468e743c04565048fb39ddea4,2025-10-06T08:55:37Z,'wildfire heat',www.nationalobserver.com,en,0,Wildfire smoke will become deadlier if emissions aren't curbed: study,"As many as 1.4 million people globally will die each year if planet-heating emissions aren't curbed, researchers have found, while separate research released on the same day shows more than 70,000 people will die each year in the US alone by 2050.",https://www.nationalobserver.com/2025/10/06/news/wildfire-smoke-lethality-study,https://www.nationalobserver.com/sites/default/files/img/2025/10/02/engine_343_alongside_the_gifford_fire.jpg,,"This story was originally published by The Guardian and appears here as part of the Climate Desk collaboration
Smoke billowing from wildfires will cause a growing number of deaths around the world i… [+4374 chars]",
5e81861512b634547e390a13b89f5fb7,2025-10-06T11:55:57Z,'wildfire',www.insurancejournal.com,en,0,Hedge Funds Targeting Fire Insurance Hit a Wall in California,"Hedge funds speculating on wildfire insurance claims in California were just dealt a legal blow, after the state adopted new legislation designed to stifle such bets. Under the law, approved last month by California Governor Gavin Newsom, alternative investme…",https://www.insurancejournal.com/news/national/2025/10/06/842750.htm,https://www.insurancejournal.com/app/uploads/2025/10/wildfires-bloomberg-photo-scaled.jpg,,"Hedge funds speculating on wildfire insurance claims in California were just dealt a legal blow, after the state adopted new legislation designed to stifle such bets.
Under the law, approved last mo… [+6203 chars]",
2ad2855eafa9d16af3dcd134608d5d83,2025-10-06T14:27:15Z,'wildfire',contexts.org,en,0,fire flight,"In January 2025, wildfires tore through Los Angeles County, reducing entire communities to ashes and displacing tens of thousands of residents. While the immediate impacts on city infrastructure and displaced residents are well-documented, a research study in…",https://contexts.org/articles/fire-flight/,,,"Affected areas can see out-migration for over a year following rare, highly destructive wildfires. iStockPhoto // VladTeodor
In January 2025, wildfires tore through Los Angeles County, reducing enti… [+1681 chars]",
8d5fc08ef7e4b03aff29f37c5f2201de,2025-10-06T16:17:17Z,'wildfire',www.cbc.ca,en,0,Officials ask people to 'stay the heck out' of evacuation zones near Lake George wildfire,The mayor of the Municipality of the County of Kings is calling for people to stop entering wildfire evacuation zones on all-terrain vehicles. The Lake George wildfire remains uncontrolled and has caused more then 350 homes and cottages to be evacuated.,https://www.cbc.ca/news/canada/nova-scotia/lake-george-fire-evacuation-zones-1.7652104,https://i.cbc.ca/1.7649069.1759766515!/fileImage/httpImage/image.jpg_gen/derivatives/16x9_1180/lake-george-fire.jpg?im=Resize%3D620,,"Municipal officials in Kings County are calling for people to stay out of mandatory evacuation zones as the Lake George wildfire remains out of control. 
Dave Corkum, mayor of the Municipality of th… [+1842 chars]",
7a5c2321470f92a836ba04611f5f4e2d,2025-10-06T18:45:32Z,'bushfire',www.abc.net.au,en,0,"Wildfires more lethal, economically damaging than ever, modelling shows","New research from Australian researchers shows, globally, major bushfire events are becoming more frequent, fatal and economically damaging.",https://www.abc.net.au/news/2025-10-07/wildfires-more-lethal-economically-damaging-report-finds/105853650,https://live-production.wcms.abc-cdn.net.au/ef71c09d1f670c0f683f94a230dcc26e?impolicy=wcms_watermark_news&cropH=2717&cropW=4830&xPos=94&yPos=995&width=862&height=485&imformat=generic,,"Every year, Australians are impacted by scores of bushfires.
Just this weekend, campers were evacuated off Moreton Island in Queensland's south-east.
A windy and hotter-than-usual Saturday in south… [+5269 chars]",
733d55a5b82c7fc88d58f0959e9e7dd0,2025-10-06T19:29:41Z,'wildfire',www.nationalobserver.com,en,0,Nova Scotia wildfire burning out of control amid hot fall weather,Unseasonably warm temperatures proved challenging Monday as the fight against an out-of-control wildfire in Nova Scotia's Annapolis Valley entered its second week.,https://www.nationalobserver.com/2025/10/06/news/nova-scotia-wildfire-burning-out-control-amid-hot-fall-weather,https://www.nationalobserver.com/sites/default/files/img/2025/10/06/db72a0be-a943-4b73-a71e-4fd6e7094b30.jpeg,,"Unseasonably warm temperatures proved challenging Monday as the fight against an out-of-control wildfire in Nova Scotia's Annapolis Valley entered its second week.
The Department of Natural Resource… [+2170 chars]",
58af248c8ea288bbd6bef3404991066b,2025-10-07T01:30:37Z,'bushfire',www.abc.net.au,en,0,"Far north of WA sees 2.7 million hectares burnt, double the size of Sydney","This year's northern bushfire season has been dubbed ""one of the toughest on record"", with blazes having burnt through about 2.7 million hectares of land in WA's Kimberley region.",https://www.abc.net.au/news/2025-10-07/kimberley-bushfires-millions-burnt-hectares/105835854,https://live-production.wcms.abc-cdn.net.au/9077bad364cb3f7b7f3103e44b073104?impolicy=wcms_watermark_news&cropH=608&cropW=1080&xPos=0&yPos=481&width=862&height=485&imformat=generic,,"Western Australia's Department of Fire and Emergency Services has dubbed this year's northern bushfire season ""one of the toughest on record"" with blazes burning an estimated 2.7 million hectares in … [+3266 chars]",
e6867cdeb9648cbdaf88144f9b4616a9,2025-10-07T08:45:00Z,'forest fire',grist.org,en,0,The ambitious plan to protect Northern California’s Plumas National Forest from wildfires,"To shield the forest and its communities from the next megafire, the Forest Service plans to burn it — intentionally.",https://grist.org/wildfires/the-ambitious-plan-to-protect-northern-californias-plumas-national-forest-from-wildfires/,https://grist.org/wp-content/uploads/2025/10/TimOBrien16by9.jpg?quality=75&strip=all,,"This investigation was originally published by The Plumas Sun and Bay Nature, a nonprofit news outlet that connects San Francisco Bay Area residents more deeply with the natural world.
A white-heade… [+24774 chars]",
d18dacda8e18ec454473adb9e73d9c11,2025-10-07T09:00:00Z,'wildfire insurance',www.artnews.com,en,0,What the Los Angeles Wildfires Taught the Art Insurance Industry,"After the devastating wildfires in Los Angeles in January 2025, art insurance experts discuss what has and hasn't changed in the industry.",https://www.artnews.com/art-news/news/art-insurance-los-angeles-wildfires-1234755619/,https://www.artnews.com/wp-content/uploads/2025/10/View-of-Radcliffe-avenue-as-the-Palisades-Fire-burns-in-during-a-powerful-windstorm-on-January-8-2025-in-the-Pacific-Palisades-neighborhood-of-Los-Angeles-California-Photo-by-Apu-Gomes-Getty-Images.jpg?w=1024,,Ron Rivlin thought he was well prepared for fire. The owner of Revolver Gallery in Los Angeles and a prolific collector of works by Andy Warhol had custom-built his home in Pacific Palisades with sta… [+16232 chars],
49da9ee5ed02ec6c18f52322bc124eb8,2025-10-07T15:39:01Z,'wildfire',www.bellingcat.com,en,0,Wildfires Ravage One of Africa’s Largest Nature Reserves,"Late last month, fires engulfed Namibia’s most visited wildlife reserve – Etosha National Park. An analysis of satellite imagery by Bellingcat has found that more than a third of the park was affected, impacting crucial grazing lands for endangered species, i…",https://www.bellingcat.com/news/2025/10/07/wildfires-ravage-one-of-africas-largest-nature-reserves/,https://www.bellingcat.com/app/uploads/2025/10/top.jpg,,"Late last month, fires engulfed Namibias most visited wildlife reserve – Etosha National Park. An analysis of satellite imagery by Bellingcat has found that more than a third of the park was affected… [+5738 chars]",
d9b028f61a67d64ae032bc72aeb1505c,2025-10-07T19:02:02Z,'bushfire',www.abc.net.au,en,0,Telcos face surprise 'stress test' within weeks as Optus fallout continues,"The adequacy of Australia's emergency call network will be stress tested with a surprise drill ahead of bushfire season, as the opposition ramps up its assault over the communication minister's handling of last month's fatal triple-0 outage.",https://www.abc.net.au/news/2025-10-08/surprise-drill-for-telcos-as-coalition-goes-after-wells/105863244,https://live-production.wcms.abc-cdn.net.au/ceba792b291b52c9d9ee65f192ffe675?impolicy=wcms_watermark_news&cropH=850&cropW=1511&xPos=89&yPos=41&width=862&height=485&imformat=generic,,"The adequacy of Australia's emergency call network will be stress tested with a surprise drill ahead of bushfire season, as the opposition ramps up its assault over the communication minister's handl… [+6043 chars]",
f2d8687c8eea1a35cb0dda5d8174b423,2025-10-07T21:59:19Z,'wildfire',consent.yahoo.com,en,0,US sues Southern California Edison over Saddleridge wildfire,,https://consent.yahoo.com/v2/collectConsent?sessionId=1_cc-session_535e3b55-b463-43f5-b65d-14a09e8511bc,,,"If you click 'Accept all', we and our partners, including 237 who are part of the IAB Transparency &amp; Consent Framework, will also store and/or access information on a device (in other words, use … [+714 chars]",
830ec3ec6a2bd58cbaa0b8c38a0f99b2,2025-10-08T05:00:10Z,'wildfire victims',www.insurancejournal.com,en,0,US Sues Southern California Edison Over 2019 Wildfire,The U.S. government sued Southern California Edison to help restore National Forest System lands burned in the Saddleridge wildfire near Los Angeles in 2019. Tuesday’s lawsuit seeks damages for fire suppression costs and rehabilitation stemming from the Ediso…,https://www.insurancejournal.com/news/west/2025/10/08/843007.htm,https://www.insurancejournal.com/img/social/opengraph/ij-social-lawsuits-1200x630.png,,"The U.S. government sued Southern California Edison to help restore National Forest System lands burned in the Saddleridge wildfire near Los Angeles in 2019.
Tuesday’s lawsuit seeks damages for fire… [+1885 chars]",
517ecfad9c6dafebe8ea9809590ac77b,2025-10-08T13:40:40Z,'forest fire',scienceblog.com,en,0,Amazon’s Invisible Crisis: Fire Damage Now Worse Than Deforestation,"The Amazon rainforest just experienced something scientists didn't see coming. In 2024, forest fires caused more carbon emissions than clear-cutting did",https://scienceblog.com/amazons-invisible-crisis-fire-damage-now-worse-than-deforestation/,https://scienceblog.com/wp-content/uploads/2025/10/Pan-Amazon-map.jpg,,"The Amazon rainforest just experienced something scientists didn’t see coming. In 2024, forest fires caused more carbon emissions than clear-cutting did for the first time on record, releasing roughl… [+5564 chars]",
464f9584443eb71e22623ee7dcf0e046,2025-10-08T13:45:28Z,'wildfire house',www.fox6now.com,en,0,The Night Wisconsin Burned: The Peshtigo Fire of 1871,"Before Chicago’s famous blaze, Wisconsin faced its own inferno. The 1871 Peshtigo Fire killed over 1,200 people and remains America’s deadliest wildfire.",https://www.fox6now.com/weather/night-wisconsin-burned-forgotten-firestorm-peshtigo,https://images.foxtv.com/static.fox6now.com/www.fox6now.com/content/uploads/2025/10/1280/720/gettyimages-517220336.jpg?ve=1&tl=1,,"While most will recall Oct. 8, 1871 as the day of Chicago’s Great Fire, that story stole the headlines from a blaze in Wisconsin that has been described as Hell on Earth.
On the very same night, Mrs… [+4572 chars]",
59a799f09ff3773e2278d036906e6e7f,2025-10-08T14:57:30Z,'wildfire',www.denverpost.com,en,0,Authorities make an arrest related to deadly January wildfire that leveled LA neighborhood,A 29-year-old man was arrested in Florida and will appear in court Wednesday in that state.,https://www.denverpost.com/2025/10/08/significant-development-palisades-fire-probe/,https://www.denverpost.com/wp-content/uploads/2025/10/California_Wildfires_75668-1.jpg?w=1024&h=682,,"By CHRISTOPHER WEBER and ERIC TUCKER, Associated Press
LOS ANGELES (AP) Authorities in California have made an arrest in connection with the deadly January wildfire that erupted into the most destru… [+2031 chars]",
4041a4cdcacbecca35a5961c0e2462db,2025-10-08T15:08:50Z,'wildfire',nypost.com,en,0,"Suspect in deadly Los Angeles Palisades Fire arrested, law enforcement sources say","A suspect tied to the deadly Palisades Fire — the most destructive wildfire in Los Angeles history — has been arrested, according to multiple reports. The arrest was reported Wednesday morning by ABC News and NBC Los Angeles, citing multiple law enforcement s…",https://nypost.com/2025/10/08/us-news/suspect-in-deadly-los-angeles-palisades-fire-arrested-law-enforcement-sources-say/,https://nypost.com/wp-content/uploads/sites/2/2025/10/palisades-fire-ravages-neighborhood-amid-113051485.jpg?quality=75&strip=all&w=1024,,"A suspect tied to the deadly Palisades Fire the most destructive wildfire in Los Angeles history has been arrested, according to multiple reports.
The arrest was reported Wednesday morning by ABC Ne… [+853 chars]",
9ac4a504600f90f6ff9b582f979cc767,2025-10-08T15:39:28Z,'wildfire insurance',www.insurancejournal.com,en,0,Connecticut Launches Free Online Property Risk Mapping Tool,"Connecticut has launched a free online risk mapping tool that allows Connecticut homeowners and businesses to assess their property’s risk from flooding, wildfires, and other perils to better understand their insurance needs. Provided through a public-partner…",https://www.insurancejournal.com/news/east/2025/10/08/843106.htm,https://www.insurancejournal.com/img/social/opengraph/ij-social-default-1200x630.png,,"Connecticut has launched a free online risk mapping tool that allows Connecticut homeowners and businesses to assess their property’s risk from flooding, wildfires, and other perils to better underst… [+1789 chars]",
3c1620996ac38ca0f4a1463d83127008,2025-10-08T16:03:51Z,'wildfire',www.huffpost.com,en,0,Authorities Make Arrest Related To Wildfire That Leveled LA Neighborhood,The deadly January wildfire destroyed the Los Angeles neighborhood of Pacific Palisades.,https://www.huffpost.com/entry/los-angeles-wildfire-arrest-la-palisades_n_68e68958e4b07aeeb1956491,https://img.huffingtonpost.com/asset/68e68b11180000b46f5d1a67.jpeg?cache=0IAENamc1c&ops=1200_630,,LOS ANGELES (AP) Authorities in California charged a 29-year-old man with starting a fire that days later erupted into the most destructive blaze in Los Angeles history and destroyed much of the Paci… [+3654 chars],
b62808e21b141f35365263d0ef9b6c6d,2025-10-08T16:11:00Z,'wildfire',news.sky.com,en,0,Man arrested over deadly Pacific Palisades fire in California,"A man has been arrested in connection with a deadly wildfire that destroyed much of the Pacific Palisades neighbourhood in Los Angeles, California.",https://news.sky.com/story/man-arrested-over-deadly-pacific-palisades-fire-in-california-13447128,https://e3.365dm.com/25/10/1600x900/skynews-pacific-palisades-jonathan-rinderknecht_7046111.jpg?20251008171705,,"A man has been arrested in connection with a deadly wildfire that destroyed much of the Pacific Palisades neighbourhood in Los Angeles, California.
Jonathan Rinderknecht, 29, was detained for allege… [+1327 chars]",
50ce3b8fce125d46077a5428b2af3e11,2025-10-08T16:32:33Z,'wildfire victims',www.tmz.com,en,0,Feds Arrest Man Suspected of Starting L.A.'s Palisades Wildfire,Huge update in the investigation into the devastating Palisades Fire in California ... the feds say they've arrested a suspect who they say ignited the inferno. Acting U.S. Attorney Bill Essayli just announced the arrest of a 29-year-old man named…,https://www.tmz.com/2025/10/08/arrest-made-pacific-palisades-fire-los-angeles/,https://imagez.tmz.com/image/94/16by9/2025/10/08/941b538780fd44b2a312023a28c95bfc_xl.jpg,,"Huge update in the investigation into the devastating Palisades Fire in California ... the feds say they've arrested a suspect who they say ignited the inferno.
Acting U.S. Attorney Bill Essayli jus… [+935 chars]",
3f86673ede52249849888d12055849aa,2025-10-08T17:29:11Z,'wildfire',www.cbc.ca,en,0,Authorities say they've arrested man who set deadly wildfire that levelled L.A. neighbourhood,"Authorities in California charged a 29-year-old man with starting a fire that days later erupted into the most destructive blaze in Los Angeles history and destroyed much of the Pacific Palisades neighbourhood, U.S. federal law enforcement officials announced…",https://www.cbc.ca/news/world/arrest-january-la-wildfire-9.6931791,"https://i.cbc.ca/ais/196070f1-5374-43a0-a353-d0a4f4e1f2b1,1759942249564/full/max/0/default.jpg?im=Crop%2Crect%3D%280%2C104%2C5280%2C2970%29%3BResize%3D620",,Authorities in California charged a 29-year-old man with starting a fire that days later erupted into the most destructive blaze in Los Angeles history and destroyed much of the Pacific Palisades nei… [+2524 chars],
9d12fd23b1677ae0d57cff5700f9c15b,2025-10-08T19:30:49Z,'wildfire area',www.insurancejournal.com,en,0,Man Charged With ‘Maliciously’ Starting Massive LA Wildfire,"Federal authorities arrested a 29-year-old man on charges that he intentionally started the blaze that days later became the Palisades Fire, which killed 12 people and destroyed thousands of homes in the Pacific Coast area of Los Angeles. Jonathan Rinderknech…",https://www.insurancejournal.com/news/west/2025/10/08/843168.htm,https://www.insurancejournal.com/img/social/opengraph/ij-social-wildfire-1200x630.png,,"Federal authorities arrested a 29-year-old man on charges that he intentionally started the blaze that days later became the Palisades Fire, which killed 12 people and destroyed thousands of homes in… [+4956 chars]",
