index,url,valid,domain,title,description,image,published,archive,content,quote,language,keyword
https://www.huffpost.com/entry/south-and-north-carolina-wildfires_n_67e3cd01e4b027a18a22e1f4,https://www.huffpost.com/entry/south-and-north-carolina-wildfires_n_67e3cd01e4b027a18a22e1f4,0,www.huffpost.com,"Wildfires In The Carolinas Fueled By Drought, Wind And Fallen Trees From Hurricane Helene","""Helene just dropped tons of fuel on the ground,"" one expert said. “Then these flash droughts allow that fuel to dry out very fast.”",https://img.huffingtonpost.com/asset/67e3cd021700002600e1af31.jpeg?cache=6u6TTEb0S2&ops=1200_630,2025-03-26T09:54:30Z,,"In this March 23, 2025, photo released by the U.S. National Guard shows a UH-60 Black Hawk helicopter from the 1-111th General Support Aviation Battalion, 59th Aviation Troop Command, McEntire Joint … [+5200 chars]",,en,'wildfire'
https://www.ibtimes.com.au/workers-save-buddha-s-koreas-wildfires-raze-ancient-temple-1857261,https://www.ibtimes.com.au/workers-save-buddha-s-koreas-wildfires-raze-ancient-temple-1857261,0,www.ibtimes.com.au,Workers Save Buddha As S. Korea's Wildfires Raze Ancient Temple,"At South Korea's thousand-year-old Gounsa Temple, workers delicately swaddled a giant gilded Buddha statue with a fire-retardant blanket.",https://d.ibtimes.com.au/en/full/1876932/wildfires-south-korea-have-claimed-24-lives-destroyed-thousands-hectares-forests.jpg,2025-03-26T10:57:09Z,,"At South Korea's thousand-year-old Gounsa Temple, workers delicately swaddled a giant gilded Buddha statue with a fire-retardant blanket.
Hours later much of the temple burned down in one of the dea… [+5083 chars]",,en,'forest fire'
https://www.ibtimes.com/workers-save-buddha-s-koreas-wildfires-raze-ancient-temple-3767654,https://www.ibtimes.com/workers-save-buddha-s-koreas-wildfires-raze-ancient-temple-3767654,0,www.ibtimes.com,Workers Save Buddha As S. Korea's Wildfires Raze Ancient Temple,"At South Korea's thousand-year-old Gounsa Temple, workers delicately swaddled a giant gilded Buddha statue with a fire-retardant blanket.",https://d.ibtimes.com/en/full/4589399/wildfires-south-korea-have-claimed-24-lives-destroyed-thousands-hectares-forests.jpg,2025-03-26T10:57:19Z,,"At South Korea's thousand-year-old Gounsa Temple, workers delicately swaddled a giant gilded Buddha statue with a fire-retardant blanket.
Hours later much of the temple burned down in one of the dea… [+5083 chars]",,en,'forest fire'
https://www.digitaljournal.com/world/workers-save-buddha-as-s-koreas-wildfires-raze-ancient-temple/article,https://www.digitaljournal.com/world/workers-save-buddha-as-s-koreas-wildfires-raze-ancient-temple/article,0,www.digitaljournal.com,Workers save Buddha as S. Korea’s wildfires raze ancient temple,"At South Korea’s thousand-year-old Gounsa Temple, workers delicately swaddled a giant gilded Buddha statue with a fire-retardant blanket.  Hours later much of the temple burned down in one of the deadliest wildfires to hit South Korea — but the Buddha and the…",https://www.digitaljournal.com/wp-content/uploads/2025/03/bab583319a4be7ec21754420abc7f573021a0748.jpg,2025-03-26T10:57:21Z,,"Wildfires in South Korea have claimed 24 lives and destroyed thousands of hectares of forests - Copyright AFP YASUYOSHI CHIBA
At South Korea’s thousand-year-old Gounsa Temple, workers delicately swa… [+5271 chars]",,en,'wildfire'
https://www.hurriyetdailynews.com/south-koreas-wildfires-kill-24-wreak-unprecedented-damage-207355,https://www.hurriyetdailynews.com/south-koreas-wildfires-kill-24-wreak-unprecedented-damage-207355,0,www.hurriyetdailynews.com,"South Korea's wildfires kill 24, wreak 'unprecedented damage'","One of South Korea's worst-ever wildfire outbreaks has killed at least 24 people, officials said on Wednesday, with multiple raging blazes causing ""unprecedented damage"" and threatening two UNESCO-listed sites.",https://image.hurimg.com/i/hurriyet/75/200x200/67e3de2e6f547b4d58824691.jpg,2025-03-26T11:00:07Z,,"SEOUL
One of South Korea's worst-ever wildfire outbreaks has killed at least 24 people, officials said on Wednesday, with multiple raging blazes causing ""unprecedented damage"" and threatening two UN… [+2792 chars]",,en,'wildfire damage'
https://www.channelnewsasia.com/east-asia/south-koreas-wildfires-kill-24-wreak-unprecedented-damage-5024901,https://www.channelnewsasia.com/east-asia/south-koreas-wildfires-kill-24-wreak-unprecedented-damage-5024901,0,www.channelnewsasia.com,"South Korea's wildfires kill 24, wreak 'unprecedented damage'","ANDONG: One of South Korea's worst-ever wildfire outbreaks has killed at least 24 people, officials said Wednesday (Mar 26), with multiple raging blazes causing ""unprecedented damage"" and threatening t","https://dam.mediacorp.sg/image/upload/s--CDsUtkdA--/fl_relative,g_south_east,l_one-cms:core:watermark:ap_data-1,w_0.1/f_auto,q_auto/c_fill,g_auto,h_676,w_1200/v1/one-cms/core/south_korea_wildfires_ancient_temple_11907.jpg?itok=QLl34-TO",2025-03-26T11:18:20Z,,"Some types of extreme weather have a well-established link with climate change, such as heatwaves or heavy rainfall.
Other phenomena, such as forest fires, droughts, snowstorms and tropical storms c… [+1014 chars]",,en,'wildfire'
https://www.aljazeera.com/gallery/2025/3/26/wild-horses-help-prevent-wildfires-in-spain,https://www.aljazeera.com/gallery/2025/3/26/wild-horses-help-prevent-wildfires-in-spain,0,www.aljazeera.com,Wild horses help prevent wildfires in Spain,"In the Galicia region, wild horses help protect ecosystems and support biodiversity - but their numbers are declining.",https://www.aljazeera.com/wp-content/uploads/2025/03/2025-03-25T081146Z_1666791493_RC2ZO8AEJOS1_RTRMADP_3_SPAIN-ENVIRONMENT-WILDHORSES-1742970096_5ee495-1742984161.jpg?resize=1200%2C630&quality=80,2025-03-26T11:55:35Z,,"The wildfires that once scorched the forests above the Spanish village of Barro each summer have all but disappeared since Lucia Perez began grazing wild horses in the area.
There used to be fires e… [+4164 chars]",,en,'wildfire'
https://www.cbc.ca/news/world/south-korea-wildfires-1.7493533,https://www.cbc.ca/news/world/south-korea-wildfires-1.7493533,0,www.cbc.ca,Helicopter pilot fighting blaze among 24 killed in South Korea wildfires,"The death toll in the wildfires raging across South Korea's southeastern region rose to 24 and the pilot of a firefighting helicopter was killed when the aircraft crashed on Wednesday, as the country battles some of its worst forest fires in decades.",https://i.cbc.ca/1.7493553.1742984415!/fileImage/httpImage/image.jpg_gen/derivatives/16x9_1180/south-korea-wildfires.jpg?im=Resize%3D620,2025-03-26T11:58:59Z,,"The death toll in the wildfires raging across South Korea's southeastern region rose to 24, and the pilot of a firefighting helicopter was killed when the aircraft crashed on Wednesday, as the countr… [+3165 chars]",,en,'wildfire'
https://www.fastcompany.com/91306134/wildfires-ravage-south-korea-forcing-27000-evacuate,https://www.fastcompany.com/91306134/wildfires-ravage-south-korea-forcing-27000-evacuate,0,www.fastcompany.com,"Wildfires ravage South Korea, forcing 27,000 to evacuate","Wind-driven wildfires that were among South Korea’s worst ever have ravaged the country’s southern regions, killing 24 people, destroying more than 200 structures and forcing 27,000 residents to evacuate, officials said Wednesday.The death toll included a pil…","https://images.fastcompany.com/image/upload/f_webp,q_auto,c_fit/wp-cms-2/2025/03/AP25084150784970.jpg",2025-03-26T12:19:40Z,,"Wind-driven wildfires that were among South Koreas worst ever have ravaged the countrys southern regions, killing 24 people, destroying more than 200 structures and forcing 27,000 residents to evacua… [+3584 chars]",,en,'wildfire death'
https://www.irishtimes.com/ireland/2025/03/26/eu-supported-exercise-in-co-wicklow-to-test-emergency-services-response-to-large-wildfire/,https://www.irishtimes.com/ireland/2025/03/26/eu-supported-exercise-in-co-wicklow-to-test-emergency-services-response-to-large-wildfire/,0,www.irishtimes.com,EU-supported exercise in Co Wicklow to test emergency services response to large wildfire,Multi-agency operation will assess Ireland’s preparedness and response capacity,https://www.irishtimes.com/resizer/v2/YQJRE744BRECHCWJCAM5YWMHRU.jpg?smart=true&auth=6e88449f0673e0d4d5798bdbc9f7f017877c349c93d899e803564c74f41187ba&width=1200&height=630,2025-03-26T12:37:32Z,,"An exercise in the Wicklow Mountains, supported by European Union (EU) experts, tests Irelands ability to deal with large forest fires on Wednesday.
Members of the public have been asked not to be a… [+2697 chars]",,en,'wildfire'
https://time.com/7271734/north-south-carolina-wildfires-cause-drought-wind-fallen-trees-hurricane-helene/,https://time.com/7271734/north-south-carolina-wildfires-cause-drought-wind-fallen-trees-hurricane-helene/,0,time.com,"North and South Carolina Wildfires Fueled by Drought, Wind, and Fallen Trees From Hurricane Helene","“The weather over the next few days remains concerning,” the forestry commission said, amid ongoing evacuation orders in the Carolinas.",https://api.time.com/wp-content/uploads/2025/03/AP25083684418468.jpg?quality=85&w=1120&h=628&crop=1,2025-03-26T12:59:34Z,https://web.archive.org/web/20250327153538/https://time.com/7271734/north-south-carolina-wildfires-cause-drought-wind-fallen-trees-hurricane-helene/,"Dry conditions, wind and trees downed by Hurricane Helene fueled wildfires in North Carolina and South Carolina, where evacuation orders were in effect Tuesday.
Many people in the area are still get… [+3495 chars]",,en,'wildfire weather'
https://www.insurancejournal.com/news/international/2025/03/26/817278.htm,https://www.insurancejournal.com/news/international/2025/03/26/817278.htm,0,www.insurancejournal.com,South Korea Battles Wildfires as Death Toll Rises to 18,"Wildfires ravaging South Korea over the past week have killed at least 24 people, making it the country’s worst forest fire disaster in about three decades, as firefighters struggled to contain multiple blazes that have broken out in the country’s …",https://www.insurancejournal.com/app/uploads/2025/03/wildfire-in-andong-south-korea-getty-scaled.jpg,2025-03-26T13:11:26Z,,"Wildfires ravaging South Korea over the past week have killed at least 24 people, making it the country’s worst forest fire disaster in about three decades, as firefighters struggled to contain multi… [+1704 chars]",,en,'forest fire'
https://slashdot.org/firehose.pl?op=view&amp;id=176829005,https://slashdot.org/firehose.pl?op=view&amp;id=176829005,0,slashdot.org,Measles vaccinations are increasing in some areas hit hard by cases: Officials - ABC News,"Measles vaccinations are increasing in some areas hit hard by cases: OfficialsABC News ‘Like a forest fire’: Where large measles outbreaks will occur, according to an epidemiologistThe Hill Measles Can Hide in the Brain—And Four Other Facts That Might Surpris…",,2025-03-26T13:12:15Z,,"Ummm, well, OK. The network's the network, the computer's the computer.
Sorry for the confusion.
-- Sun Microsystems",,en,'forest fire'
https://www.thestar.com.my/news/world/2025/03/26/war-ignited-record-breaking-wildfires-in-ukraine-last-year-scientists-say,https://www.thestar.com.my/news/world/2025/03/26/war-ignited-record-breaking-wildfires-in-ukraine-last-year-scientists-say,0,www.thestar.com.my,"War ignited record-breaking wildfires in Ukraine last year, scientists say","BRUSSELS (Reuters) - Last year was Ukraine's worst year for wildfires in more than three decades of record-keeping, as shelling along front lines in the war with Russia triggered an unprecedented number of blazes, scientists said. Read full story",https://apicms.thestar.com.my/uploads/images/2025/03/26/3235867.jpg,2025-03-26T13:17:00Z,,"BRUSSELS (Reuters) - Last year was Ukraine's worst year for wildfires in more than three decades of record-keeping, as shelling along front lines in the war with Russia triggered an unprecedented num… [+2343 chars]",,en,'forest fire'
https://www.insurancejournal.com/news/southeast/2025/03/26/817282.htm,https://www.insurancejournal.com/news/southeast/2025/03/26/817282.htm,0,www.insurancejournal.com,Crews Battled Helene-Fueled Wildfires for Another Day in the Carolinas,"Firefighters in North and South Carolina were battling multiple wind-driven wildfires Monday in rugged terrain that complicated containment efforts, officials said. Millions of trees knocked down by Hurricane Helene last year combined with long stretches of d…",https://www.insurancejournal.com/app/uploads/2025/03/AP25083684418468.jpg,2025-03-26T13:23:54Z,,"Firefighters in North and South Carolina were battling multiple wind-driven wildfires Monday in rugged terrain that complicated containment efforts, officials said.
Millions of trees knocked down by… [+4058 chars]",,en,'forest fire'
https://www.insurancejournal.com/news/national/2025/03/26/817293.htm,https://www.insurancejournal.com/news/national/2025/03/26/817293.htm,0,www.insurancejournal.com,Catastrophe Experts Tap AI to Tackle Soaring Insured Losses,"Insurers are betting on a suite of new AI-driven techniques to better predict surging losses from climate-driven weather catastrophes ranging from unprecedented wildfires to hurricanes and floods. Less than three months into the year, natural disasters are al…",https://www.insurancejournal.com/app/uploads/2025/03/Palisades-Fire-aftermath-Bloomberg-scaled.jpg,2025-03-26T13:47:23Z,https://web.archive.org/web/20250327153228/https://www.insurancejournal.com/news/national/2025/03/26/817293.htm,"Insurers are betting on a suite of new AI-driven techniques to better predict surging losses from climate-driven weather catastrophes ranging from unprecedented wildfires to hurricanes and floods.
L… [+5506 chars]",,en,'wildfire'
https://thepointsguy.com/news/maui-recovery/,https://thepointsguy.com/news/maui-recovery/,0,thepointsguy.com,Maui is still recovering from the devastating wildfires: Here’s why you should go and how to help,"It’s been a year and a half since devastating fires raged through parts of Maui and killed more than 100 people. During a recent visit, I saw that there has been some progress in cleaning up fire debris in Lahaina, but construction still appears to be a ways …",https://thepointsguy.global.ssl.fastly.net/us/originals/2024/11/20241118_Sheraton-Maui-Resort-and-Spa_CHenderson_133.jpg,2025-03-26T14:30:43Z,https://web.archive.org/web/20250326180138/https://thepointsguy.com/news/maui-recovery/,"It's been a year and a half since devastating fires raged through parts of Maui and killed more than 100 people.
During a recent visit, I saw that there has been some progress in cleaning up fire de… [+7249 chars]",,en,'wildfire'
https://www.nbcnews.com/weather/wildfires/8-million-red-flag-warnings-wildfires-still-rage-carolinas-rcna198156,https://www.nbcnews.com/weather/wildfires/8-million-red-flag-warnings-wildfires-still-rage-carolinas-rcna198156,0,www.nbcnews.com,Over 8 million under red flag warnings as wildfires still rage in the Carolinas,"More than 8 million people are under red flag warnings on Wednesday, as firefighters continue to fight wildfires in the Carolinas.","https://media-cldnry.s-nbcnews.com/image/upload/t_nbcnews-fp-1200-630,f_auto,q_auto:best/rockcms/2025-03/250326-wildfire-ch-0949-563b4e.jpg",2025-03-26T15:01:12Z,https://web.archive.org/web/20250327153000/https://www.nbcnews.com/weather/wildfires/8-million-red-flag-warnings-wildfires-still-rage-carolinas-rcna198156,"More than 8 million people are under red flag warnings on Wednesday, as firefighters continue to fight wildfires in the Carolinas.
In addition to the Carolinas, wildfire risk is spread throughout Vi… [+2663 chars]",,en,'wildfire'
https://www.newser.com/story/366249/south-koreas-wildfires-are-its-deadliest-ever.html,https://www.newser.com/story/366249/south-koreas-wildfires-are-its-deadliest-ever.html,0,www.newser.com,South Korea's Wildfires Are 'Rewriting the Record Books',"Wildfires are infrequent in South Korea—but the ones burning there now in the country's southern regions have been labeled the deadliest ever. The fires, which CNN reports began last Friday from a spark from a lawn mower, have destroyed an ancient temple and …",https://img2-azrcdn.newser.com/image/1600905-12-20250326110417.jpeg,2025-03-26T15:50:49Z,https://web.archive.org/web/20250326163727/http://www.newser.com/story/366249/south-koreas-wildfires-are-its-deadliest-ever.html,"Wildfires are infrequent in South Korea—but the ones burning there now in the country's southern regions have been labeled the deadliest ever. The fires, which CNN reports began last Friday from a sp… [+1467 chars]",,en,'wildfire victims'
https://www.irishtimes.com/world/asia-pacific/2025/03/26/south-korea-wildfires-kill-at-least-24-force-more-than-27000-to-evacuate/,https://www.irishtimes.com/world/asia-pacific/2025/03/26/south-korea-wildfires-kill-at-least-24-force-more-than-27000-to-evacuate/,0,www.irishtimes.com,"South Korea wildfires kill at least 24, force more than 27,000 to evacuate",Pilot killed in firefighting helicopter crash amid battle to contain some of country’s worst forest fires in decades,https://www.irishtimes.com/resizer/v2/RJNXTH57IUTN4E4FQKTTBCARAA.jpg?smart=true&auth=c392c638f8f261d6ae0c21226de89669ef4b8814942b39277cd9d3ce6ea3e67f&width=1200&height=630,2025-03-26T16:11:47Z,,"The death toll in the wildfires raging across South Koreas southeastern region rose to 24 and the pilot of a firefighting helicopter was killed when the aircraft crashed on Wednesday, as the country … [+3463 chars]",,en,'forest fire'
https://www.independent.ie/irish-news/huge-operation-under-way-in-wicklow-to-prepare-for-wildfire-season-as-blazes-become-more-prevalent-and-more-ferocious/a85784600.html,https://www.independent.ie/irish-news/huge-operation-under-way-in-wicklow-to-prepare-for-wildfire-season-as-blazes-become-more-prevalent-and-more-ferocious/a85784600.html,0,www.independent.ie,Huge operation under way in Wicklow to prepare for wildfire season as blazes become ‘more prevalent and more ferocious’,Fire chiefs are warning that the 2025 wildfire season between February and April will be more extensive and longer in duration than in any previous year.,https://focus.independent.ie/thumbor/na9Wz8xqNjEMLz0C3BYcpxzSw7A=/0x17:3187x2141/629x0/prod-mh-ireland/4c39dc6b-a1e6-469a-a951-d2c5503703e5/d06f1968-48e3-4a24-936f-66782410cdd8/4c39dc6b-a1e6-469a-a951-d2c5503703e5.jpg,2025-03-26T16:42:37Z,,"Fire chiefs are warning that the 2025 wildfire season between February and April will be more extensive and longer in duration than in any previous year.Battling the increasing number of fires, which… [+4570 chars]",,en,'wildfire'
https://we-make-money-not-art.com/lament-mourning-ecologies-after-extreme-wildfires/,https://we-make-money-not-art.com/lament-mourning-ecologies-after-extreme-wildfires/,0,we-make-money-not-art.com,Lament: mourning ecologies after extreme wildfires,"The performance and installation explore death from a more-than-human perspective, embracing overlooked stories of transformation in post-wildfire environments",https://we-make-money-not-art.com/wp-content/uploads/2025/03/54398552366_47fc2112ba_h.jpg,2025-03-26T16:46:01Z,,"Australia, Greece, Canada, Spain, Siberia, Portugal, Italy, France, the Amazon, California, etc. Videos of wildfires have been appearing on our screens repeatedly and mercilessly, as we are moving de… [+23124 chars]",,en,'wildfire'
https://www.forbes.com/sites/jenreeder/2025/03/26/shelter-reunites-families-with-pets-displaced-by-la-wildfires/,https://www.forbes.com/sites/jenreeder/2025/03/26/shelter-reunites-families-with-pets-displaced-by-la-wildfires/,0,www.forbes.com,Shelter Reunites Families With Pets Displaced By L.A. Wildfires,"Pasadena Humane took in over 1,500 cats, dogs and other pets displaced by the Eaton Fire that torched Altadena and Pasadena. The team loves reuniting pets and families.","https://imageio.forbes.com/specials-images/imageserve/67e334e8d50f9be7173ecb47/0x0.jpg?format=jpg&crop=1907,1430,x0,y14,safe&height=900&width=1600&fit=bounds",2025-03-26T18:15:16Z,https://web.archive.org/web/20250326182856/https://www.forbes.com/sites/jenreeder/2025/03/26/shelter-reunites-families-with-pets-displaced-by-la-wildfires/,"Pasadena Humane took in over 1,500 pets displaced by the Eaton fire that started the evening of ... More January 7, 2025. Now the shelter staff delights in happy reunions and adoptions.
Courtesy of … [+6688 chars]",,en,'wildfire'
https://www.pbs.org/newshour/world/wildfires-ravaging-southern-south-korea-leave-24-dead-force-thousands-to-evacuate,https://www.pbs.org/newshour/world/wildfires-ravaging-southern-south-korea-leave-24-dead-force-thousands-to-evacuate,0,www.pbs.org,"Wildfires ravaging southern South Korea leave 24 dead, force thousands to evacuate","Wind-driven wildfires that were among South Korea’s worst ever have ravaged the country’s southern regions, killing 24 people, destroying more than 300 structures and forcing 28,800 residents to evacuate, officials said Wednesday.",https://d3i6fh83elv35t.cloudfront.net/static/2025/03/2025-03-26T125737Z_799009690_RC2ZKDA7KPP6_RTRMADP_3_SOUTHKOREA-FIRE-1024x683.jpg,2025-03-26T19:50:30Z,,"SEOUL, South Korea (AP) Wind-driven wildfires that were among South Koreas worst ever have ravaged the countrys southern regions, killing 24 people, destroying more than 300 structures and forcing 28… [+3652 chars]",,en,'wildfire wind'
https://www.fark.com/comments/13611362/Measles-spreading-like-a-forest-fire-As-I-was-a-walking-down-by-lock-As-I-was-walking-one-morning-of-late-Who-did-I-spy-but-my-own-dear-comrade-Wrappd-in-flannel-so-hard-his-fate,https://www.fark.com/comments/13611362/Measles-spreading-like-a-forest-fire-As-I-was-a-walking-down-by-lock-As-I-was-walking-one-morning-of-late-Who-did-I-spy-but-my-own-dear-comrade-Wrappd-in-flannel-so-hard-his-fate,0,www.fark.com,"Measles spreading 'like a forest fire'. ♪ As I was a-walking down by the lock/ As I was walking one morning of late/ Who did I spy but my own dear comrade/ Wrapp'd in flannel, so hard his fate... ♪ [Murica]","Measles spreading 'like a forest fire'. ♪ As I was a-walking down by the lock/ As I was walking one morning of late/ Who did I spy but my own dear comrade/ Wrapp'd in flannel, so hard his fate... ♪",https://usrimg-full.fark.net/2/2v/fark_2vNYkaWo_H7volu2D_bI3u9Ged8.jpg?AWSAccessKeyId=JO3ELGV4BGLFW7Y3EZXN&Expires=1743393600&Signature=mtCkB9w3VGEZLJmb9C5DcSNt2EU%3D,2025-03-26T21:30:02Z,,"ajgeek:What the United States needs right now, more than anything else, is a very deadly virus with a very high R-Value and an incredibly effective vaccine.
/Kill 'em all and let God sort 'em out.
… [+35 chars]",,en,'forest fire'
https://japantoday.com/category/world/south-korea-wildfires-kill-at-least-24-pilot-killed-as-firefighting-helicopter-crashes,https://japantoday.com/category/world/south-korea-wildfires-kill-at-least-24-pilot-killed-as-firefighting-helicopter-crashes,0,japantoday.com,South Korea wildfires kill at least 24; pilot killed as firefighting helicopter crashes,"The death toll in the wildfires raging across South Korea's southeastern region rose to 24 and the pilot of a firefighting helicopter was killed when the aircraft crashed on Wednesday, as the country battles some of its worst forest fires in decades. The dead…",,2025-03-26T21:34:59Z,,"The death toll in the wildfires raging across South Korea's southeastern region rose to 24 and the pilot of a firefighting helicopter was killed when the aircraft crashed on Wednesday, as the country… [+3442 chars]",,en,'wildfire'
https://www.breitbart.com/asia/2025/03/26/massive-south-korean-wildfires-kill-24-inflict-unprecedented-damage/,https://www.breitbart.com/asia/2025/03/26/massive-south-korean-wildfires-kill-24-inflict-unprecedented-damage/,0,www.breitbart.com,"Massive South Korean Wildfires Kill 24, Inflict ‘Unprecedented Damage’","South Korea suffered more than a dozen major wildfires over the weekend. The fires killed 24 people, forced 27,000 to evacuate, and burned more than 17,000 hectares of land.
The post Massive South Korean Wildfires Kill 24, Inflict ‘Unprecedented Damage’ appea…",https://media.breitbart.com/media/2025/03/GettyImages-2206379409-640x335.jpg,2025-03-26T21:45:26Z,https://web.archive.org/web/20250327024004/https://www.breitbart.com/asia/2025/03/26/massive-south-korean-wildfires-kill-24-inflict-unprecedented-damage/,"South Korea suffered more than a dozen major wildfires over the weekend. The fires killed 24 people, forced 27,000 to evacuate, and burned more than 17,000 hectares of land. 
Acting President Han Du… [+3204 chars]",,en,'wildfire'
https://www.ibtimes.com/south-korea-wildfires-largest-record-disaster-chief-3767794,https://www.ibtimes.com/south-korea-wildfires-largest-record-disaster-chief-3767794,0,www.ibtimes.com,South Korea Wildfires 'Largest On Record': Disaster Chief,"Wildfires in South Korea are now ""the largest on record"" having burned more forest than any previous blaze, the country's disaster chief said Thursday, as the death toll rose to 26.",https://d.ibtimes.com/en/full/4589617/smoke-rises-wildfire-andong-early-march-27-2025.jpg,2025-03-27T03:00:18Z,,"Wildfires in South Korea are now ""the largest on record"" having burned more forest than any previous blaze, the country's disaster chief said Thursday, as the death toll rose to 26.
More than a doze… [+3801 chars]",,en,'wildfire weather'
