index,published,keyword,domain,language,valid,title,description,url,image,archive,content,quote,de,en,la,added
647524c30710a50cdfc576319fb796ac,2026-03-08T19:58:53Z,'bushfire',www.abc.net.au,en,0.9,'Amazing' generosity helps bushfire survivors back on their feet,"Paula Jones and Ringo Hansen feared they would be homeless after last year's bushfires, but a NSW Central Coast community ensured that did not happen.",https://www.abc.net.au/news/2026-03-09/koolewong-bushfire-survivors-find-housing/106420124,https://live-production.wcms.abc-cdn.net.au/548f43961fb0b4c6c4b61a8b0be8d2e9?impolicy=wcms_watermark_news&cropH=2813&cropW=5000&xPos=0&yPos=0&width=862&height=485&imformat=generic,,"The morning before a bushfire ripped through the NSW Central Coast suburb of Koolewong in December last year, residents Paula Jones and Ringo Hansen talked about their fire plan.
""We have that discu… [+4478 chars]",,"„Erstaunliche“ Großzügigkeit hilft Überlebenden des Buschfeuers, wieder auf die Beine zu kommen. Paula Jones und Ringo Hansen befürchteten, dass sie nach den Buschbränden im letzten Jahr obdachlos werden würden, doch eine Gemeinde an der Central Coast in New South Wales sorgte dafür, dass dies nicht geschah.","'Amazing' generosity helps bushfire survivors back on their feet. Paula Jones and Ringo Hansen feared they would be homeless after last year's bushfires, but a NSW Central Coast community ensured that did not happen.","'Miris' liberalitas subsidia bushfire superstites reduxit in pedes. Paula Jones et Ringo Hansen veriti sunt ne profugos post anni rubicundiores essent, sed communitas NSW Centralis Coast conservata est ne eveniret.",2026-03-20 20:50:56+00:00
f6f64cfa9b750c880e611e661cb1c5d5,2026-03-13T21:07:07Z,'wildfire health',i-70scout.com,en,0.7,Air Quality Health Advisory for Wildfire Smoke,"Affected Area: Larimer, Weld, Morgan, Logan, Sedgwick, Phillips, Washington, Yuma, Lincoln, Kit Carson, Cheyenne, Crowley, Otero, Kiowa, Bent, Prowers and Baca Counties. Locations include, but are …",https://i-70scout.com/blog/air-quality-health-advisory-for-wildfire-smoke-8/,https://i-70scout.com/blog/wp-content/uploads/2022/02/cropped-Louie-with-Masthead-1-900x450-1.jpg,,"Affected Area
: Larimer, Weld, Morgan, Logan, Sedgwick, Phillips, Washington, Yuma, Lincoln, Kit Carson, Cheyenne, Crowley, Otero, Kiowa, Bent, Prowers and Baca Counties. Locations include, but are … [+1367 chars]",,"Gesundheitshinweis zur Luftqualität bei Waldbrandrauch. Betroffenes Gebiet: Larimer, Weld, Morgan, Logan, Sedgwick, Phillips, Washington, Yuma, Lincoln, Kit Carson, Cheyenne, Crowley, Otero, Kiowa, Bent, Prowers und Baca Counties. Zu den Standorten gehören, sind aber …","Air Quality Health Advisory for Wildfire Smoke. Affected Area: Larimer, Weld, Morgan, Logan, Sedgwick, Phillips, Washington, Yuma, Lincoln, Kit Carson, Cheyenne, Crowley, Otero, Kiowa, Bent, Prowers and Baca Counties. Locations include, but are …","Air Quality Health Advisory for Wildfire Smoke. Area affectata: Larimer, Weld, Morgan, Logan, Sedgwick, Phillips, Washington, Yuma, Lincoln, Kit Carson, Cheyenne, Crowley, Otero, Kiowa, Bent, Prowers et Baca comitatuum. Loca includunt, sed sunt …",2026-03-21 04:47:42+00:00
d4eb961abdb4f5d9d04a4bd6d9c450b9,2026-03-14T21:38:21Z,'wildfire wind',www.pbs.org,en,0.9,"Powerful winds and extreme weather knock out power, damage property and fuel wildfires across parts of U.S.","Hundreds of thousands of people were left without power Saturday after high winds raked eastward from the Great Lakes region. Farther west, at least one person died in a massive wind-driven wildfire in Nebraska.",https://www.pbs.org/newshour/nation/powerful-winds-and-extreme-weather-knock-out-power-damage-property-and-fuel-wildfires-across-parts-of-u-s,https://d3i6fh83elv35t.cloudfront.net/static/2026/03/2026-03-07T193257Z_1292647315_RC2RZJAFTDVU_RTRMADP_3_USA-WEATHER-TORNADO-1024x661.jpg,,"HARRISBURG, Pa. (AP) Hundreds of thousands of people were left without power Saturday after high winds raked eastward from the Great Lakes region, leaving trees down and substantial property damage i… [+3954 chars]",,"Starke Winde und extreme Wetterbedingungen unterbrechen den Strom, beschädigen Eigentum und lösen Waldbrände in Teilen der USA aus. Hunderttausende Menschen blieben am Samstag ohne Strom, nachdem starke Winde aus der Region der Großen Seen nach Osten wehten. Weiter westlich starb bei einem gewaltigen, vom Wind verursachten Waldbrand in Nebraska mindestens eine Person.","Powerful winds and extreme weather knock out power, damage property and fuel wildfires across parts of U.S.. Hundreds of thousands of people were left without power Saturday after high winds raked eastward from the Great Lakes region. Farther west, at least one person died in a massive wind-driven wildfire in Nebraska.","Ventorum potentes et extremae tempestatis vim expellunt, damnum rerum et focorum incendia trans partes US.. Centum milia hominum sine potestate Saturni relicta sunt post magnos ventos ad orientem e regione Magna Lacuum. Ulterior occidens, saltem unus homo in Nebraska ignem ferum vento agitato ingens mortuus est.",2026-03-21 04:47:42+00:00
51b474a2e87d1bc68004c911c67d1a99,2026-03-12T09:52:24Z,'wildfire solidarity',freerepublic.com,en,0.9,Remembering a CIA Coup in Iran That Never Was,"When anti-regime protests spread like wildfire throughout Iran in mid-October of 2022, the regime’s Supreme Leader Ali Khamenei was quick to lay the blame on the usual foreign suspects. “I say explicitly that these riots and this insecurity were a design by t…",https://freerepublic.com/focus/f-news/4370303/posts,,,"Skip to comments.
Remembering a CIA Coup in Iran That Never WasTablet ^
 | March 6, 2023
 | Peter Theroux
Posted on 03/12/2026 2:52:24 AM PDT by ScaniaBoy
When anti-regime protests spread like w… [+2130 chars]",,"Ich erinnere mich an einen CIA-Putsch im Iran, der nie stattgefunden hat. Als sich Mitte Oktober 2022 die Proteste gegen das Regime wie ein Lauffeuer im ganzen Iran ausbreiteten, war der Oberste Führer des Regimes, Ali Khamenei, schnell dabei, die Schuld den üblichen ausländischen Verdächtigen zuzuschieben. „Ich sage ausdrücklich, dass diese Unruhen und diese Unsicherheit eine Absicht von … waren.“","Remembering a CIA Coup in Iran That Never Was. When anti-regime protests spread like wildfire throughout Iran in mid-October of 2022, the regime’s Supreme Leader Ali Khamenei was quick to lay the blame on the usual foreign suspects. “I say explicitly that these riots and this insecurity were a design by t…","CIA Coup in Irania memorare quod numquam fuit. When anti-regime protests spread like wildfire throughout Iran in mid-October of 2022, the regime’s Supreme Leader Ali Khamenei was quick to lay the blame on the usual foreign suspects. Dico diserte has seditiones et hanc suspicionem machinari per t…",2026-03-21 08:51:13+00:00
42073d73a70af045d73da514e1a6e360,2026-03-16T09:46:00Z,'wildfire donation',www.mindbodygreen.com,en,0.3,Why Are Alcohol-Related Deaths Skyrocketing Among Women?,Women fare worse drinking less over a shorter period of time.,https://www.mindbodygreen.com/articles/alcohol-related-deaths-increased-by-35-for-women-whats-going-on-for-latest-stats,"https://mindbodygreen-res.cloudinary.com/image/upload/c_fill,w_2000,h_1200,g_auto,fl_lossy,f_jpg/org/4xzpftq3plc9dmixt.jpg",,"Bottomless brunches have morphed into a hobby, mommy wine culture has spread like wildfire, and after-work happy hours have regained a standing time slot on calendars. These scenes often paint a gigg… [+5882 chars]",,"Warum nehmen alkoholbedingte Todesfälle bei Frauen sprunghaft zu? Frauen schneiden schlechter ab, wenn sie über einen kürzeren Zeitraum weniger trinken.",Why Are Alcohol-Related Deaths Skyrocketing Among Women?. Women fare worse drinking less over a shorter period of time.,Cur Sin Mortes Skyrocketing Inter mulieres? Feminae peius bibentes breviore tempore minus valent.,2026-03-22 08:52:41+00:00
71791a9260278426ae7330a4960ce7a4,2026-03-15T18:00:24Z,'wildfire',abcnews.com,en,0.9,Biggest wildfire in Nebraska history continues to burn out of control,"Three major wildfires, including the largest one in Nebraska history, have burned around 600,000 acres of wildland in rural central and western Nebraska .",https://abcnews.com/US/biggest-wildfire-nebraska-history-continues-burn-control/story?id=131086196,https://i.abcnewsfe.com/a/8e2cc283-f3e3-4eb0-a0ca-de487997cd2d/Nebraska-wildfires-two-hd-bh-260315_1773589696549_hpMain_16x9.jpg?w=1600,,"Three major wildfires, including the largest one in Nebraska history, have burned around 600,000 acres of land in central and western Nebraska and remained 0% contained on Sunday after killing one pe… [+2115 chars]",,"Der größte Waldbrand in der Geschichte Nebraskas gerät weiterhin außer Kontrolle. Drei große Waldbrände, darunter der größte in der Geschichte Nebraskas, haben rund 600.000 Hektar Wildland im ländlichen Zentrum und Westen Nebraskas verbrannt.","Biggest wildfire in Nebraska history continues to burn out of control. Three major wildfires, including the largest one in Nebraska history, have burned around 600,000 acres of wildland in rural central and western Nebraska .","Ignis maximus in Nebraska historia e potestate ardere pergit. Tres incendia incendia maiora, maxima in historia Nebraska, incenderunt circiter 600.000 iugera silvestrium in media rustica et in Nebraska occidentali.",2026-03-22 08:52:41+00:00
675cf48da87ae4d510324c148c8b2e4d,2026-03-18T11:30:56Z,'wildfire relief',consent.yahoo.com,en,0.9,Nebraska football donating spring game ticket sales to wildfire relief,The Nebraska Athletic Department has announced that all ticket proceeds from the spring game will be donated toward wildfire relief within the state.,https://consent.yahoo.com/v2/collectConsent?sessionId=1_cc-session_861c5d21-8634-4c7c-94c2-e64e8053b06a,,,"If you click 'Accept all', we and our partners, including 247 who are part of the IAB Transparency &amp; Consent Framework, will also store and / or access information on a device (in other words, us… [+1046 chars]",,"Nebraska Football spendet Ticketverkäufe für Frühjahrsspiele zur Waldbrandbekämpfung. Das Nebraska Athletic Department hat angekündigt, dass alle Ticketerlöse des Frühlingsspiels für die Waldbrandbekämpfung im Bundesstaat gespendet werden.",Nebraska football donating spring game ticket sales to wildfire relief. The Nebraska Athletic Department has announced that all ticket proceeds from the spring game will be donated toward wildfire relief within the state.,Nebraska eu donando tesseram venationis venationis venditio ad subsidio ferum. Department Athletica Nebraska denuntiavit omnia tessera quae ex venatione verna procedit donata iri subsidio ad ignem ferum in civitate.,2026-03-22 08:52:41+00:00
333d93c4deeeb2484660f96f6a7ead35,2026-03-19T01:20:34Z,'wildfire',www.foxweather.com,en,0.9,One dead as largest wildfire in Nebraska history blazes over 640K acres across state,"Multiple wildfires have burned over 800,000 acres across Nebraska in what Gov. Jim Pillen called one of the worst natural disasters in the state's history.",https://www.foxweather.com/weather-news/largest-wildfire-nebraska-history-one-dead-scorches-640000-acres,https://nypost.com/wp-content/uploads/sites/2/2026/03/largest-wildfire-nebraska-history-leaves-123941248.jpg?quality=75&strip=all&w=1200,,"The single largest wildfire in Nebraska state history has scorched the Cornhusker State, burning over 640,000 acres and killing one as the generational blaze continues to burn.
Across the state, hun… [+5607 chars]",,"Ein Todesopfer beim größten Waldbrand in der Geschichte Nebraskas, der über 640.000 Hektar im ganzen Bundesstaat verwüstet. Mehrere Waldbrände haben in ganz Nebraska über 800.000 Hektar Land verbrannt, was Gouverneur Jim Pillen als eine der schlimmsten Naturkatastrophen in der Geschichte des Staates bezeichnete.","One dead as largest wildfire in Nebraska history blazes over 640K acres across state. Multiple wildfires have burned over 800,000 acres across Nebraska in what Gov. Jim Pillen called one of the worst natural disasters in the state's history.",Ignis feralis mortuus in historia Nebraska super 640K acras civitatis translucens exardescit. Incendia multae ignium super 800.000 iugerum trans Nebraska arserunt in illis quae Gov Jim Pillen vocavit unam calamitates pessimas naturales in historia rei publicae.,2026-03-22 08:52:41+00:00
cfdfc0e328b2f60e5e44f700598604ef,2026-03-20T16:05:24Z,'wildfire',gizmodo.com,en,0.9,It’s the First Day of Spring—but the US West Is Already Bracing for a Brutal Summer,"The combined impact of a historic snow drought, early heat wave, and above-average Pacific Ocean temperatures could fuel a vicious drought and wildfire season.",https://gizmodo.com/its-the-first-day-of-spring-but-the-us-west-is-already-bracing-for-a-brutal-summer-2000736064,https://gizmodo.com/app/uploads/2026/03/hot-day-in-LA-1200x675.jpg,,"Spring officially begins today with the vernal equinox, but the western U.S. is already enduring summerlike temperatures. Numerous cities from the Pacific Coast to the Great Plains are experiencing a… [+5752 chars]",,"Es ist der erste Frühlingstag – aber der Westen der USA bereitet sich bereits auf einen brutalen Sommer vor. Die kombinierten Auswirkungen einer historischen Schneedürre, einer frühen Hitzewelle und überdurchschnittlicher Temperaturen im Pazifischen Ozean könnten eine schlimme Dürre- und Waldbrandsaison auslösen.","It’s the First Day of Spring—but the US West Is Already Bracing for a Brutal Summer. The combined impact of a historic snow drought, early heat wave, and above-average Pacific Ocean temperatures could fuel a vicious drought and wildfire season.","Primus dies Springis est-sed US West Iam Bracing pro aestate Brutal. Ictum historicae nix siccitatis, fluctus primi caloris, et supra mediocris Oceani Pacifici temperaturae vitiosam siccitatem et incendia temporis incendium poterant.",2026-03-22 08:52:41+00:00
0fa2d41577c00ee060c13c1153ef1ee7,2026-03-19T05:18:39Z,'wildfire',www.sciencedaily.com,en,0.7,Wildfires in carbon-rich tropical peatlands hit 2000-year high,"Tropical peatlands, some of the planet’s largest underground carbon stores, are now burning at levels never seen in at least 2,000 years. By analyzing charcoal preserved in peat across multiple continents, scientists discovered that fires had actually been de…",https://www.sciencedaily.com/releases/2026/03/260319005110.htm,https://www.sciencedaily.com/images/1920/wildfire-peatland-fire.webp,,"A new study has found a sharp and unusual rise in wildfires in tropical peatlands during the 20th century, marking a clear departure from long-term historical patterns.Peatlands are massive undergrou… [+2481 chars]",,"Waldbrände in kohlenstoffreichen tropischen Torfmooren erreichen den höchsten Stand seit 2000 Jahren. Tropische Torfmoore, einige der größten unterirdischen Kohlenstoffspeicher der Erde, brennen jetzt in einem Ausmaß wie seit mindestens 2.000 Jahren nicht mehr. Durch die Analyse von in Torf konservierter Holzkohle auf mehreren Kontinenten entdeckten Wissenschaftler, dass Brände tatsächlich entzündet worden waren.","Wildfires in carbon-rich tropical peatlands hit 2000-year high. Tropical peatlands, some of the planet’s largest underground carbon stores, are now burning at levels never seen in at least 2,000 years. By analyzing charcoal preserved in peat across multiple continents, scientists discovered that fires had actually been de…","Ignes in carbonibus divitiis tropicis peatlandis 2000 annos altos feriunt. Peatlandae tropicae, nonnullae maximae planetarum sub terra carbonum thesaurorum, nunc ardent in campestribus, numquam saltem in annis 2,000 visi sunt. Per carbones analysando in gagatem per plures continentes servatos, phisici ignes de ... re vera fuisse deprehensos.",2026-03-22 20:46:01+00:00
74cf3068de5868160c652447ff70e238,2026-03-18T16:00:13Z,'wildfire',www.thetimes.com,en,0.9,American billionaires prepare for 'tax the rich' wildfire...,"As wealth inequality widens in the AI revolution, the super-rich are planning their escape route should political unrest — and taxes — threaten their reserves",https://www.thetimes.com/us/business-us/article/american-billionaires-prepare-for-tax-the-rich-wildfire-l0gsktcf5,https://www.thetimes.com/imageserver/image/%2F0b5ac83f-1a17-49b2-8524-bcf45f8342f7.jpg?crop=1442%2C811%2C158%2C89&resize=1200,,"As wealth inequality widens in the AI revolution, the super-rich are planning their escape route should political unrest — and taxes — threaten their reserves",,"Amerikanische Milliardäre bereiten sich darauf vor, die Reichen zu besteuern. Während die Vermögensungleichheit im Zuge der KI-Revolution zunimmt, planen die Superreichen ihren Fluchtweg für den Fall, dass politische Unruhen – und Steuern – ihre Reserven gefährden","American billionaires prepare for 'tax the rich' wildfire.... As wealth inequality widens in the AI revolution, the super-rich are planning their escape route should political unrest — and taxes — threaten their reserves","American billionaires praeparant ignem divitum tributum.... Ut divitiae inaequalitas in revolutionibus AI dilatatur, super-divites eorum fugam meditantur, ne politica inquietudo et vectigalia subsidiis suis immineant.",2026-03-22 20:46:01+00:00
a7e979eb3b69d413a7b3874665a67693,2026-03-18T18:26:51Z,'wildfire residents',nypost.com,en,0.9,Inside the luxury hotel-branded condos reshaping LA’s skyline — with one approaching $1B in sales,"For tax, security and even wildfire-related reasons, Los Angeles's wealthiest residents are looking to trade sprawling mansions for sky-high condos.",https://nypost.com/2026/03/18/real-estate/luxury-branded-condos-are-reshaping-the-la-skyline/,https://nypost.com/wp-content/uploads/sites/2/2026/03/123914399.jpg?quality=75&strip=all&w=1200,,"Wealthy Angelenos are trading their sprawling mansions for deluxe apartments in the sky.
These days, Los Angeles developers are betting big on a flashy class of multimillion-dollar residences. Tower… [+10345 chars]",,"In den Luxus-Eigentumswohnungen, die mit der Marke eines Hotels versehen sind und die Skyline von L.A. neu gestalten – mit einem Umsatz von nahezu 1 Milliarde US-Dollar. Aus steuerlichen, sicherheitstechnischen und sogar verheerenden Gründen versuchen die wohlhabendsten Einwohner von Los Angeles, weitläufige Villen gegen himmelhohe Eigentumswohnungen einzutauschen.","Inside the luxury hotel-branded condos reshaping LA’s skyline — with one approaching $1B in sales. For tax, security and even wildfire-related reasons, Los Angeles's wealthiest residents are looking to trade sprawling mansions for sky-high condos.","Intra deversorium notati condos reformationi LA's skyline — uno appropinquante $1B in venditionibus. Ad tributum, securitatem et causas etiam ignium relatas, opulentissimi incolae Los Angeles mercaturam sparsae mansiones altae condos caeli spectant.",2026-03-22 20:46:01+00:00
9f91a44ad2ee0f07c07d3b6e4e307711,2026-03-18T20:59:00Z,'wildfire house',www.contemporist.com,en,0.9,"Rebuilding After Fire, This California Home Is Designed to Withstand the Next One","After losing their off-grid home in the 2019 Kincade Fire, the owners of Pine Flat Residence chose to rebuild with a clear goal. Create a house that could endure future wildfire conditions while supporting daily life over time. Set in the hills north-east of …",https://www.contemporist.com/rebuilding-after-fire-this-california-home-is-designed-to-withstand-the-next-one/#article,https://www.contemporist.com/wp-content/uploads/2026/03/modern-house-bedrooms-180326-1143-01.jpg,,"After losing their off-grid home in the 2019 Kincade Fire, the owners of Pine Flat Residence chose to rebuild with a clear goal. Create a house that could endure future wildfire conditions while supp… [+2820 chars]",,"Dieses kalifornische Haus wird nach einem Brand wieder aufgebaut und ist so konzipiert, dass es dem nächsten standhält. Nachdem ihr netzunabhängiges Haus beim Brand von Kincade im Jahr 2019 verloren ging, entschieden sich die Eigentümer der Pine Flat Residence für den Wiederaufbau mit einem klaren Ziel. Schaffen Sie ein Haus, das künftigen Waldbränden standhält und gleichzeitig das tägliche Leben langfristig unterstützt. In den Hügeln nordöstlich von … gelegen","Rebuilding After Fire, This California Home Is Designed to Withstand the Next One. After losing their off-grid home in the 2019 Kincade Fire, the owners of Pine Flat Residence chose to rebuild with a clear goal. Create a house that could endure future wildfire conditions while supporting daily life over time. Set in the hills north-east of …","Reedificatione Post Ignem, Hoc California Domus destinatur sustinere Proximum. Domum suam amissam in anno 2019 Kincade Fire, possessores Residentiae Pineae plana cum meta reficere voluerunt. Facere domum, quae condiciones ignem ferum futuras perpeti potuit dum vitam cotidianam supra tempus sustinens. In collibus a septentrione ad orientem solem ...",2026-03-22 20:46:01+00:00
0309ce8ee9afa35c1efdc75a38a4ce5a,2026-03-06T22:41:01Z,'wildfire insurance',nypost.com,en,0.9,Mayor Karen Bass speaks with Trump on Palisades Fire after calling rebuild plan a ‘political stunt’,"Months after a tense public clash over rebuilding the Pacific Palisades following the devastating 2025 wildfires, Los Angeles Mayor Karen Bass and President Donald Trump have finally broken the silence.",https://nypost.com/2026/03/06/us-news/mayor-karen-bass-speaks-with-trump-on-palisades-fire-after-calling-rebuild-plan-a-political-stunt/,https://nypost.com/wp-content/uploads/sites/2/2026/03/122934012.jpg?quality=75&strip=all&w=1200,,"Los Angeles Mayor Karen Bass and President Donald Trump have finally broken their silence.
Months after a tense public clash over rebuilding the Pacific Palisades following the devastating 2025 wild… [+4121 chars]",,"Bürgermeisterin Karen Bass spricht mit Trump über den Brand von Palisades, nachdem sie den Wiederaufbauplan als „politischen Stunt“ bezeichnet hat. Monate nach einem angespannten öffentlichen Streit um den Wiederaufbau der Pacific Palisades nach den verheerenden Waldbränden im Jahr 2025 haben die Bürgermeisterin von Los Angeles, Karen Bass, und Präsident Donald Trump endlich ihr Schweigen gebrochen.","Mayor Karen Bass speaks with Trump on Palisades Fire after calling rebuild plan a ‘political stunt’. Months after a tense public clash over rebuilding the Pacific Palisades following the devastating 2025 wildfires, Los Angeles Mayor Karen Bass and President Donald Trump have finally broken the silence.","Mayor Karen Bass loquitur cum Trump de Palisade Ignis adhibito consilio reaedificandi quoddam 'stunt politicum'. Menses post tempus publicum armorum in aedificando Pacifici Palisades sequentes incendia vastanda 2025, Los Angeles Major Karen Bass et Praeses Donald Trump silentium tandem ruperunt.",2026-03-23 09:14:18+00:00
7228fd1b7de800248c9f8df9040fc6f1,2026-03-16T17:30:54Z,'wildfire',www.insurancejournal.com,en,0.9,Even Low-Risk Homes Are Caught Up in California’s Climate Insurance Crisis,"As another wildfire season looms, insurance companies have abandoned some California neighborhoods at lower risk of burning, forcing tens of thousands of homeowners to obtain bare-bones coverage from the state’s insurer of last resort. California intended the…",https://www.insurancejournal.com/news/west/2026/03/16/862079.htm,https://www.insurancejournal.com/app/uploads/2026/03/The-Palisades-Fire-in-L.A.-Bloomberg-scaled.jpg,,"As another wildfire season looms, insurance companies have abandoned some California neighborhoods at lower risk of burning, forcing tens of thousands of homeowners to obtain bare-bones coverage from… [+6564 chars]",,"Sogar Häuser mit geringem Risiko sind von der Klimaversicherungskrise in Kalifornien betroffen. Während eine weitere Waldbrandsaison bevorsteht, haben Versicherungsgesellschaften einige kalifornische Viertel mit geringerer Brandgefahr aufgegeben, was Zehntausende Hausbesitzer dazu zwingt, eine Grundversicherung beim staatlichen Versicherer der letzten Instanz abzuschließen. Kalifornien beabsichtigte die…","Even Low-Risk Homes Are Caught Up in California’s Climate Insurance Crisis. As another wildfire season looms, insurance companies have abandoned some California neighborhoods at lower risk of burning, forcing tens of thousands of homeowners to obtain bare-bones coverage from the state’s insurer of last resort. California intended the…","Etiam Low-Risk Homes in Climate Insurance Crisi deprehensi in California sunt. Cum alia incendia temporis conclavia, societates assecurationes aliquas vicinitates Californiae in inferiori periculo incendendi reliquerunt, decem milia homeowners ut ossa nudis coverage e statu insore ultimae auxilii obtineant. California in animo est…",2026-03-23 09:14:18+00:00
