index,published,keyword,domain,language,valid,title,description,url,image,archive,content,quote
b7b6ef3ca5f989295671b67ed8e14678,2025-10-08T19:37:42Z,'wildfire donation',nypost.com,en,0,"Alleged Palisades fire arsonist Jonathan Rinderknecht donated to Joe Biden, was registered to vote in Florida","Rinderknecht is accused of setting a brush fire Jan. 1 that was put out, but then smoldered unnoticed underground for days before igniting the raging Palisades inferno.",https://nypost.com/2025/10/08/us-news/alleged-palisades-fire-arsonist-jonathan-rinderknecht-donated-to-joe-biden-was-registered-to-vote-in-florida/,https://nypost.com/wp-content/uploads/sites/2/2025/10/COMP-GettyImages-1228514991.jpg?quality=75&strip=all&w=1024,,"The Uber driver accused of sparking the most destructive wildfire in Los Angeles history chipped in a small donation to Joe Bidens 2020 presidential campaign, records revealed.
Jonathan Rinderknecht… [+1715 chars]",
9e524191281bb8d5883d595d82234d2b,2025-10-08T19:48:52Z,'wildfire',www.aljazeera.com,en,0,Authorities charge man accused of starting deadly LA wildfire,Police say 29-year-old Jonathan Rinderknecht was behind fire that destroyed much of the Pacific Palisades neighbourhood.,https://www.aljazeera.com/news/2025/10/8/authorities-charge-man-accused-of-starting-deadly-la-wildfire,https://www.aljazeera.com/wp-content/uploads/2025/10/2025-01-12T180928Z_1876707852_RC2G8CA2BYJD_RTRMADP_3_CALIFORNIA-WILDFIRES-1759943329.jpg?resize=1920%2C1440,,"Authorities in California charged a man with starting a fire that days later erupted into the most destructive blaze in Los Angeles history and destroyed much of the Pacific Palisades neighbourhood, … [+2549 chars]",
e2ff9f5dfbfe46f7271ad15e9062ca51,2025-10-08T19:52:36Z,'wildfire',hollywoodlife.com,en,0,‘The Lost Bus’ Movie: Where it Was Filmed & the True Story of Driver Kevin McKay,"Based on California's deadliest wildfire in history, 'The Lost Bus' explores the true story of bus driver Kevin McKay and the brutal Camp Fire that ravaged the town of Paradise.",https://hollywoodlife.com/feature/the-lost-bus-where-it-was-filmed-true-story-kevin-mckay-5476614/,https://hollywoodlife.com/wp-content/uploads/2025/10/The_Lost_Bus_Photo_0103_73438f-e1759949680215.jpeg?fit=3635%2C2054,,"Image Credit: Apple TV+
Californias wildfires have gripped the nation in years. Dry conditions have made it difficult for the West Coast to prevent and contain them. Nine months after a string of in… [+2571 chars]",
1c0c2e8a4d2061a80a4f6631039adf51,2025-10-08T21:30:06Z,'wildfire',japantoday.com,en,0,Authorities charge man with sparking deadly January wildfire that leveled LA neighborhoods,"A 29-year-old man charged with sparking one of the most destructive blazes in California history likely used a lighter to start a fire on New Year’s Day that smoldered underground and reignited almost a week later, killing 12 people in wealthy Los Angeles-are…",https://japantoday.com/category/world/authorities-to-announce-%27significant-development%27-in-probe-of-california%E2%80%99s-palisades-fire,,,A 29-year-old man charged with sparking one of the most destructive blazes in California history likely used a lighter to start a fire on New Years Day that smoldered underground and reignited almost… [+4621 chars],
e7b7a4ffe38ad2598e5751b8290e03ae,2025-10-09T00:09:05Z,'wildfire evacuation',www.cbc.ca,en,0,Lake George wildfire evacuees cleared to return home soon,Natural Resources announced on Wednesday evening that the fire is being held and that the evacuation zone is considered low risk. Residents will be able to start heading home in a phased approach on Thursday.,https://www.cbc.ca/news/canada/nova-scotia/lake-george-wildfire-evacuees-able-to-return-home-soon-9.6932536,"https://i.cbc.ca/ais/9c7e7918-cc6a-489c-aa6e-4bf3415eb61b,1759967503796/full/max/0/default.jpg?im=Crop%2Crect%3D%280%2C0%2C1180%2C663%29%3BResize%3D620",,"Everyone who had to leave their home because of the Lake George wildfire will be able to return home on Thursday, after the province announced the fire had been ""held"" as of Wednesday evening.
Held … [+1531 chars]",
b981c4c027acc87d3b17fca35525b905,2025-10-09T00:44:07Z,'wildfire',freerepublic.com,en,0,"Alleged Palisades fire arsonist Jonathan Rinderknecht donated to Joe Biden, was registered to vote in Florida","“The alleged pyromaniac accused of igniting the deadly Palisades Fire – Los Angeles’ most destructive wildfire – chipped in a tiny donation to Joe Biden’s 2020 presidential campaign, records show. Jonathan Rinderknecht, 29, shelled out $2 to hybrid PAC ActBlu…",https://freerepublic.com/focus/f-news/4345155/posts,,,"Skip to comments.
Alleged Palisades fire arsonist Jonathan Rinderknecht donated to Joe Biden, was registered to vote in FloridaMSN ^
 | 10/08/25
 | Anna Young
Posted on 10/08/2025 5:44:07 PM PDT … [+1565 chars]",
9bfbf46806d9f4cb4b843b5003518956,2025-10-09T03:59:58Z,'wildfire',economictimes.indiatimes.com,en,0,Who is Jonathan Rinderknecht? Man charged with sparking most destructive wildfire in LA's history; fire department reveals reason behind slowed response to blaze,"A Florida man, Jonathan Rinderknecht, has been charged with starting California's destructive Palisades Fire on New Year's Day. The blaze, initially a smoldering underground fire, reignited days later, causing significant damage and fatalities. Rinderknecht a…",https://economictimes.indiatimes.com/news/international/us/who-is-jonathan-rinderknecht-man-charged-with-sparking-most-destructive-wildfire-in-las-history-fire-department-reveals-reason-behind-slowed-response-to-blaze/articleshow/124404131.cms,"https://img.etimg.com/thumb/msid-124404204,width-1200,height-630,imgsize-116890,overlay-economictimes/articleshow.jpg",,"A 29-year-old man has been charged with sparking Californias deadly Palisades Fire, one of the most destructive wildfires in its history, authorities said Wednesday. The suspect was identified as Jon… [+4710 chars]",
75c1ca026fbc6c4381802ad2e9567ba8,2025-10-09T05:23:00Z,'bushfire',www.abc.net.au,en,0,Almost 350 rapid-response fire trucks grounded in Victoria due to faults,"Hundreds of rapid-response fire vehicles are off the road ahead of bushfire season, prompting fears local brigades will have to pick up the slack.",https://www.abc.net.au/news/2025-10-09/story-forest-fire-management-vehicles-faults-bushfires/105869610,https://live-production.wcms.abc-cdn.net.au/c583b1026eede43ee4eca0e48c34c6e8?impolicy=wcms_watermark_news&cropH=450&cropW=800&xPos=0&yPos=111&width=862&height=485&imformat=generic,,"Country firefighters fear the withdrawal of hundreds of firefighting vehicles from service on the eve of the bushfire season will put extra pressure on local brigades.
Forest Fire Management Victori… [+4328 chars]",
533920e24bf4ce93947ceb3183054482,2025-10-09T07:56:11Z,'wildfire',www.insurancejournal.com,en,0,French Wine Output to Fall Below 2024 After Fires Ravage Vines,"France further cut its estimate for this year’s wine production, putting output below 2024’s historically low level, after summer heat waves and wildfires hit vineyards. With the grape harvest nearly complete, output is now seen at 36 million hectoliters, the…",https://www.insurancejournal.com/news/international/2025/10/09/843086.htm,https://www.insurancejournal.com/app/uploads/2025/10/burned-grape-vines-after-wildfire-in-france-bloomberg-scaled.jpg,,"France further cut its estimate for this year’s wine production, putting output below 2024’s historically low level, after summer heat waves and wildfires hit vineyards.
With the grape harvest nearl… [+1147 chars]",
34967d32386ac25c1459639b58039076,2025-10-09T12:48:04Z,'wildfire climate change',www.insurancejournal.com,en,0,World Is Far More Ablaze Now With Damaging Fires Than in 1980s: Study,"Earth’s nastiest and costliest wildfires are blazing four times more often now than they did in the 1980s because of human-caused climate change and people moving closer to wildlands, a new study found. A study in the journal Science looks …",https://www.insurancejournal.com/news/national/2025/10/09/842846.htm,https://www.insurancejournal.com/app/uploads/2025/10/Wildfire-Lahaina-Hawaii-AP-scaled.jpg,,"Earth’s nastiest and costliest wildfires are blazing four times more often now than they did in the 1980s because of human-caused climate change and people moving closer to wildlands, a new study fou… [+5187 chars]",
270de797692a166a634557df4e81197d,2025-10-09T13:40:18Z,'wildfire climate change',dailycaller.com,en,0,DUKE: California’s Leaders Lit The Match Long Before The Deranged Pyromaniac Did,Ten months after Los Angeles was hit by a deadly wildfire — which nearly every Democrat blamed on climate change — a suspect has been arrested for arson.,https://dailycaller.com/2025/10/09/duke-california-fire-mismanagement-pyromaniac-los-angeles-wildfires/,"https://images.dailycaller.com/image/width=1280,height=549,fit=cover,format=webp,f=auto/https://cdn01.dailycaller.com/wp-content/uploads/2025/10/GettyImages-2192412208-scaled-e1760016545920.jpg",,"Hey y’all, welcome back to Unfit to Print. 
We have a short edition today as I am traveling out of town for the weekend, but this story is just too crazy not to bring to your attention. 
Don’t forg… [+2601 chars]",
96a7b031550ed27c1e1578d5c1fae929,2025-10-09T17:10:02Z,'wildfire',people.com,en,0,What We Know About Jonathan Rinderknecht and His Alleged Connection to the Deadly Palisades Fire,"California authorities announced on Oct. 8 that the Melbourne, Fla., resident had been arrested in connection with one of the most destructive wildfires in...",https://people.com/who-is-jonathan-rinderknecht-palisades-fire-11827203,https://s.yimg.com/ny/api/res/1.2/fcrzM2XMRXwBnpfK4qC9HA--/YXBwaWQ9aGlnaGxhbmRlcjt3PTEyMDA7aD04MDA7Y2Y9d2VicA--/https://media.zenfs.com/en/people_218/e5919fb7d7b345e34bdd1d8b418bec03,,"NEED TO KNOW
<ul><li>The Palisades Fire started on Jan. 7, 2025, and became one of the deadliest wildfires in California's history
</li><li>Over nine months later, Jonathan Rinderknecht was arreste… [+6285 chars]",
b4f6e28a742d82ee5a0f25af2e64ab05,2025-10-09T17:24:57Z,'wildfire house',nypost.com,en,0,Alleged LA Palisades firebug Jonathan Rinderknecht threatened to burn down sister’s house before arrest: feds,"The disturbing revelations came during a Thursday morning court hearing for Jonathan Rinderknecht, 29, accused of igniting the most expensive wildfire in U.S. history.",https://nypost.com/2025/10/09/us-news/alleged-la-palisades-firebug-jonathan-rinderknecht-threatened-burn-down-sisters-house-before-arrest/,https://nypost.com/wp-content/uploads/sites/2/2025/10/COMP-G2wAORYbMAACw-s-2.jpg?quality=75&strip=all&w=1024,,"MELBOURNE, Florida The alleged firebug accused of starting the Palisades blaze threatened to burn down his sisters house and shoot his brother-in-law while their kids were inside, authorities said.
… [+2132 chars]",
a7f314a7aa95c7bd80459da621893080,2025-10-09T20:12:27Z,'wildfire evacuation',www.cbc.ca,en,0,Manitoba wildfire first responders inducted into Order of the Buffalo Hunt,"One of Manitoba's highest honours, the Order of the Buffalo Hunt, has been bestowed upon the first responders who navigated one of the worst wildfire seasons in recent memory.",https://www.cbc.ca/news/canada/manitoba/wildfire-first-responders-order-buffalo-hunt-9.6933481,"https://i.cbc.ca/ais/1f89dc51-09f4-4a8c-8dbd-a2bd004b2278,1760040228464/full/max/0/default.jpg?im=Crop%2Crect%3D%280%2C125%2C1180%2C663%29%3BResize%3D620",,"One of Manitoba's highest honours has been bestowed upon the first responders who navigated one of the province's worst wildfire seasons in recent memory.
""It's a room full of heroes. I hope that yo… [+2856 chars]",
7ef0d52cbfc0393662c4b5b99001ea97,2025-10-09T21:24:13Z,'wildfire',nypost.com,en,0,LAFD probe into disastrous Palisades fire response ignores feds’ claim deadly inferno began with missed blaze,"On Wednesday, federal investigators claimed the worst wildfire in California history likely came from a previous blaze, the Lachman Fire.",https://nypost.com/2025/10/09/us-news/lafd-probe-into-disastrous-palisades-fire-response-ignores-feds-claim-deadly-inferno-began-with-missed-blaze/,https://nypost.com/wp-content/uploads/sites/2/2025/10/COMP-GettyImages-2192407443.jpg?quality=75&strip=all&w=1024,,"The Los Angeles Fire Department finally released its internal investigation of the chaotic and short-handed response to the Palisades Fire but failed to address the causes of the blaze, including new… [+2931 chars]",
4782155a2dadbc7d21b58aa912387b76,2025-10-09T21:44:10Z,'wildfire evacuation',www.kpbs.org,en,0,Ramona wildfire prompts evacuations,The Rancho Fire is burning near Highway 78 and Casner Road. Evacuations have been ordered.,https://www.kpbs.org/news/public-safety/2025/10/09/ramona-wildfire-prompts-evacuations,https://cdn.kpbs.org/dims4/default/e15a07b/2147483647/strip/true/crop/1355x711+0+29/resize/1200x630!/quality/90/?url=http%3A%2F%2Fkpbs-brightspot.s3.us-west-2.amazonaws.com%2F7a%2Fcc%2F33b7d106472198fd8103a95dd3e3%2Fimage.jpg,,"Crews are responding to a wildfire near Ramona in North County. The Rancho Fire is burning along Highway 78 and Casner Road. Evacuations are underway.
Rancho Fire
The fire, now dubbed the Rancho Fi… [+548 chars]",
8637e55ac1d18d06ffb8bd64d2bf35b6,2025-10-09T22:51:00Z,'wildfire',biztoc.com,en,0,LA Mayor Seeks to Halt ‘Mansion Tax’ for Wildfire Victims,,https://biztoc.com/x/5dc1a7816d6db60b,https://biztoc.com/cdn/5dc1a7816d6db60b_s.webp,,"{ window.open(this.href, '_blank'); }, 200); return false;""&gt;Why was former UK PM Sunak appointed Microsoft adviser? { window.open(this.href, '_blank'); }, 200); return false;""&gt;How did Delta's l… [+766 chars]",
3304faba9bae92e7a1a879b9ce3b0da5,2025-10-10T14:29:42Z,'wildfire',thoughtcatalog.com,en,0,ChatGPT Image Helps Catch Suspect In The Deadly Pacific Palisades Fire – A Landmark First For AI In Criminal Evidence,"In what may be the first arrest of its kind, the arrest of a suspect in California’s most destructive wildfire may rest, in part, on the words and images he gave to artificial intelligence. On Wedn…",https://thoughtcatalog.com/erinwhitten/2025/10/chatgpt-image-helps-catch-suspect-in-the-deadly-pacific-palisades-fire-a-landmark-first-for-ai-in-criminal-evidence/,https://thoughtcatalog.com/wp-content/uploads/2025/10/Untitled-design-30.remini-enhanced.jpg?w=1536&h=768&crop=1,,"In what may be the first arrest of its kind, the arrest of a suspect in Californias most destructive wildfire may rest, in part, on the words and images he gave to artificial intelligence. On Wednesd… [+5668 chars]",
87cc97701f67ce8c513cf63be054a6fe,2025-10-10T16:46:22Z,'wildfire',www.breitbart.com,en,0,Deputy Mayor Absent During CA Wildfires Because He Called In Fake Bomb Threat Gets Probation,"The L.A. deputy mayor whose job overseeing the fire department was left empty prior to the deadly Palisades wildfire because he had been suspended has been sentenced to a year’s probation.
The post Deputy Mayor Absent During CA Wildfires Because He Called In …",https://www.breitbart.com/crime/2025/10/10/deputy-mayor-absent-during-ca-wildfires-because-he-called-fake-bomb-threat-receives-light-sentence/,https://media.breitbart.com/media/2025/10/Brian-K.-Williams-640x335.jpg,,The Los Angeles deputy mayor whose job overseeing the fire department was left empty prior to the deadly Palisades wildfire — because hed been suspended for calling in a phony bomb threat — was sente… [+3996 chars],
1e40e60fa1417346dee3d28b4983a6e4,2025-10-10T16:57:38Z,'wildfire',www.livescience.com,en,0,Extreme weather caused more than $100 billion in damage by June — smashing US records,"After damaging wildfires in LA, tornadoes and series of floods, the first six months of this year smashed multiple extreme weather records in the U.S., data show — and experts say this trend is likely to continue.",https://www.livescience.com/planet-earth/climate-change/extreme-weather-caused-more-than-usd100-billion-in-damage-by-june-smashing-us-records,https://cdn.mos.cms.futurecdn.net/dtw6DHtdBLcXriBPzWZUEF-1920-80.jpg,,"The first half of 2025 logged the most damaging extreme weather on record in terms of cost, even after accounting for inflation, data shows.
This is partly because of a handful of extraordinary even… [+12427 chars]",
50bc40eaa9da1e0b647af4536e8a0b36,2025-10-10T19:54:09Z,'bushfire',www.abc.net.au,en,0,Chaotic weather outlook raises prospects of summer bushfires across east,"An atmospheric 'tug of war' is taking place this spring for control of Australia's weather, and it is a forecasting nightmare.",https://www.abc.net.au/news/2025-10-11/chaotic-australia-weather-outlook-a-forecasting-nightmare/105878032,https://live-production.wcms.abc-cdn.net.au/14d3ccc1d57847ebab336d787988d367?impolicy=wcms_watermark_news&cropH=845&cropW=1502&xPos=0&yPos=83&width=862&height=485&imformat=generic,,"An atmospheric 'tug of war' is taking place this spring for control of Australia's weather, and it is a forecasting nightmare.
On the one hand, one of the strongest negative Indian Ocean Dipoles (IO… [+6437 chars]",
c8449d6ef2ba91c608d86aee42168bc3,2025-10-10T20:14:14Z,'wildfire military',www.cbc.ca,en,0,"Military continues to battle wildfires at CFB Gagetown, no risk to nearby communities",The military is continuing to fight wildfires within Canadian Forces Base Gagetown.,https://www.cbc.ca/news/canada/new-brunswick/cfb-gagetown-wildfire-9.6935213,"https://i.cbc.ca/ais/0fed1ce6-9b32-488f-80a2-32cd84c516d4,1760126536200/full/max/0/default.jpg?im=Crop%2Crect%3D%280%2C0%2C1920%2C1080%29%3BResize%3D620",,"The military is continuing to fight wildfires within Canadian Forces Base Gagetown.
A release on Thursday said there is currently no risk to nearby communities or Department of National Defence faci… [+1091 chars]",
e8722bb0859b6370032a78845b5caa21,2025-10-11T00:33:01Z,'wildfire',www.kpbs.org,en,0,Researchers link wildfire smoke to hundreds of excess deaths each year in San Diego County by 2050,"California could see 4,500 more deaths a year than today and San Diego County could see hundreds more deaths each year.",https://www.kpbs.org/news/environment/2025/10/10/researchers-link-wildfire-smoke-to-hundreds-of-excess-deaths-each-year-in-san-diego-county-by-2050,https://cdn.kpbs.org/dims4/default/72c3f4a/2147483647/strip/true/crop/5184x2722+0+734/resize/1200x630!/quality/90/?url=http%3A%2F%2Fkpbs-brightspot.s3.us-west-2.amazonaws.com%2Fimg%2Fphotos%2F2020%2F09%2F15%2F01.jpg,,"New data show that San Diego County has among the lowest levels of annual wildfire smoke exposure compared to other counties in California.
San Diego, in some sense, is in a lucky spot, said Marshal… [+5628 chars]",
2bd48f25bef9e4ff7905c1c09e870805,2025-10-11T04:26:42Z,'wildfire',economictimes.indiatimes.com,en,0,"Top movies you can’t miss streaming this weekend, from fire-breathing dragons to sinister Werewolves, which one will you binge first?","This weekend brings exciting new movies across streaming platforms. Discover a live-action ""How to Train Your Dragon"" on Peacock. Prime Video features a John Candy documentary and a modern ""You've Got Mail"" style romance. Apple TV+ presents a wildfire surviva…",https://economictimes.indiatimes.com/news/international/us/top-movies-you-cant-miss-streaming-this-weekend-from-fire-breathing-dragons-to-sinister-werewolves-which-one-will-you-binge-first/articleshow/124469801.cms,"https://img.etimg.com/thumb/msid-124469803,width-1200,height-630,imgsize-24540,overlay-economictimes/articleshow.jpg",,"Werewolves, dragons, and monsters are making their seasonal debut, but the real surprises come in unexpected places, like women mechanics taking charge. Whether youre in the mood for blockbuster adve… [+3077 chars]",
fba4e386e565af25863d291a1fa1fd8b,2025-10-11T05:39:56Z,'wildfire',www.yahoo.com,en,0,Questions loom over Albania's forests after devastating fires,"As Albania recovers from a summer of devastating wildfires, locals and experts are eyeing a long road back to save its shrinking forests from intensifying...",https://www.yahoo.com/news/articles/questions-loom-over-albanias-forests-053956384.html,https://media.zenfs.com/en/afp.com/181355d87b1a72ff28abe85755e9de65,,"As Albania recovers from a summer of devastating wildfires, locals and experts are eyeing a long road back to save its shrinking forests from intensifying disasters.
In some of the worst blazes to e… [+3959 chars]",
6060f174aca5caac329d6ebe36a366fc,2025-10-11T14:00:25Z,'wildfire',legalinsurrection.com,en,0,Death Penalty May Be on the Table for Man Charged in Palisades Wildfire,"Gov. Gavin Newsom is forced to shift the blame from climate change to....""Florida Man"".
The post Death Penalty May Be on the Table for Man Charged in Palisades Wildfire first appeared on Le·gal In·sur·rec·tion.",https://legalinsurrection.com/2025/10/death-penalty-may-be-on-the-table-for-man-charged-in-palisades-wildfire/,https://legalinsurrection.com/wp-content/uploads/2025/10/Jonathan-Rinderknecht-Palisades-Fire.jpg,,"A few days ago, my colleague Mary Chastain reported that authorities have arrested Jonathan Rinderknecht, 29, for allegedly starting a fire that turned into the Palisades Fire in Los Angeles, CA.
Ri… [+4024 chars]",
d5c1ffb309fee3b76f714ecd2beebd90,2025-10-12T14:06:58Z,'wildfire',www.cbc.ca,en,0,What have Manitoba leaders learned from a summer of wildfire evacuations?,Governments and non-profit groups are taking time to review this year's wildfire season and the unprecedented challenges posed by evacuating tens of thousands of people across wide swaths of the country.,https://www.cbc.ca/news/canada/manitoba/manitoba-wildfire-season-lessons-9.6936275,"https://i.cbc.ca/ais/c5071233-aec7-476e-9306-e5c6b295889c,1760273405661/full/max/0/default.jpg?im=Crop%2Crect%3D%280%2C0%2C1180%2C663%29%3BResize%3D620",,Governments and non-profit groups are taking time to review this year's wildfire season and the unprecedented challenges posed by evacuating tens of thousands of people across wide swaths of the coun… [+4722 chars],
8a3aa50f8f0b08a6c257cf3e6a3f0b97,2025-10-12T16:30:30Z,'wildfire',www.cbc.ca,en,0,Lake George wildfire under control,"The Lake George wildfire, burning since the end of September, is now considered under control.",https://www.cbc.ca/news/canada/nova-scotia/lake-george-wildfire-under-control-9.6936374,"https://i.cbc.ca/ais/1.7647901,1759322702000/full/max/0/default.jpg?im=Crop%2Crect%3D%280%2C46%2C2048%2C1152%29%3BResize%3D620",,"The Lake George wildfire, burning since the end of September, is now considered under control.
In a social media post Saturday,
 Nova Scotias Department of Natural Resources said it doesn't anticip… [+467 chars]",
0845eeb0a62b9ae95b8d03ec37589238,2025-10-12T23:50:40Z,'wildfire buildings',dailycaller.com,en,0,STEVE MILLOY: Arsonist Burns Down Climate Hoax,The arrest this week of a suspect for starting the fire that led to last January’s deadly Palisades wildfire in Los Angeles came as no real surprise.,https://dailycaller.com/2025/10/12/opinion-arsonist-burns-down-the-climate-hoax-steve-milloy/,"https://images.dailycaller.com/image/width=1280,height=549,fit=cover,format=webp,f=auto/https://cdn01.dailycaller.com/wp-content/uploads/2025/09/GettyImages-2192342554-scaled-e1756909332698.jpg",,"The arrest this week of a suspect for starting the fire that led to last January’s deadly Palisades wildfire in Los Angeles came as no real surprise.
Arson was hinted at as early as February. People… [+3815 chars]",
676e1020d28e6e3aca2a77aadd6aa983,2025-10-13T09:29:47Z,'forest fire',en.antaranews.com,en,0,Indonesia ends 2025 forest fire operations as risk subsides,"Forestry Minister Raja Juli Antoni announced that Indonesia&rsquo;s 2025 forest and land fire control operations have officially concluded, though authorities ...",https://en.antaranews.com/news/385845/indonesia-ends-2025-forest-fire-operations-as-risk-subsides,https://cdn.antaranews.com/cache/1200x800/2025/10/13/WhatsApp-Image-2025-10-13-at-14.37.05.jpeg,,"Jakarta (ANTARA) - Forestry Minister Raja Juli Antoni announced that Indonesia’s 2025 forest and land fire control operations have officially concluded, though authorities remain on alert in several … [+1889 chars]",
de4518c7c27eced18f8db21eec3a54bf,2025-10-13T11:26:47Z,'wildfire',financialpost.com,en,0,The Worst Kinds of Wildfires Are Becoming More Frequent,"Nearly half of the costliest fires around the world since 1980 happened over the past decade, according to new research.",https://financialpost.com/pmn/business-pmn/the-worst-kinds-of-wildfires-are-becoming-more-frequent,https://smartcdn.gprod.postmedia.digital/financialpost/wp-content/uploads/2025/10/number-of-billion-dollar-events.jpg,,"(Bloomberg) Wildfire disasters are becoming more frequent and severe globally, costing more human lives and racking up more economic damage than in previous decades, according to a new study by the U… [+4606 chars]",
d2e552bff10a6977a388a4c0878c304b,2025-10-13T15:40:00Z,'wildfire insurance',www.newser.com,en,0,New California Law Eases Homeowner Burden After a Fire,"A new law in California will make it easier for homeowners who lost everything in a wildfire to get money from their insurance company. Starting next year, insurers in the state will be required to pay out at least 60% of a homeowner's personal-property cover…",https://www.newser.com/story/376730/new-california-law-eases-homeowner-burden-after-a-fire.html,https://img2-azrcdn.newser.com/image/1639729-12-20251013110002.jpeg,,"A new law in California will make it easier for homeowners who lost everything in a wildfire to get money from their insurance company. Starting next year, insurers in the state will be required to p… [+1129 chars]",
