index,url,valid,domain,title,description,image,published,archive,content,quote,language,keyword
https://timesofindia.indiatimes.com/home/sunday-times/all-that-matters/we-are-living-in-a-world-on-fire-and-not-just-literally-because-of-climate-change/articleshow/119050862.cms,https://timesofindia.indiatimes.com/home/sunday-times/all-that-matters/we-are-living-in-a-world-on-fire-and-not-just-literally-because-of-climate-change/articleshow/119050862.cms,0,timesofindia.indiatimes.com,We are living in a world on fire and not just literally because of climate change,"Pico Iyer's memoir 'Aflame: Learning From Silence' recounts his refuge in a Benedictine monastery after losing everything in a wildfire. Describing the transformative power of solitude and silence, Iyer reflects on his experiences and the significance of inne…","https://static.toiimg.com/thumb/msid-119051450,width-1070,height-580,imgsize-1158865,resizemode-75,overlay-toi_sw,pt-32,y_pad-40/photo.jpg",2025-03-15T17:14:08Z,https://web.archive.org/web/20250317040533/https://timesofindia.indiatimes.com/home/sunday-times/all-that-matters/we-are-living-in-a-world-on-fire-and-not-just-literally-because-of-climate-change/articleshow/119050862.cms,"<ul><li>News</li>
<li>We are living in a world on fire and not just literally because of climate change</li></ul>
Pico Iyer's memoir 'Aflame: Learning From Silence' recounts his refuge in a Benedic… [+236 chars]",,en,'wildfire'
https://www.fox6now.com/news/wisconsin-wildfire-risk-check-conditions-before-burn,https://www.fox6now.com/news/wisconsin-wildfire-risk-check-conditions-before-burn,0,www.fox6now.com,"Wisconsin wildfire risk, check conditions before you burn","Spring wildfire season is here, and the Wisconsin Department of Natural Resources (DNR) is urging the public to check fire danger before conducting outdoor burning activities.",https://images.foxtv.com/static.fox6now.com/www.fox6now.com/content/uploads/2025/01/1280/720/9p-california-fires-local-angle-pkg_00.01.13.50.jpg?ve=1&tl=1,2025-03-15T17:36:11Z,,"MADISON, Wis. - Spring wildfire season is here, and the Wisconsin Department of Natural Resources (DNR) is urging the public to check fire danger before conducting outdoor burning activities.
Accord… [+2927 chars]",,en,'wildfire'
https://www.abc.net.au/news/2025-03-16/firefighters-battle-montrose-kilsyth-blaze/105057526,https://www.abc.net.au/news/2025-03-16/firefighters-battle-montrose-kilsyth-blaze/105057526,0,www.abc.net.au,Residents on alert after bushfire rages in Melbourne's east overnight,Multiple warnings are issued for an out-of-control bushfire after residents are urged to take shelter near Mount Dandenong in Melbourne's outer east.,https://live-production.wcms.abc-cdn.net.au/472e5b962400fc8a428ce197486e975e?impolicy=wcms_watermark_news&cropH=1080&cropW=1920&xPos=0&yPos=0&width=862&height=485&imformat=generic,2025-03-15T21:41:31Z,https://web.archive.org/web/20250315223601/https://www.abc.net.au/news/2025-03-16/firefighters-battle-montrose-kilsyth-blaze/105057526,"One house has been lost in an out-of-control bushfire in Melbourne's outer-east overnight.
Authorities say they've slowed the spread of the blaze in Montrose and Kilsyth, near Mount Dandenong, after… [+1256 chars]",,en,'bushfire'
https://7news.com.au/news/at-least-one-home-destroyed-and-another-damaged-as-bushfire-continues-to-rage-in-melbournes-east-c-18054561,https://7news.com.au/news/at-least-one-home-destroyed-and-another-damaged-as-bushfire-continues-to-rage-in-melbournes-east-c-18054561,0,7news.com.au,At least one home destroyed and another damaged as bushfire continues to rage in Melbourne’s east,"More than 100 firefighters, four helicopter water bombers, and two bulldozers have been dispatched to battle the blaze.",https://images.7news.com.au/publication/C-18054561/7e67e0c4f1d4a1d8f455f7e68357d3f5f5f28bd3-16x9-x0y2w1280h720.png?imwidth=1200,2025-03-15T23:33:41Z,,"At least one home has been destroyed, and another has suffered damage as a bushfire continues to rage out of control in Melbournes east.
The fire broke out at Dr Ken Leversha Reserve in Montrose abo… [+1521 chars]",,en,'bushfire'
https://thehillstimes.in/international/threat-of-tornadoes-moves-to-us-south-after-big-storm-unleashes-winds-fans-wildfires,https://thehillstimes.in/international/threat-of-tornadoes-moves-to-us-south-after-big-storm-unleashes-winds-fans-wildfires,0,thehillstimes.in,"Threat of tornadoes moves to US South after big storm unleashes winds, fans wildfires","OKLAHOMA CITY, March 15: The threat of tornadoes moved east into the Mississippi Valley and Deep South on Saturday, a day after a massive storm system moving across the country unleashed winds that damaged buildings, whipped up dust storms that caused deadly …",https://thehillstimes.in/wp-content/uploads/2025/03/New-Project8-37.jpg,2025-03-15T23:35:00Z,,"OKLAHOMA CITY, March 15: The threat of tornadoes moved east into the Mississippi Valley and Deep South on Saturday, a day after a massive storm system moving across the country unleashed winds that d… [+5488 chars]",,en,'wildfire damage'
https://www.thestar.com.my/news/world/2025/03/16/australia039s-new-south-wales-sweats-through-heatwave-faces-039extreme039-bushfire-risk,https://www.thestar.com.my/news/world/2025/03/16/australia039s-new-south-wales-sweats-through-heatwave-faces-039extreme039-bushfire-risk,0,www.thestar.com.my,"Australia's New South Wales sweats through heatwave, faces 'extreme' bushfire risk",SYDNEY (Reuters) - Australia's New South Wales on Sunday sweated in a heat wave that raised the risk of bushfires and prompted authorities to issue a total fire ban for state capital Sydney. Read full story,https://cdn.thestar.com.my/Themes/img/newTsol_logo_socmedia.png,2025-03-15T23:37:00Z,https://web.archive.org/web/20250319123533/https://www.thestar.com.my/news/world/2025/03/16/australia039s-new-south-wales-sweats-through-heatwave-faces-039extreme039-bushfire-risk,"SYDNEY (Reuters) - Australia's New South Wales on Sunday sweated in a heat wave that raised the risk of bushfires and prompted authorities to issue a total fire ban for state capital Sydney.
New Sou… [+1498 chars]",,en,'bushfire'
https://www.abc.net.au/news/2025-03-16/us-tornadoes-kill-at-least-26/105057560,https://www.abc.net.au/news/2025-03-16/us-tornadoes-kill-at-least-26/105057560,0,www.abc.net.au,At least 26 killed by storms and tornadoes in US as extreme weather threatens millions,"A massive storm system moving across the country has triggered deadly dust storms, tornadoes and fanned more than 100 wildfires.",https://live-production.wcms.abc-cdn.net.au/3d14dea12af6fc94be027526bc35529e?impolicy=wcms_watermark_news&cropH=2268&cropW=4032&xPos=0&yPos=378&width=862&height=485&imformat=generic,2025-03-15T23:52:39Z,,"At least 26 people have been killed by tornadoes and storms in the United States as whipping winds moved east into the Mississippi Valley and Deep South.
A massive storm system across the country ha… [+3888 chars]",,en,'wildfire weather'
https://www.usatoday.com/story/news/nation/2025/03/15/texas-fredericksburg-wildfires/82453453007/,https://www.usatoday.com/story/news/nation/2025/03/15/texas-fredericksburg-wildfires/82453453007/,0,www.usatoday.com,"Wildfires, including one near Fredericksburg, rage through thousands of acres across Texas","Multiple wildfires are ablaze in Texas, including one named the Crabapple Fire which is near Fredericksburg.",https://s.yimg.com/ny/api/res/1.2/_9V5w5Dyv9J0mhEAb5kb8Q--/YXBwaWQ9aGlnaGxhbmRlcjt3PTEyMDA7aD02NzU-/https://media.zenfs.com/en/usa_today_news_641/990a00fd90ce58fc0cb7b9688c85de38,2025-03-16T00:31:55Z,,"As high winds blow through the South this weekend, thousands of acres of wildfires are raging in Texas.
An outbreak of wildfires began in Texas on Friday as winds exceeded 30 miles per hour and dry … [+2608 chars]",,en,'wildfire'
https://abcnews.go.com/US/wireStory/tornadoes-wildfires-blinding-dust-sweep-us-massive-storm-119845713,https://abcnews.go.com/US/wireStory/tornadoes-wildfires-blinding-dust-sweep-us-massive-storm-119845713,0,abcnews.go.com,"Tornadoes, wildfires and blinding dust sweep across U.S. as massive storm leaves at least 32 dead","Violent tornadoes and high winds have decimated homes, wiped out schools and toppled semitractor-trailers as a monster storm that killed at least 32 people ripped its way across the central and southern U.S. Some of the initial storm deaths were report...",https://i.abcnewsfe.com/a/5c3f509f-516f-4270-90c1-d73e02892369/wirestory_ce794c4070279fdca3e6ecdd67f9225b_16x9.jpg?w=1600,2025-03-16T07:03:05Z,,"PIEDMONT, Mo. -- Violent tornadoes and high winds decimated homes, wiped out schools and toppled semitractor-trailers as a monster storm that killed at least 32 people ripped its way across the centr… [+4372 chars]",,en,'wildfire wind'
https://www.newsweek.com/monster-storm-leaves-least-32-dead-across-us-2045574,https://www.newsweek.com/monster-storm-leaves-least-32-dead-across-us-2045574,0,www.newsweek.com,Monster Storm Leaves at Least 32 Dead Across US,"Tornadoes, wildfires and blinding dust have swept across the central and southern U.S., with more severe weather forecast.",https://d.newsweek.com/en/full/2608249/severe-weather.jpg,2025-03-16T12:25:47Z,https://web.archive.org/web/20250316152847/https://www.newsweek.com/monster-storm-leaves-least-32-dead-across-us-2045574,"A powerful storm system tore through the central and southern United States, leaving destruction in its wake and killing at least 32 people.
The storm, which produced violent tornadoes, raging wildf… [+4137 chars]",,en,'wildfire buildings'
https://www.cbc.ca/news/canada/edmonton/why-some-jasper-residents-may-never-move-back-1.7484597,https://www.cbc.ca/news/canada/edmonton/why-some-jasper-residents-may-never-move-back-1.7484597,0,www.cbc.ca,Why some Jasper residents may never move back,"More than six months after the devastating wildfire ravaged Jasper, Alberta, many residents are still struggling to return to their homes, facing a housing crisis magnified by the destruction.",https://i.cbc.ca/1.7484514.1741991849!/fileImage/httpImage/image.JPG_gen/derivatives/16x9_1180/nancy-addison-and-family.JPG?im=Resize%3D620,2025-03-16T13:00:00Z,,"More than six months after the devastating wildfire ravaged Jasper, Alta., many residents are still struggling to return to their homes, facing a housing crisis magnified by the destruction. 
While … [+4860 chars]",,en,'wildfire'
https://insidethemagic.net/2025/03/national-weather-service-disney-world-fire-warning-ad1/,https://insidethemagic.net/2025/03/national-weather-service-disney-world-fire-warning-ad1/,0,insidethemagic.net,National Weather Service Locks Disney World Down for Severe Wildfire Warning,"While we’re all about the magic at Walt Disney World, sometimes Mother Nature throws us a curveball, and right now, she’s throwing some hot weather our way. The National Weather Service (NWS) in Melbourne has issued a Fire Weather Watch for Central Florida on…",https://insidethemagic.net/wp-content/uploads/2025/02/Untitled-design-2025-02-04T113258.873.jpg,2025-03-16T18:10:13Z,,"While were all about the magic at Walt Disney World, sometimes Mother Nature throws us a curveball, and right now, shes throwing some hot weather our way. The National Weather Service (NWS) in Melbou… [+6840 chars]",,en,'wildfire weather'
https://www.today.com/news/news/tornadoes-wildfires-dust-storms-us-rcna196632,https://www.today.com/news/news/tornadoes-wildfires-dust-storms-us-rcna196632,0,www.today.com,"Tornadoes, wildfires and blinding dust sweep across US as massive storm leaves at least 35 dead","Unusually vicious weather hits parts of the U.S., as violent tornadoes, high winds and blinding dust storms decimate homes and become fatal.","https://media-cldnry.s-nbcnews.com/image/upload/t_social_share_1200x630_center,f_auto,q_auto:best/rockcms/2025-03/250316-storm-mississippi-vl-148p-d649dd.jpg",2025-03-16T18:30:52Z,,"PIEDMONT, Mo. (AP) Residents pounded by unusually vicious weather across parts of the U.S. surveyed damage Sunday from violent tornadoes, high winds and blinding dust storms that decimated homes and … [+5819 chars]",,en,'wildfire wind'
https://insidethemagic.net/2025/03/disney-world-first-cancelation-wildfire-threat-ad1/,https://insidethemagic.net/2025/03/disney-world-first-cancelation-wildfire-threat-ad1/,0,insidethemagic.net,Disney World Makes 1st Cancelation After Wildfire Threat From U.S. Government,"As we’ve just reported, the National Weather Service (NWS) in Melbourne has issued another fire weather watch for Orange County, home to both Walt Disney World and Universal Orlando Resort. Now, we have confirmation that the weather is having a direct impact …",https://insidethemagic.net/wp-content/uploads/2024/02/epcot-rope-drop-header.jpg,2025-03-16T19:20:24Z,,"As weve just reported, the National Weather Service (NWS) in Melbourne has issued another fire weather watch for Orange County, home to both Walt Disney World and Universal Orlando Resort. Now, we ha… [+5069 chars]",,en,'wildfire wind'
https://www.justjared.com/2025/03/16/why-jennifer-garner-is-available-on-cameo-right-now/,https://www.justjared.com/2025/03/16/why-jennifer-garner-is-available-on-cameo-right-now/,0,www.justjared.com,Why Jennifer Garner is Available on Cameo Right Now,Jennifer Garner is reaching out to fans for a good cause. The 52-year-old actress took to her Instagram story on Saturday (March 15) to announce that she will be joining Cameo for a limited time in order to help raise funds for California wildfire relief. 13 …,https://cdn01.justjared.com/wp-content/uploads/headlines/2025/03/jennifer-garner-cameo-wildfires1.jpg,2025-03-16T19:34:19Z,,"Jennifer Garner is reaching out to fans for a good cause. 
The 52-year-old actress took to her Instagram story on Saturday (March 15) to announce that she will be joining Cameo for a limited time in… [+664 chars]",,en,'wildfire relief'
https://insidethemagic.net/2025/03/severe-weather-throws-disney-travel-plans-into-chaos-ab1/,https://insidethemagic.net/2025/03/severe-weather-throws-disney-travel-plans-into-chaos-ab1/,0,insidethemagic.net,Severe Weather Throws Disney Travel Plans Into Chaos,"Severe weather has been causing significant disruptions for travelers heading to Walt Disney World, with flight delays at Orlando International Airport and a wildfire warning from the National Weather Service impacting plans. Unpredictable weather is a known …",https://insidethemagic.net/wp-content/uploads/2025/01/wdw-entrance.jpg,2025-03-16T19:41:31Z,,"Severe weather has been causing significant disruptions for travelers heading to Walt Disney World, with flight delays at Orlando International Airport and a wildfire warning from the National Weathe… [+3471 chars]",,en,'wildfire weather'
https://dailycaller.com/2025/03/16/dozens-dead-tornadoes-wildfires-dust-storms-kansas-texas-mississippi-missouri-arkansas-oklahoma-sanders-stitt/,https://dailycaller.com/2025/03/16/dozens-dead-tornadoes-wildfires-dust-storms-kansas-texas-mississippi-missouri-arkansas-oklahoma-sanders-stitt/,0,dailycaller.com,"‘The Worst I’ve Ever Seen’: Dozens Dead Across Six States After Tornadoes, Wildfires, Dust Storms","A monster storm sweeping through parts of the U.S. whipped up tornadoes and dust storms and sparked wildfires, killing at least 34 people across six states",https://cdn01.dailycaller.com/wp-content/uploads/2025/03/Occluded_mesocyclone_tornado5_-_NOAA-e1742153993702.jpg,2025-03-16T19:56:55Z,https://web.archive.org/web/20250316201636/https://dailycaller.com/2025/03/16/dozens-dead-tornadoes-wildfires-dust-storms-kansas-texas-mississippi-missouri-arkansas-oklahoma-sanders-stitt/,"A monster storm sweeping through parts of the U.S. whipped up tornadoes and dust storms and sparked wildfires, killing at least 34 people across six states, according to reports.
The massive storm s… [+4431 chars]",,en,'wildfire'
https://www.abc.net.au/news/2025-03-17/emergency-warning-for-ledge-point-bushfire-north-of-perth/105059768,https://www.abc.net.au/news/2025-03-17/emergency-warning-for-ledge-point-bushfire-north-of-perth/105059768,0,www.abc.net.au,Lives and homes under threat from Ledge Point bushfire north of Perth,"An emergency warning is declared for a bushfire burning in the West Australian coastal town of Ledge Point north of Perth, with people urged to leave the area now.",https://live-production.wcms.abc-cdn.net.au/349bacf5caafc2475e70e1a3a6a04140?impolicy=wcms_watermark_news&cropH=633&cropW=1126&xPos=117&yPos=215&width=862&height=485&imformat=generic,2025-03-16T22:03:46Z,https://web.archive.org/web/20250316234730/https://www.abc.net.au/news/2025-03-17/emergency-warning-for-ledge-point-bushfire-north-of-perth/105059768,"An emergency warning has been declared for a bushfire burning in the West Australian coastal town of Ledge Point, north of Perth, with people urged to leave the area now.
The Department of Fire and … [+973 chars]",,en,'bushfire'
https://slashdot.org/firehose.pl?op=view&amp;id=176747883,https://slashdot.org/firehose.pl?op=view&amp;id=176747883,0,slashdot.org,Oklahomans survey devastation after hundreds of homes are destroyed and damaged by wildfires - The Associated Press,"Oklahomans survey devastation after hundreds of homes are destroyed and damaged by wildfiresThe Associated Press 4 deaths confirmed, at least 142 injured as Oklahoma wildfires prompts state of emergencyKOCO Oklahoma City Oklahoma wildfires destroy more than 2…",,2025-03-17T00:52:29Z,,The Fine Print: The following comments are owned by whoever posted them. We are not responsible for them in any way.,,en,'wildfire damage'
https://abcnews.go.com/US/wireStory/oklahomans-survey-devastation-after-hundreds-homes-destroyed-damaged-119858025,https://abcnews.go.com/US/wireStory/oklahomans-survey-devastation-after-hundreds-homes-destroyed-damaged-119858025,0,abcnews.go.com,Oklahomans survey devastation after hundreds of homes are destroyed and damaged by wildfires,Oklahomans are assessing the devastation after wildfires damaged or destroyed hundreds of homes around the state during a severe weather outbreak,https://i.abcnewsfe.com/a/678e05a4-cf93-428e-969c-d8acf9282b24/wirestory_58086d653ceb478fbc433f2b94a2e673_16x9.jpg?w=1600,2025-03-17T04:06:18Z,,"DALLAS -- As Oklahomans assessed the devastation from wildfires that whipped across the state, damaging or destroying hundreds of homes, officials in both Oklahoma and Texas warned Sunday of an incre… [+3500 chars]",,en,'wildfire weather'
https://english.khabarhub.com/2025/17/446947/,https://english.khabarhub.com/2025/17/446947/,0,english.khabarhub.com,Wildfire breaks out in Gorakhnath Community Forest,"KAVRE: A fire broke out in the Gorakhnath Community Forest in Bolde, Bethanchok Rural Municipality-3, in the southern part of Kavre on Sunday night. The fire, which started around 11:00 pm, continues to spread, prompting ongoing efforts by local authorities a…",https://english.khabarhub.com/wp-content/uploads/2025/03/Wildfifre-Gorakhnath-Community-Forest.jpg,2025-03-17T06:15:02Z,https://web.archive.org/web/20250317064541/https://english.khabarhub.com/2025/17/446947/,"KAVRE: A fire broke out in the Gorakhnath Community Forest in Bolde, Bethanchok Rural Municipality-3, in the southern part of Kavre on Sunday night.
The fire, which started around 11:00 pm, continue… [+1312 chars]",,en,'wildfire residents'
https://www.scientificamerican.com/article/how-to-build-a-wildfire-resistant-house/,https://www.scientificamerican.com/article/how-to-build-a-wildfire-resistant-house/,0,www.scientificamerican.com,How to Build a Wildfire-Resistant House,"With wildfires happening more often and burning more area, homes need to be “hardened” to make them more fire-resistant",https://static.scientificamerican.com/dam/m/17785585958f4544/original/fire-resistant-house_leadImage.png?m=1741974895.949&w=1200,2025-03-17T10:30:00Z,http://archive.md/20250317111815/https://www.scientificamerican.com/article/how-to-build-a-wildfire-resistant-house/,"Wildfires in the western U.S. are larger and more frequent now than in the past. And the number of homes, businesses and other structures lost to the flames has skyrocketed.
This is because such bla… [+12592 chars]",,en,'wildfire'
https://www.businessinsider.com/renters-insurance-reimbursed-me-quickly-after-la-wildfire-2025-3,https://www.businessinsider.com/renters-insurance-reimbursed-me-quickly-after-la-wildfire-2025-3,0,www.businessinsider.com,"After the LA wildfire, my renters insurance was a huge help — but I'm hoping to increase my coverage soon","I almost didn't renew my renters insurance policy, but I'm glad I decided to continue with my coverage — it's well worth the annual cost.",https://i.insider.com/67d48cd4b8b41a9673fac0e8?width=1080&format=jpeg,2025-03-17T11:12:01Z,https://web.archive.org/web/20250317143623/https://www.businessinsider.com/renters-insurance-reimbursed-me-quickly-after-la-wildfire-2025-3,"After the 2020 Bobcat Fire, which occurred in the San Gabriel Mountains near where I live, I had a hard time getting renters insurance. No insurance company would cover my tiny cabin as I was conside… [+4746 chars]",,en,'wildfire insurance'
https://www.ibtimes.com.au/ledge-point-bushfire-residents-told-its-too-late-evacuate-flames-close-1856927,https://www.ibtimes.com.au/ledge-point-bushfire-residents-told-its-too-late-evacuate-flames-close-1856927,0,www.ibtimes.com.au,Ledge Point Bushfire: Residents Told It's Too Late To Evacuate As Flames Close In,"Department of Fire and Emergency Services has advised residents to stay inside a room with running water before the fire reaches them, warning that the extreme heat could be deadly.",https://d.ibtimes.com.au/en/full/1675533/firefighters-are-battling-out-control-bushfire-citys-eastern-fringes-where-several-properties.jpg,2025-03-17T11:27:14Z,,Western Australia's Department of Fire and Emergency Services (DFES) issued an emergency warning this morning for residents that it was now too late for them to leave as a fast-moving bushfire burns … [+2357 chars],,en,'bushfire'
https://www.pbs.org/newshour/nation/at-least-4-dead-hundreds-of-homes-destroyed-after-wildfires-sweep-across-oklahoma-and-texas,https://www.pbs.org/newshour/nation/at-least-4-dead-hundreds-of-homes-destroyed-after-wildfires-sweep-across-oklahoma-and-texas,0,www.pbs.org,"At least 4 dead, hundreds of homes destroyed after wildfires sweep across Oklahoma and Texas",The Oklahoma Department of Emergency Management said Sunday evening that over 400 homes were damaged statewide. Officials said Sunday that at least four people had died because of the severe weather in Oklahoma.,https://d3i6fh83elv35t.cloudfront.net/static/2025/03/2025-03-15T051932Z_2058924233_RC2BDDAGIDQT_RTRMADP_3_USA-WILDFIRES-1024x683.jpg,2025-03-17T13:13:12Z,,"DALLAS (AP) As Oklahomans assessed the devastation from wildfires that whipped across the state, damaging or destroying hundreds of homes, officials in both Oklahoma and Texas warned Sunday of an inc… [+3692 chars]",,en,'wildfire weather'
https://www.huffpost.com/entry/severe-weather-storms-photos_n_67d819dbe4b0b4f6083851ac,https://www.huffpost.com/entry/severe-weather-storms-photos_n_67d819dbe4b0b4f6083851ac,0,www.huffpost.com,"Photos Show Widespread Destruction From Violent Tornadoes, Wildfires, Dust Storms",At least 37 people were killed as a sprawling storm barreled across the nation’s midsection toward the East Coast.,https://img.huffingtonpost.com/asset/67d8272c1500001b006ff3e2.jpeg?cache=IWLcSrR01j&ops=1200_630,2025-03-17T13:47:48Z,,"Residents are surveying damage from unusually vicious weather in multiple U.S. states where violent twisters, blinding dust storms and fast-moving wildfires decimated entire neighborhoods.
As of Sun… [+2393 chars]",,en,'wildfire'
https://www.newsweek.com/donald-trump-mar-lago-wildfire-threat-florida-2045922,https://www.newsweek.com/donald-trump-mar-lago-wildfire-threat-florida-2045922,0,www.newsweek.com,Donald Trump's Mar-a-Lago Warned of 'Rapidly' Spreading Wildfires,"NWS Miami, which services Palm Beach County, issued a red flag warning for the first time in more than two years.",https://d.newsweek.com/en/full/2608699/donald-trump-mar-lago-wildfire-threat.png,2025-03-17T15:57:41Z,https://web.archive.org/web/20250317183027/https://www.newsweek.com/donald-trump-mar-lago-wildfire-threat-florida-2045922,"National Weather Service (NWS) meteorologists across Florida are warning of increased fire risk on Monday amid dry, windy conditions, and Palm Beach, where President Donald Trump's Mar-a-Lago estate … [+2880 chars]",,en,'wildfire'
https://www.zdnet.com/home-and-office/kitchen-household/this-is-one-of-the-most-clever-smart-air-purifiers-ive-tested-and-its-on-sale-for-100/,https://www.zdnet.com/home-and-office/kitchen-household/this-is-one-of-the-most-clever-smart-air-purifiers-ive-tested-and-its-on-sale-for-100/,0,www.zdnet.com,This is one of the most clever smart air purifiers I've tested and it's on sale for $100,"The Morento smart air purifier has an inlet and filters on both sides to cover rooms up to 1,076 square feet for cleaner air during wildfire season. Plus, it's on sale on Amazon.",https://www.zdnet.com/a/img/resize/996be8fa3ac95c5b06ee263881ce354742d81266/2024/04/11/9e6bd51a-ed58-424d-8748-d61adb730e81/4.jpg?auto=webp&fit=crop&height=675&width=1200,2025-03-17T16:07:51Z,,"The Morento smart air purifier is $60 off at Amazon, currently on sale for $100.
One thing I love about air purifiers is the fresh feeling you get when you first turn it on. An air purifier starts c… [+4015 chars]",,en,'wildfire smoke'
