index,published,keyword,domain,language,valid,title,description,url,image,archive,content,quote,de,en,la,added
aba903d962324b93c2d2a7c0ebac35ed,2026-07-08T19:51:42Z,'wildfire hot',www.kqed.org,en,0.3,More California Communities Adopting Zone 0 Policy for Fire Safety,The strongest push for implementation may come from insurance companies themselves.,https://www.kqed.org/news/12090165/more-california-communities-adopting-zone-0-policy-for-fire-safety,https://cdn.kqed.org/wp-content/uploads/sites/10/2026/07/zone-zero.jpg,http://web.archive.org/web/20260708195415/https://www.kqed.org/news/12090165/more-california-communities-adopting-zone-0-policy-for-fire-safety,"Here are the morning’s top stories on Wednesday, July 8, 2026
<ul><li>In the aftermath of a catastrophic wildfire we often ask, how do we stop this from happening again? Fire experts and the insuran… [+2398 chars]",,Weitere kalifornische Gemeinden übernehmen Brandschutzrichtlinie für Zone 0. Der stärkste Impuls zur Umsetzung könnte von den Versicherungsunternehmen selbst ausgehen.,More California Communities Adopting Zone 0 Policy for Fire Safety. The strongest push for implementation may come from insurance companies themselves.,More California Communities Adopting Zone 0 Policy for Fire Safety. Validissima impulsio ad exsecutionem ab ipsis societatibus assecurationibus venire potest.,2026-07-11 21:06:51+00:00
bfd85e21f99383f4b024987d4d316da1,2026-07-09T02:00:00Z,'wildfire death',grist.org,en,0.3,Western Europe just set the record for its hottest June ever,Several countries experienced all-time highs in June as Europeans endured unprecedented heat and dangerously elevated overnight temperatures.,https://grist.org/extreme-weather/western-europe-just-set-the-record-for-its-hottest-june-ever/,https://grist.org/wp-content/uploads/2026/07/Europe-heatwave-record-tempeature-climate-change-hot.jpeg?quality=75&strip=all,http://web.archive.org/web/20260710025708/https://grist.org/extreme-weather/western-europe-just-set-the-record-for-its-hottest-june-ever/,"Europe has spent several weeks enduring blistering heat. The heatwave the continent experienced last month closed schools, disrupted power supplies, and has been linked to thousands of deaths. France… [+3704 chars]",,"Westeuropa hat gerade den Rekord für den heißesten Juni aller Zeiten aufgestellt. Mehrere Länder verzeichneten im Juni Rekordwerte, da die Europäer unter beispielloser Hitze und gefährlich hohen Nachttemperaturen litten.",Western Europe just set the record for its hottest June ever. Several countries experienced all-time highs in June as Europeans endured unprecedented heat and dangerously elevated overnight temperatures.,Europa occidentalis iustus recordum suum Iunium semper calidissimum posuit. Plures nationes in mense Iunio temporis grauis expertae Europaei inauditum calorem pertulerunt et periculosissime temperaturas pernoctare elatae sunt.,2026-07-11 21:06:51+00:00
58f05bd13bd873544f79a9d6b0658af1,2026-07-09T09:00:46Z,'wildfire death',www.aljazeera.com,en,0.3,Hottest June on record in Western Europe as heatwaves hit continent,"Thousands of deaths across Europe, mostly in France, Spain and Belgium, have been linked to a June heatwave.",https://www.aljazeera.com/news/2026/7/9/hottest-june-on-record-in-western-europe-as-heatwaves-hit-continent,https://www.aljazeera.com/wp-content/uploads/2026/07/afp_6a4f4de882ed-1783582184.jpg?resize=1200%2C675,http://web.archive.org/web/20260710010028/https://www.aljazeera.com/news/2026/7/9/hottest-june-on-record-in-western-europe-as-heatwaves-hit-continent,"Last month was the hottest June ever recorded in Western Europe, with temperatures more than three degrees Celcius (5.4 degrees Fahrenheit) above the 1991-2020 average, the European Unions Copernicus… [+2461 chars]",,"Der heißeste Juni seit Beginn der Aufzeichnungen in Westeuropa, da Hitzewellen den Kontinent heimsuchten. Tausende Todesfälle in ganz Europa, vor allem in Frankreich, Spanien und Belgien, wurden mit einer Hitzewelle im Juni in Verbindung gebracht.","Hottest June on record in Western Europe as heatwaves hit continent. Thousands of deaths across Europe, mostly in France, Spain and Belgium, have been linked to a June heatwave.","Calidissimus mensis Iunii in Europa occidentali recordatus est sicut aestus continentis aestus pulsavit. Milia mortium per Europam, maxime in Gallia, Hispania et Belgio, cum aestu Iunio coniuncta sunt.",2026-07-11 21:06:51+00:00
2290d620c667c30d0bd58527e53dd116,2026-07-08T20:36:57Z,'wildfire evacuation',www.cbc.ca,en,0.7,"Wildfires near Boston Bar, B.C., growing, more evacuations ordered",The Brunswick and Ainslie Creek fires continues to burn out of control in B.C.'s Fraser Canyon.,https://www.cbc.ca/news/canada/british-columbia/boston-bar-brunswick-creek-fire-july-8-2026-9.7263069,"https://i.cbc.ca/ais/cb2736ec-9668-4dce-aaaa-1c24fd68d787,1783531636026/full/max/0/default.jpg?im=Crop%2Crect%3D%280%2C1219%2C4284%2C2409%29%3BResize%3D620",,"A wildfire burning in B.C.'s Fraser Canyon has forced more evacuations as it burns out of control and threatens homes. 
As of Wednesday morning, the Brunswick Creek fire near Boston Bar, B.C., has g… [+1208 chars]",,"Waldbrände in der Nähe von Boston Bar, B.C. nehmen zu, weitere Evakuierungen werden angeordnet. Die Brände in Brunswick und Ainslie Creek geraten im Fraser Canyon in British Columbia weiterhin außer Kontrolle.","Wildfires near Boston Bar, B.C., growing, more evacuations ordered. The Brunswick and Ainslie Creek fires continues to burn out of control in B.C.'s Fraser Canyon.","Wildfires prope Boston Bar, B.C., crescens, purgationes magis iussit. Brunsvicensis et Ainslie Creek ignes in B.C. Fraser Canyon imperium exurere pergunt.",2026-07-11 21:06:51+00:00
fcfce63d42140740842d14e2f57403bc,2026-07-08T08:13:00Z,'wildfire',www.dw.com,en,0.9,The Australian tree supercharging global wildfires,"As Europe experiences another summer of extreme heat and wildfire warnings, one tree imported from Australia is coming under renewed scrutiny across the world: eucalyptus. Each year, more than 400,000 hikers descend on Galicia for the Camino de Santiago pilgr…",https://www.dw.com/en/the-australian-tree-supercharging-global-wildfires/a-77560208,https://static.dw.com/image/77562892_6.jpg,,"Each year, more than 400,000 hikers descend on Galicia for the Camino de Santiago pilgrim walk, crossing misty hills and dense green woodland. But much of the forest surrounding the route is no longe… [+6901 chars]",,"Der australische Baum löst weltweite Waldbrände aus. Während Europa einen weiteren Sommer mit extremer Hitze und Waldbrandwarnungen erlebt, wird ein aus Australien importierter Baum weltweit erneut unter die Lupe genommen: Eukalyptus. Jedes Jahr kommen mehr als 400.000 Wanderer auf dem Jakobsweg nach Galizien.","The Australian tree supercharging global wildfires. As Europe experiences another summer of extreme heat and wildfire warnings, one tree imported from Australia is coming under renewed scrutiny across the world: eucalyptus. Each year, more than 400,000 hikers descend on Galicia for the Camino de Santiago pilgr…","Arbor Australiae incendia globalis supercharge. Cum Europa aliam aestatem aestus nimii et incendii feritatis monita experitur, una arbor ex Australia importata venit sub scrutinio renovato per orbem: eucalyptus. Singulis annis plus quam 400,000 hikeri in Gallaecia descendunt pro pilgr Camino de Santiago…",2026-07-11 21:06:51+00:00
53b6bf7b6bb272bb96861c947fd5a3c5,2026-07-08T13:18:55Z,'wildfire weather',www.insurancejournal.com,en,0.9,"Wildfire Risk Rises Across US West as Winds, Dry Lightning Build","Strong winds and dry thunderstorms are raising the risk of fast-moving wildfires across much of the U.S. West, where forecasters warned conditions will favor new ignitions and rapid fire spread through Thursday. An elevated fire-weather outlook, Level 1 on th…",https://www.insurancejournal.com/news/west/2026/07/08/876665.htm,https://www.insurancejournal.com/img/social/opengraph/ij-social-trends-1200x630.png,,"Strong winds and dry thunderstorms are raising the risk of fast-moving wildfires across much of the U.S. West, where forecasters warned conditions will favor new ignitions and rapid fire spread throu… [+1521 chars]",,"Die Gefahr von Waldbränden steigt im Westen der USA, da Winde und trockene Blitze zunehmen. Starke Winde und trockene Gewitter erhöhen das Risiko sich schnell ausbreitender Waldbrände in weiten Teilen des Westens der USA, wo Prognostiker warnten, dass die Bedingungen bis Donnerstag zu neuen Bränden und einer schnellen Ausbreitung des Feuers führen werden. Eine erhöhte Feuerwetteraussicht, Ebene 1 auf der …","Wildfire Risk Rises Across US West as Winds, Dry Lightning Build. Strong winds and dry thunderstorms are raising the risk of fast-moving wildfires across much of the U.S. West, where forecasters warned conditions will favor new ignitions and rapid fire spread through Thursday. An elevated fire-weather outlook, Level 1 on th…","INCAENDIUM Risk surgit Trans US Occidentem sicut Venti, Arida Lightning aedificate. Venti validi et procellis sicci periculum excitant incendia ignium velocium mobilium per multum Americae occidentales, ubi condiciones denuntiaverunt forecasters novas ignitiones favere et ignis rapidus per Iovis divulgatum. Elevatus ignis-tempestatis prospectans, Level 1 on th…",2026-07-11 21:06:51+00:00
5d3665e4e94cf8dbf7afa309dba8b4f3,2026-07-08T15:07:35Z,'wildfire smoke',www.cbc.ca,en,0.9,"Fire crews continue to fight 'disheartening' fires burning in Labrador, minister says",Firefighting crews are continuing to tackle several wildfires burning across Labrador on Wednesday — which are bringing smoke and air quality concerns across the region.,https://www.cbc.ca/news/canada/newfoundland-labrador/forsey-labrador-wildfires-july-8-9.7262578,"https://i.cbc.ca/ais/085b7868-a6b5-4229-bafb-4dbc1744d0ed,1783521220683/full/max/0/default.jpg?im=Crop%2Crect%3D%280%2C14%2C1617%2C909%29%3BResize%3D620",,"Firefighting crews are continuing to tackle several wildfires burning across Labrador on Wednesday which are bringing smoke and air quality concerns across the region.
Newfoundland and Labrador's ac… [+2665 chars]",,"Feuerwehrleute bekämpfen weiterhin „entmutigende“ Brände in Labrador, sagt der Minister. Feuerwehrleute bekämpfen am Mittwoch weiterhin mehrere Waldbrände in Labrador, die in der gesamten Region zu Problemen mit der Rauchentwicklung und der Luftqualität führen.","Fire crews continue to fight 'disheartening' fires burning in Labrador, minister says. Firefighting crews are continuing to tackle several wildfires burning across Labrador on Wednesday — which are bringing smoke and air quality concerns across the region.","Ignis nautarum pugnare pergunt 'discordes' ignes ardentes in Labrador, minister dicit. Nautae pugnae aliquot incendia silvestrium trans Labrador die Mercurii occupari pergunt - quae fumum et qualitatem aeris per regionem ingerunt.",2026-07-11 21:06:51+00:00
808462006d0a1bd12b25c30c16ef9690,2026-07-08T18:00:04Z,'wildfire health',www.thejournal.ie,en,0.9,"Lise Hand: In this heat, Irish summers just aren't what they used to be","We once lathered on tanning oil and prayed for sunshine. Now every heatwave comes with wildfire maps, health warnings and an uneasy feeling that something is off.",https://www.thejournal.ie/readme/irish-summer-extreme-heat-7094035-Jul2026/,https://img2.thejournal.ie/article/7094035/river/?height=400&version=7094151,,"FLYING ACROSS IRELAND on an overnight flight from New York to Dublin almost exactly eight years ago in early July 2018, my face was pressed against the window looking at the countryside below. Id nev… [+6401 chars]",,"Lise Hand: Bei dieser Hitze sind die irischen Sommer einfach nicht mehr das, was sie einmal waren. Einmal schäumten wir uns mit Bräunungsöl ein und beteten um Sonnenschein. Mittlerweile bringt jede Hitzewelle Waldbrandkarten, Gesundheitswarnungen und das unbehagliche Gefühl mit sich, dass etwas nicht stimmt.","Lise Hand: In this heat, Irish summers just aren't what they used to be. We once lathered on tanning oil and prayed for sunshine. Now every heatwave comes with wildfire maps, health warnings and an uneasy feeling that something is off.","Lise Hand: In hoc calore, aestates Hiberniae non sunt tantum quales esse solebant. Nos olim tanning oleum lauimus et pro sole oravimus. Nunc omnis heatwave venit cum mappis ferum, monita sanitatis et anxium quod aliquid abest.",2026-07-11 21:06:51+00:00
704703168e61d15b76706f68812d4d45,2026-07-10T07:44:44Z,'wildfire',www.thejournal.ie,en,0.9,The 9 at 9: Friday,"Loyalist bonfire with replica mosque lit ahead of removal, at least 12 killed in Spain wildfire and the Bayeux Tapestry crosses the English Channel.",https://www.thejournal.ie/9-at-9-friday-72-7097473-Jul2026/,https://img2.thejournal.ie/article/7097473/river/?height=400&version=7097479,http://web.archive.org/web/20260711010352/https://www.thejournal.ie/9-at-9-friday-72-7097473-Jul2026/,"GOOD MORNING.
Heres all the news you need to know to start the day.
Assault
1. An Indian man was allegedly attack by a group of teenagers in Citywest, Co Dublin after they asked where he was from.… [+3780 chars]",,"Die 9 um 9: Freitag. Lagerfeuer der Loyalisten mit nachgebauter Moschee vor dem Abtransport angezündet, mindestens 12 Tote bei Waldbrand in Spanien und der Teppich von Bayeux überquert den Ärmelkanal.","The 9 at 9: Friday. Loyalist bonfire with replica mosque lit ahead of removal, at least 12 killed in Spain wildfire and the Bayeux Tapestry crosses the English Channel.","9 at 9 quod : Veneris. Pyra fidelis cum effigie meschitam ante remotionem accensam, saltem duodecim in Hispania ferum occisum et Channel Baiocum Tapestriam Anglicam transit.",2026-07-11 21:06:51+00:00
c7145f39b112ddafcc50cf20a50f9e66,2026-07-10T13:18:23Z,'wildfire',www.bbc.co.uk,en,0.9,'Extreme' London wildfire risk warning issued,"The risk has been raised due to the hot, dry weather and wind direction and speed, the LFB says.",https://www.bbc.co.uk/news/articles/cy8dz8dzegyo,https://ichef.bbci.co.uk/ace/branded_news/1200/cpsprodpb/871e/live/264dfcd0-60f3-11f0-ae6b-f98c94e089e3.jpg,http://web.archive.org/web/20260710185103/https://www.bbc.co.uk/news/articles/cy8dz8dzegyo,"The LFB has tackled an increasing number of wildfires on grass and heathland in recent years, some of them devastating.
Most notably, 16 homes were destroyed by a fast-moving fire that swept across … [+860 chars]",,"Warnung vor „extremer“ Waldbrandgefahr in London. Das Risiko sei aufgrund des heißen, trockenen Wetters sowie der Windrichtung und -geschwindigkeit erhöht, so die LFB.","'Extreme' London wildfire risk warning issued. The risk has been raised due to the hot, dry weather and wind direction and speed, the LFB says.","'extremae' incendii incendii periculum denuntiatio Londinii edita. Periculum elevatum est propter aestus, siccitatem et ventorum directionem et velocitatem, ut dicit LFB.",2026-07-11 21:06:51+00:00
6315088732541f1f8c857029e2bdd2b4,2026-07-10T16:57:26Z,'wildfire',www.cbc.ca,en,0.9,"'Vigorous fire behaviour' expected for Brunswick wildfire complex near Boston Bar, despite slight reprieve","The Brunswick wildfires complex near Boston Bar, B.C., continues to rage out of control Friday.",https://www.cbc.ca/news/canada/british-columbia/brunswick-wildfire-complex-july-10-9.7265703,"https://i.cbc.ca/ais/6d1cebf9-71d3-4e8c-b10f-f29550e7379b,1783701718274/full/max/0/default.jpg?im=Crop%2Crect%3D%280%2C449%2C3067%2C1725%29%3BResize%3D620",,"The Brunswick wildfire complex burning near Boston Bar, B.C., continues to rage out of control Friday.
A number of evacuation orders and alerts are in place for nearby communities.
B.C. Wildfire Se… [+1822 chars]",,"„Heftiges Brandverhalten“ wird für den Brunswick-Waldbrandkomplex in der Nähe von Boston Bar erwartet, trotz einer leichten Verschnaufpause. Der Waldbrandkomplex Brunswick in der Nähe von Boston Bar, B.C., ist am Freitag weiterhin außer Kontrolle geraten.","'Vigorous fire behaviour' expected for Brunswick wildfire complex near Boston Bar, despite slight reprieve. The Brunswick wildfires complex near Boston Bar, B.C., continues to rage out of control Friday.","'Ignis morum strenuus' expectatur pro complexu incendium ferum Brunsvicense prope Boston Bar, non obstante levi relaxatione. Brunsvicensis incendia incendia iuncta prope Boston Bar, B.C., e potestate Veneris saevire pergit.",2026-07-11 21:06:51+00:00
7ba29f027e7e58063c803d7ff70b182e,2026-07-10T15:45:09Z,'wildfire disaster',grist.org,en,0.3,Congress is about to pass the biggest disaster reform in years,A little-noticed section in a bipartisan housing bill could speed up new construction after major disasters.,https://grist.org/politics/trump-congress-housing-bill-disaster-recovery/,https://grist.org/wp-content/uploads/2026/07/California-fire-rebuild.jpg?quality=75&strip=all,http://web.archive.org/web/20260711003324/https://grist.org/politics/trump-congress-housing-bill-disaster-recovery/,There are a lot of ways for disaster victims to get help in the immediate aftermath of a flood or fire. The Federal Emergency Management Agency gives out temporary housing assistance and pays for deb… [+5195 chars],,"Der Kongress steht kurz davor, die größte Katastrophenreform seit Jahren zu verabschieden. Ein wenig beachteter Abschnitt in einem parteiübergreifenden Wohnungsbaugesetz könnte den Neubau nach größeren Katastrophen beschleunigen.",Congress is about to pass the biggest disaster reform in years. A little-noticed section in a bipartisan housing bill could speed up new construction after major disasters.,Congressus maximam calamitatem annis reformationis passurus est. Sectio parum notata in libello habitationi bipartisanae novam constructionem post magnas clades accelerare potuit.,2026-07-12 10:01:42+00:00
c5b0de7d330631d0879cf0ce26079f49,2026-07-07T00:00:00Z,'wildfire wind',www.nature.com,en,0.9,Causal effects of wildfire PM2.5 on hospital costs and length of stay in Brazil,"This study links 184.5 million hospitalizations in Brazil to wildfire-specific PM₂.₅, using wind-driven variation within a causal framework. It finds higher hospitalization costs and longer stays for all-cause, respiratory, and cardiovascular diseases, with s…",https://www.nature.com/articles/s41467-026-75157-8,,,"<li>Climate, Air Quality Research (CARE) Unit, School of Public Health and Preventive Medicine, Monash University, Melbourne, Australia
Ke Ju, Wenzhong Huang, Yiwen Zhang, Tingting Ye, Wenhua Yu, Zh… [+873 chars]",,"Kausale Auswirkungen von Waldbränden PM2,5 auf Krankenhauskosten und Aufenthaltsdauer in Brasilien. Diese Studie verknüpft 184,5 Millionen Krankenhausaufenthalte in Brasilien mit waldbrandspezifischem PM₂,₅ und nutzt dabei windbedingte Variationen innerhalb eines kausalen Rahmens. Es werden höhere Krankenhauskosten und längere Aufenthalte bei Erkrankungen jeglicher Ursache sowie bei Atemwegs- und Herz-Kreislauf-Erkrankungen festgestellt, wobei …","Causal effects of wildfire PM2.5 on hospital costs and length of stay in Brazil. This study links 184.5 million hospitalizations in Brazil to wildfire-specific PM₂.₅, using wind-driven variation within a causal framework. It finds higher hospitalization costs and longer stays for all-cause, respiratory, and cardiovascular diseases, with s…","Effectus causales ignem ignem PM2.5 in sumptibus hospitalis et longitudinem morandi in Brasilia. Hoc studium 184.5 decies centena hospitalizationes in Brasilia ad ignem specialium PM₂.₅ coniungit, utens variatione ventosae intra compagem causalem. Superiores hospitalizationis impensas invenit et moras longiores omnium causarum, respiratorii et morbi cardiovasculares, cum s...",2026-07-12 10:01:42+00:00
c5751ab1ef12192292c3c8f3ef612576,2026-07-06T15:41:49Z,'wildfire heat',en.protothema.gr,en,0.7,"Wildfires force thousands to flee in France, Spain and Portugal as heatwave grips southern Europe","France has called in EU firefighting aircraft after a major blaze near Perpignan burned 4,600 hectares, while Portugal and Spain remain on high alert as temperatures climb above 40C
The post Wildfires force thousands to flee in France, Spain and Portugal as h…",https://en.protothema.gr/2026/07/06/wildfires-force-thousands-to-flee-in-france-spain-and-portugal-as-heatwave-grips-southern-europe/,https://en.protothema.gr/wp-content/uploads/2026/07/fire-portugal-1.jpg-1.jpg,,"Firefighters are battling major wildfires in France, Spain and Portugal, where a new heatwave, strong winds and prolonged dry conditions have turned large areas of southern Europe into high-risk fire… [+3098 chars]",,"Waldbrände zwingen Tausende zur Flucht in Frankreich, Spanien und Portugal, während die Hitzewelle Südeuropa erfasst. Frankreich hat EU-Löschflugzeuge angefordert, nachdem bei einem Großbrand in der Nähe von Perpignan 4.600 Hektar Land verbrannt waren, während Portugal und Spanien weiterhin in höchster Alarmbereitschaft sind, da die Temperaturen auf über 40 °C steigen
Die Waldbrände nach den Waldbränden zwingen Tausende zur Flucht in Frankreich, Spanien und Portugal, da …","Wildfires force thousands to flee in France, Spain and Portugal as heatwave grips southern Europe. France has called in EU firefighting aircraft after a major blaze near Perpignan burned 4,600 hectares, while Portugal and Spain remain on high alert as temperatures climb above 40C
The post Wildfires force thousands to flee in France, Spain and Portugal as h…","Ignium ignium millia in Galliam, Hispaniam et Lusitaniam fugere cogunt sicut aestus Europae meridionalis tenet. Gallia in elit pugnae EU inclamavit post maiorem flammam prope Perpinianum 4600 hectares incensa, dum Portugal et Hispania in altum intentum manent sicut supra 40C temperaturas ascendunt.
Praesidium Wildfires milia vi in Galliam, Hispaniam et Lusitaniam fugere h…",2026-07-12 15:16:29+00:00
900c9d94d2540b0d9564870d7058a867,2026-07-10T05:38:55Z,'wildfire buildings',www.irishtimes.com,en,0.7,"Wildfires in southern Spain kill 12, emergency agency says","Blaze may have started after a power line fell, igniting dry vegetation before spreading rapidly",https://www.irishtimes.com/world/europe/2026/07/10/wildfires-in-southern-spain-kill-12-emergency-agency-says/,https://www.irishtimes.com/resizer/v2/O5OTDEY2ZQMEYZRENTWDN263AQ.jpg?smart=true&auth=cba38035c069dc7d1e3d8e17a653cb90bd1e2b080f4ce625f9c8eb304b131640&width=1200&height=630,,"Twelve people were reported killed in a wildfire in Almeria in southern Spain, as about 150 firefighters battled the blaze which broke out amid soaring temperatures.
The number of people who died in… [+2268 chars]",,"Bei Waldbränden in Südspanien sind nach Angaben der Katastrophenschutzbehörde zwölf Menschen ums Leben gekommen. Der Brand könnte nach dem Einsturz einer Stromleitung ausgebrochen sein und trockene Vegetation entzündet haben, bevor er sich schnell ausgebreitet hat","Wildfires in southern Spain kill 12, emergency agency says. Blaze may have started after a power line fell, igniting dry vegetation before spreading rapidly","Ignes in Hispania meridionali occidunt 12. Subitis procuratio dicit. Ardere fortasse incepit postquam vis recta cecidit, accendit herbam aridam antequam celeriter serperet",2026-07-12 15:16:29+00:00
fcbdbd0100f9f5053a833b81a6bd5495,2026-07-02T18:50:26Z,'wildfire',en.protothema.gr,en,0.9,"Southern France wildfires force mass evacuations as 2,000 firefighters battle blazes","According to local authorities, 1,500 people were evacuated from the city's camps, and the airport in the nearby city of Perpignan was closed
The post Southern France wildfires force mass evacuations as 2,000 firefighters battle blazes appeared first on Proto…",https://en.protothema.gr/2026/07/02/southern-france-wildfires-force-mass-evacuations-as-2000-firefighters-battle-blazes/,https://en.protothema.gr/wp-content/uploads/2026/07/maketa-gallia-fotia-1.jpg-1.jpg,http://web.archive.org/web/20260703080942/https://en.protothema.gr/2026/07/02/southern-france-wildfires-force-mass-evacuations-as-2000-firefighters-battle-blazes/,"Two thousand firefighters were battling several wildfires along Frances Mediterranean coast on Thursday, as strong winds and drought conditions following Europes recent heatwave fuelled fast-moving f… [+1826 chars]",,"Waldbrände in Südfrankreich erzwingen Massenevakuierungen, während 2.000 Feuerwehrleute gegen die Flammen kämpfen. Nach Angaben der örtlichen Behörden wurden 1.500 Menschen aus den Lagern der Stadt evakuiert und der Flughafen in der nahegelegenen Stadt Perpignan geschlossen
Die nach den Waldbränden in Südfrankreich erzwungenen Massenevakuierungen, als 2.000 Feuerwehrleute gegen die Flammen kämpften, tauchten erstmals auf Proto auf …","Southern France wildfires force mass evacuations as 2,000 firefighters battle blazes. According to local authorities, 1,500 people were evacuated from the city's camps, and the airport in the nearby city of Perpignan was closed
The post Southern France wildfires force mass evacuations as 2,000 firefighters battle blazes appeared first on Proto…","Southern France wildfires force mass evacuations as 2,000 firefighters battleing. Secundum locorum auctoritates, 1500 homines e castris urbis excessi sunt et aeriportus in urbe proxima Perpiniani clausa est.
Post Southern France wildfires force mass evacuations as 2,000 firefightersing battle to appear first on Proto…",2026-07-12 15:16:29+00:00
