index,url,valid,domain,title,description,image,published,archive,content,quote,language,keyword
https://www.japantimes.co.jp/news/2025/03/01/japan/iwate-wildfire-battle/,https://www.japantimes.co.jp/news/2025/03/01/japan/iwate-wildfire-battle/,0,www.japantimes.co.jp,Japan battles biggest wildfire in decades,"Flames are estimated to have spread over about 1,200 hectares in the forest of Ofunato in the northern region of Iwate since fire broke out on Wednesday.",https://www.japantimes.co.jp/japantimes/uploads/images/2025/03/01/454851.jpg?v=3.1,2025-03-01T03:06:00Z,http://archive.md/20250301150758/https://www.japantimes.co.jp/news/2025/03/01/japan/iwate-wildfire-battle/,"Japan was battling its largest wildfire in more than three decades on Saturday, one of several blazes that have killed one person and forced the evacuation of more than a thousand.
Flames are estima… [+1487 chars]",,en,'forest fire'
https://www.channelnewsasia.com/east-asia/japan-biggest-wildfire-ofunato-iwate-4969296,https://www.channelnewsasia.com/east-asia/japan-biggest-wildfire-ofunato-iwate-4969296,0,www.channelnewsasia.com,Japan battles biggest wildfire in decades,"One person has been killed, and over 1,000 residents in Ofunato, Iwate Prefecture have been evacuated, as of Friday (Feb 28).","https://dam.mediacorp.sg/image/upload/s--hW5Xx9Wd--/f_auto,q_auto/c_fill,g_auto,h_676,w_1200/v1/mediacorp/cna/image/2025/03/01/000_36yv3tb.jpg?itok=n0O69eJR",2025-03-01T04:25:00Z,,"TOKYO: Japan was battling its largest wildfire in more than three decades on Saturday (Mar 1), one of several blazes that have killed one person and forced the evacuation of more than a thousand.
Fl… [+1474 chars]",,en,'wildfire residents'
https://www.lewrockwell.com/2025/03/no_author/what-wildfire-illness-can-teach-us-about-treating-copd/,https://www.lewrockwell.com/2025/03/no_author/what-wildfire-illness-can-teach-us-about-treating-copd/,0,www.lewrockwell.com,What Wildfire Illness Can Teach Us About Treating COPD,"California just experienced a devastating set of wildfires that is on its way to becoming the costliest disaster in US history. As such, a significant national focus has been directed to the series of reprehensible errors and policies that gave rise to the di…",https://www.lewrockwell.com/wp-content/uploads/2025/02/1-5-620x378.webp,2025-03-01T05:01:00Z,,"California just experienced a devastating set of wildfires that is on its way to becoming the costliest disaster in US history. As such, a significant national focus has been directed to the series o… [+9758 chars]",,en,'wildfire disaster'
https://japantoday.com/category/national/more-people-ordered-to-evacuate-as-northeast-japan-wildfire-spreads,https://japantoday.com/category/national/more-people-ordered-to-evacuate-as-northeast-japan-wildfire-spreads,0,japantoday.com,More people ordered to evacuate as northeast Japan wildfire spreads,"Over a hundred more households in northeastern Japan were told to evacuate on Saturday as a wildfire that has been burning for four days continued to spread. The Iwate Prefecture government issued a new order for 333 people from 141 homes to evacuate, adding …",,2025-03-01T07:25:26Z,,"Over a hundred more households in northeastern Japan were told to evacuate on Saturday as a wildfire that has been burning for four days continued to spread.
The Iwate Prefecture government issued a… [+571 chars]",,en,'wildfire house'
https://www.dw.com/en/japan-fights-worst-wildfire-in-decades/a-71791934,https://www.dw.com/en/japan-fights-worst-wildfire-in-decades/a-71791934,0,www.dw.com,Japan fights worst wildfire in decades,The largest wildfire in Japan in more than 30 years is continuing to rage in the north of the country. At least one person is reported to have died in the blaze. A wildfire in the northern Japanese prefecture of Iwate has forced the evacuation of more than a …,https://static.dw.com/image/71782467_6.jpg,2025-03-01T10:10:00Z,http://archive.md/20250301144408/https://www.dw.com/en/japan-fights-worst-wildfire-in-decades/a-71791934,"A wildfire in the northern Japanese prefecture of Iwate has forced the evacuation of more than a thousand people and killed at least one, with some 2,500 firefighters from around the country battling… [+1530 chars]",,en,'wildfire'
https://www.bbc.com/news/articles/c17q59k52eno,https://www.bbc.com/news/articles/c17q59k52eno,0,www.bbc.com,Risk of wildfires 'very high' in parts of Scotland,The fire service said people should avoid lighting any fires outdoors between Saturday and Wednesday.,https://ichef.bbci.co.uk/news/1024/branded_news/97bc/live/2045adf0-f687-11ef-8c03-7dfdbeeb2526.jpg,2025-03-01T11:23:57Z,https://web.archive.org/web/20250301193340/https://www.bbc.com/news/articles/c17q59k52eno,"People in the north and east of Scotland have been urged not to light fires outdoors
A ""very high"" risk warning for wildfires has been issued for the north and east of Scotland over the coming days.… [+3266 chars]",,en,'wildfire'
http://deadline.com/2025/03/hollywood-workers-recovering-wildfires-1236260144/,http://deadline.com/2025/03/hollywood-workers-recovering-wildfires-1236260144/,0,deadline.com,"Hollywood Workers, Still Reeling From Five Years Of Economic Turmoil, Turn To Collective Action In Wake Of L.A. Wildfires","Seriina Covarrubias was baking herself a birthday cake in her Altadena home when the wildfire in Eaton Canyon broke out on the evening of January 7. Within an hour, she lost power and cell service as she and her husband raced to evacuate. “I knew we had to ge…",https://deadline.com/wp-content/uploads/2025/02/Hollywood.jpg?w=1024,2025-03-01T16:00:00Z,https://web.archive.org/web/20250301214208/https://deadline.com/2025/03/hollywood-workers-recovering-wildfires-1236260144/,"Seriina Covarrubias was baking herself a birthday cake in her Altadena home when the wildfire in Eaton Canyon broke out on the evening of January 7. Within an hour, she lost power and cell service as… [+10679 chars]",,en,'wildfire'
https://hiphopdx.com/news/madlib-wildfire-benefit-show-los-angeles-lineup,https://hiphopdx.com/news/madlib-wildfire-benefit-show-los-angeles-lineup,0,hiphopdx.com,"Madlib Taps The Alchemist, Mick Jenkins & More For Second Wildfire Benefit Show In L.A.",Madlib has recruited big names such as The Alchemist and Mick Jenkins for a second wildfire benefit concert in Los Angeles in April.,https://app.hiphopdx.com/wp-content/uploads/2025/02/madlib-taps-the-alchemist-mick-jenkins-for-second-wildfire-benefit-show-in-la.jpg?w=1200,2025-03-01T18:00:23Z,,"Los Angeles, CA - Madlib has assembled a heavyweight lineup of Hip Hop legends for his second Madlove benefit show aimed at helping those affected by the recent wildfires in Los Angeles and this one … [+2164 chars]",,en,'wildfire'
https://northern.starweekly.com.au/news/include-pets-in-your-bushfire-survival-plan/,https://northern.starweekly.com.au/news/include-pets-in-your-bushfire-survival-plan/,0,northern.starweekly.com.au,Include pets in your bushfire survival plan,"RSPCA Victoria and the CFA are urging residents to include pets in their bushfire survival plans, with significant fire activity...
The post Include pets in your bushfire survival plan appeared first on Northern.",https://northern.starweekly.com.au/wp-content/uploads/sites/5/2025/03/doggen_311124_01.jpg,2025-03-01T22:00:02Z,,"RSPCA Victoria and the CFA are urging residents to include pets in their bushfire survival plans, with significant fire activity already impacting the state this summer.
Making sure that you have be… [+2048 chars]",,en,'bushfire'
https://freerepublic.com/focus/f-news/4301416/posts,https://freerepublic.com/focus/f-news/4301416/posts,0,freerepublic.com,President Trump to sign executive order unleashing forest management after LA wildfires,"WASHINGTON ― President Donald Trump is expected to sign an executive order Saturday that looks to unleash forest management efforts following this year's devastating Los Angeles wildfires, according to a White House official. The order takes steps for quicker…",,2025-03-01T23:09:56Z,,"Skip to comments.
President Trump to sign executive order unleashing forest management after LA wildfiresMSN ^
 | March 1, 2025
 | Joey Garrison
Posted on 03/01/2025 3:09:56 PM PST by Twotone
WA… [+4227 chars]",,en,'wildfire'
https://www.cbsnews.com/news/multiple-wildfires-carolinas-evacuations/,https://www.cbsnews.com/news/multiple-wildfires-carolinas-evacuations/,0,www.cbsnews.com,"Multiple wildfires erupt in the Carolinas, force evacuations",Brush fires that erupted amid dry and windy conditions caused officials in both North and South Carolina to order evacuations Saturday.,https://assets3.cbsnewsstatic.com/hub/i/r/2021/10/12/557764d7-3e6c-4fe9-8836-9fda6e6f5d00/thumbnail/1200x630/0055336953859ee7892609b4849aafdc/generic-fire.jpg?v=8de240724d7f6d8b5f54f62bb158c012,2025-03-02T04:45:12Z,,"Brush fires that erupted amid dry and windy conditions caused officials in both North and South Carolina to order evacuations Saturday. 
 A fire in North Carolina's Polk County was burning at least … [+1644 chars]",,en,'wildfire evacuation'
https://www.foxnews.com/politics/newsom-declares-state-emergency-fast-track-wildfire-measures-after-trump-attacks-over-previous-blazes,https://www.foxnews.com/politics/newsom-declares-state-emergency-fast-track-wildfire-measures-after-trump-attacks-over-previous-blazes,0,www.foxnews.com,Newsom declares state of emergency to 'fast-track' wildfire measures after Trump attacks over previous blazes,California Gov. Gavin Newsom declared a state of emergency on Saturday in a bid to remove red tape blocking funding for wildfire relief efforts.,https://static.foxnews.com/foxnews.com/content/uploads/2025/01/newsom-trump-eo.jpg,2025-03-02T12:59:54Z,,"California Gov. Gavin Newsom declared a state of emergency on Saturday in a bid to fast-track wildfire prevention projects.
Newsom announced the move after President Donald Trump blasted the governo… [+2333 chars]",,en,'wildfire relief'
https://nypost.com/2025/03/02/us-news/gavin-newsom-moves-to-clear-flammable-brush-from-california-forests-after-trumps-criticism-over-wildfire-policies/,https://nypost.com/2025/03/02/us-news/gavin-newsom-moves-to-clear-flammable-brush-from-california-forests-after-trumps-criticism-over-wildfire-policies/,0,nypost.com,Newsom moves to clear flammable brush from California forests after Trump’s criticism over wildfire policies,California Gov. Gavin Newsom tapped into his emergency powers Saturday to relax environmental regulations so that the state can speed up wildfire prevention projects.,https://nypost.com/wp-content/uploads/sites/2/2025/03/99568817.jpg?quality=75&strip=all&w=1024,2025-03-02T15:46:56Z,http://archive.md/20250302232801/https://nypost.com/2025/03/02/us-news/gavin-newsom-moves-to-clear-flammable-brush-from-california-forests-after-trumps-criticism-over-wildfire-policies/,"California Gov. Gavin Newsom tapped into his emergency powers Saturday to roll back environmental regulations so that the state can speed up wildfire prevention projects, including clearing flammable… [+3059 chars]",,en,'forest fire'
https://www.nbcnews.com/weather/wildfires/south-carolina-governor-declares-state-emergency-raging-wildfires-prom-rcna194395,https://www.nbcnews.com/weather/wildfires/south-carolina-governor-declares-state-emergency-raging-wildfires-prom-rcna194395,0,www.nbcnews.com,South Carolina governor declares state of emergency as raging wildfires prompt mass evacuations,A mass of wildfires burning across South Carolina prompted Gov.,"https://media-cldnry.s-nbcnews.com/image/upload/t_nbcnews-fp-1200-630,f_auto,q_auto:best/rockcms/2025-03/250302-south-carolina-wildfire-vl-1106a-2b82ba.jpg",2025-03-02T17:22:22Z,http://archive.md/20250302183124/https://www.nbcnews.com/weather/wildfires/south-carolina-governor-declares-state-emergency-raging-wildfires-prom-rcna194395,"A mass of wildfires burning across South Carolina prompted Gov. Henry McMaster to declare a state of emergency Sunday, as firefighters battled a series of blazes that have already consumed approximat… [+2198 chars]",,en,'wildfire evacuation'
https://www.ibtimes.com/horrifying-video-shows-plane-flying-billowing-smoke-wildfires-carolinas-3765038,https://www.ibtimes.com/horrifying-video-shows-plane-flying-billowing-smoke-wildfires-carolinas-3765038,0,www.ibtimes.com,Horrifying Video Shows Plane Flying Through Billowing Smoke as Wildfires Engulf the Carolinas,"A massive wildfire is engulfing parts of South Carolina, and video shows low-flying planes cruising through the billowing smoke in a desperate attempt to fight the blazes.",https://d.ibtimes.com/en/full/4584938/carolina-wildfires.png,2025-03-02T18:29:20Z,,"A massive wildfire is engulfing parts of North and South Carolina, and a video shows low-flying planes cruising through the billowing smoke in a desperate attempt to fight the blazes in South Carolin… [+1536 chars]",,en,'wildfire'
https://www.newsweek.com/south-north-carolina-wildfires-evacuation-orders-2038437,https://www.newsweek.com/south-north-carolina-wildfires-evacuation-orders-2038437,0,www.newsweek.com,Evacuation Orders in Place Amid Massive South Carolina Wildfires,"Evacuation orders expand as a 1,200-acre wildfire threatens Carolina communities while Gov. McMaster declares a State of Emergency.",https://d.newsweek.com/en/full/2598572/conway-firefighters.png,2025-03-02T19:29:01Z,,"Massive wildfires across the Carolinas have forced evacuations of multiple neighborhoods, particularly in the Carolina Forest area near Myrtle Beach, South Carolina, where a fire has grown to approxi… [+4489 chars]",,en,'wildfire'
https://www.pbs.org/newshour/nation/los-angeles-county-managed-to-cut-homelessness-but-wildfires-threaten-to-erase-those-gains,https://www.pbs.org/newshour/nation/los-angeles-county-managed-to-cut-homelessness-but-wildfires-threaten-to-erase-those-gains,0,www.pbs.org,"Los Angeles County managed to cut homelessness, but wildfires threaten to erase those gains","As Los Angeles recovers from historic wildfires, both previously unsheltered and chronically homeless people are facing even greater instability. Some lawmakers and providers argue now is the time to put in even more resources to maintain the progress the cou…",https://d3i6fh83elv35t.cloudfront.net/static/2025/02/cali-1-1024x831.jpg,2025-03-02T21:18:25Z,,"ALTADENA, Calif. As flames engulfed a nearby canyon, dozens of residents in a sober-living home fled to an unoccupied building about 30 miles south. The evacuees, many of whom were previously homeles… [+10362 chars]",,en,'wildfire'
https://www.breitbart.com/local/2025/03/02/south-carolina-governor-declares-state-of-emergency-in-response-to-wildfires/,https://www.breitbart.com/local/2025/03/02/south-carolina-governor-declares-state-of-emergency-in-response-to-wildfires/,0,www.breitbart.com,South Carolina Governor Declares State of Emergency in Response to Wildfires,"South Carolina Gov. Henry McMaster (R) declared a State of Emergency in response to more than 100 wildfires breaking out in the state that had impacted 4,200 acres.
The post South Carolina Governor Declares State of Emergency in Response to Wildfires appeared…",https://media.breitbart.com/media/2025/03/AP25061715892933-640x335.jpg,2025-03-02T23:43:55Z,http://archive.md/20250303042100/https://www.breitbart.com/local/2025/03/02/south-carolina-governor-declares-state-of-emergency-in-response-to-wildfires/,"South Carolina Gov. Henry McMaster (R) declared a State of Emergency in response to more than 100 wildfires breaking out in the state that had impacted 4,200 acres.
In a press release, McMaster expl… [+2476 chars]",,en,'wildfire'
https://japantoday.com/category/national/japan-deploys-nearly-1-700-firefighters-to-tackle-forest-blaze,https://japantoday.com/category/national/japan-deploys-nearly-1-700-firefighters-to-tackle-forest-blaze,0,japantoday.com,"Japan deploys nearly 1,700 firefighters to tackle wildfire","Nearly 1,700 firefighters are battling Japan's biggest wildfire in three decades, officials said Monday, as some 4,600 residents remain under an evacuation advisory. One person died last week in the blaze in the northern prefecture of Iwate, which follows rec…",,2025-03-03T07:33:16Z,,"Nearly 1,700 firefighters are battling Japan's biggest wildfire in three decades, officials said Monday, as some 4,600 residents remain under an evacuation advisory.
One person died last week in the… [+1308 chars]",,en,'wildfire'
https://www.ibtimes.com/carolinas-wildfires-trigger-state-emergency-south-north-battles-9-active-fires-3765061,https://www.ibtimes.com/carolinas-wildfires-trigger-state-emergency-south-north-battles-9-active-fires-3765061,0,www.ibtimes.com,"Carolinas Wildfires Trigger State Of Emergency In South, North Battles With 9 Active Fires","Wildfires across the Carolinas have prompted a state of emergency in South Carolina amid the raging Myrtle Beach fire, and its neighboring state continues to battle active wildfires even as new fires are being reported.",https://d.ibtimes.com/en/full/4537494/people-watch-wildfire-burns-close-properties-riverside-california-july-21-2024.jpg,2025-03-03T08:39:16Z,,"KEY POINTS
<ul><li>Some 175 fires were estimated to have sparked across South Carolina over the weekend</li><li>Most fires in the south have been contained and several are controlled, but the 1,600-… [+4340 chars]",,en,'wildfire'
https://e360.yale.edu/digest/california-karuk-tribe-cultural-burns,https://e360.yale.edu/digest/california-karuk-tribe-cultural-burns,0,e360.yale.edu,"In a First, California Tribe May Freely Burn Its Ancestral Lands","In California, a state increasingly beset by devastating wildfires, the Karuk Tribe will be able to freely set controlled burns, helping to clear the dense underbrush that fuels larger and more destructive fires.Read more on E360 →",,2025-03-03T13:45:31Z,http://archive.md/20250228172040/https://e360.yale.edu/digest/california-karuk-tribe-cultural-burns,"In California, a state increasingly beset by devastating wildfires, the Karuk Tribe will be able to freely set controlled burns, helping to clear the dense underbrush that fuels larger and more destr… [+1243 chars]",,en,'wildfire'
https://www.newsweek.com/north-south-carolina-wildfires-live-tracker-maps-2038795,https://www.newsweek.com/north-south-carolina-wildfires-live-tracker-maps-2038795,0,www.newsweek.com,North and South Carolina Wildfires: Live Tracker Maps,Fire weather will persist across the Carolinas through Monday morning as firefighters battle fires in both states.,https://d.newsweek.com/en/full/2599282/carolina-wildfire-live-tracker-map.jpg,2025-03-03T17:52:36Z,,"At least one large fire is still burning in the Carolinas following an outburst of wildfires this weekend, and fire weather is expected to persist across both states on Monday.
Newsweek reached out … [+3199 chars]",,en,'wildfire weather'
https://www.newsweek.com/north-south-carolina-wildfire-map-where-fires-could-spread-2038824,https://www.newsweek.com/north-south-carolina-wildfire-map-where-fires-could-spread-2038824,0,www.newsweek.com,North and South Carolina Wildfire Map Shows Where Fires Could Spread,"More than 100 fires erupted across both states over the weekend, burning thousands of acres and prompting evacuations.",https://d.newsweek.com/en/full/2599327/wildfire-maps-show-where-fires-can-spread.jpg,2025-03-03T18:46:55Z,,"Fire weather persists in North Carolina and South Carolina on Monday, spurring concerns that more fires could ignite or those burning could spread further.
Newsweek reached out to the North Carolina… [+2996 chars]",,en,'wildfire weather'
https://www.cbsnews.com/news/carolina-fires-map-where-wildfires-burn-2025/,https://www.cbsnews.com/news/carolina-fires-map-where-wildfires-burn-2025/,0,www.cbsnews.com,Carolina fire maps show where wildfires burn in North and South Carolina,"Follow wildfire updates in North and South Carolina, where blazes erupted over the weekend. The largest stemmed from a forest fire near Myrtle Beach.",https://assets1.cbsnewsstatic.com/hub/i/r/2025/03/03/241d201e-1847-4244-beb8-97b5ae75d2d5/thumbnail/1200x630/ceeb57e2dc76f365464f6f05daa06196/gettyimages-2202548724.jpg?v=63a2b43e2ef8917aa6bd547ca29dd4fa,2025-03-03T20:25:53Z,,"At least 17 wildfires were actively burning Monday in North and South Carolina, where blazes that erupted over the weekend forced evacuations and a state of emergency. The largest of them, in the Car… [+3970 chars]",,en,'wildfire'
