index,published,keyword,domain,language,valid,title,description,url,image,archive,content,quote,de,en,la,added
d3a3a004421c0b3ba2d8b9a39cad9274,2026-02-04T16:46:00Z,'wildfire area',www.globenewswire.com,en,0.7,Team FireSwarm Advances as One of Five Finalists In Autonomous Track of the $11M XPRIZE Wildfire Competition,"Team FireSwarm Advances as One of Five Finalists
In Autonomous Track of the $11M XPRIZE Wildfire Competition...",https://www.globenewswire.com/news-release/2026/02/04/3232307/0/en/Team-FireSwarm-Advances-as-One-of-Five-Finalists-In-Autonomous-Track-of-the-11M-XPRIZE-Wildfire-Competition.html,https://ml.globenewswire.com/Resource/Download/d9a0ee63-dd24-4eeb-acf2-c3480c180a72,http://web.archive.org/web/20260205143056/https://www.globenewswire.com/news-release/2026/02/04/3232307/0/en/Team-FireSwarm-Advances-as-One-of-Five-Finalists-In-Autonomous-Track-of-the-11M-XPRIZE-Wildfire-Competition.html,"SQUAMISH, British Columbia, Feb. 04, 2026 (GLOBE NEWSWIRE) -- FireSwarm Solutions Inc., a Canadian autonomous aerial systems company and the original applicant to the XPRIZE Wildfire competition, tod… [+4854 chars]",,"Team FireSwarm rückt als einer von fünf Finalisten im Autonomous Track des mit 11 Millionen US-Dollar dotierten XPRIZE Wildfire-Wettbewerbs vor. Team FireSwarm rückt als einer von fünf Finalisten vor
Im autonomen Track des mit 11 Millionen US-Dollar dotierten XPRIZE Wildfire-Wettbewerbs ...","Team FireSwarm Advances as One of Five Finalists In Autonomous Track of the $11M XPRIZE Wildfire Competition. Team FireSwarm Advances as One of Five Finalists
In Autonomous Track of the $11M XPRIZE Wildfire Competition...","Quadrigis FireSwarm Promovetur ut One of Quinque Finalists In Autonomi Track of $11M XPRIZ INCAENDIUM Competition. Team FireSwarm Acta ut quinque Finalists
In semita Autonomia $11M XPRIZE INCAENDIUM Competition...",2026-02-11 05:13:43+00:00
2b4d4f6c926f609d3c9414a3d714d317,2026-02-06T18:11:27Z,'wildfire',www.insurancejournal.com,en,0.7,LA Mayor Race Shaken by Wildfire Allegations,"Billionaire Rick Caruso is sticking with his decision to stay out of the race for Los Angeles mayor, despite raising the prospect he would reconsider following a news report that Mayor Karen Bass asked to soften an after-action investigation into …",https://www.insurancejournal.com/news/west/2026/02/06/857279.htm,https://www.insurancejournal.com/app/uploads/2026/02/Rick-Caruso-and-Karen-Bass-Bloomberg.jpg,http://web.archive.org/web/20260206192103/https://www.insurancejournal.com/news/west/2026/02/06/857279.htm,"Billionaire Rick Caruso is sticking with his decision to stay out of the race for Los Angeles mayor, despite raising the prospect he would reconsider following a news report that Mayor Karen Bass ask… [+4238 chars]",,"Rennen um den Bürgermeister von LA durch Waldbrandvorwürfe erschüttert. Der Milliardär Rick Caruso hält an seiner Entscheidung fest, sich aus dem Rennen um das Amt des Bürgermeisters von Los Angeles herauszuhalten, obwohl er die Aussicht auf ein erneutes Überdenken geäußert hat, nachdem Bürgermeisterin Karen Bass darum gebeten hatte, eine nachträgliche Untersuchung zu mildern …","LA Mayor Race Shaken by Wildfire Allegations. Billionaire Rick Caruso is sticking with his decision to stay out of the race for Los Angeles mayor, despite raising the prospect he would reconsider following a news report that Mayor Karen Bass asked to soften an after-action investigation into …","LA Major Race Shaken by Wildfire Allegations. Billionaire Rick Caruso inhaeret cum suo consilio ut Los Angeles Maiorem e stadio maneret, quamvis spem erigeret se retractare sequentem nuntiationem Maiorem Karen Bass quaesivisse ut post-actionem inquisitionis in ... leniret.",2026-02-11 05:13:43+00:00
cbc84e4bf8674eb4708227264f624ec4,2026-02-05T18:58:01Z,'wildfire',www.foxnews.com,en,0.9,Mayor Bass facing blowback over explosive report that she altered wildfire report to downplay city's role,"Los Angeles Mayor Karen Bass allegedly altered a wildfire report to reduce city liability, according to sources. Bass denies interfering with the report.",https://www.foxnews.com/politics/mayor-bass-facing-blowback-over-explosive-report-that-she-altered-wildfire-report-to-downplay-citys-role,https://static.foxnews.com/foxnews.com/content/uploads/2025/10/karen-bass-los-angeles-ice-fox-news.jpg,http://web.archive.org/web/20260206001738/https://www.foxnews.com/politics/mayor-bass-facing-blowback-over-explosive-report-that-she-altered-wildfire-report-to-downplay-citys-role,Los Angeles Mayor Karen Bass is under fire this week after a Los Angeles Times report claiming she successfully altered in her favor a critical after-action report on the devastating southern Califor… [+3950 chars],,"Bürgermeisterin Bass muss wegen des brisanten Berichts, dass sie den Bericht über Waldbrände abgeändert hat, um die Rolle der Stadt herunterzuspielen, Rückschläge hinnehmen. Quellen zufolge hat die Bürgermeisterin von Los Angeles, Karen Bass, angeblich einen Waldbrandbericht geändert, um die Haftung der Stadt zu verringern. Bass bestreitet, sich in den Bericht eingemischt zu haben.","Mayor Bass facing blowback over explosive report that she altered wildfire report to downplay city's role. Los Angeles Mayor Karen Bass allegedly altered a wildfire report to reduce city liability, according to sources. Bass denies interfering with the report.",Major Bassus in ictu per explosivae famam spectantes se ignem ferum mutasse ad munus urbis lasciviae. Los Angeles Mayor Karen Bass dicebatur relationem ignem ferum mutavisse ad redigendum civitatem Rusticis secundum fontes. Tenor negat sese cum Clodio.,2026-02-11 05:13:43+00:00
b184d202a5dcbe34125dd8c0d5ab085b,2026-02-06T19:04:03Z,'wildfire',www.tmz.com,en,0.9,Ski Federation Denies Penis-Injecting Cheating Scandal Impacting Olympics,"The biggest story out of the 2026 Olympics so far has been reports of a penis-injecting doping scandal rocking the ski jumping community ... but officials say so far, it's nothing but a ""wild rumor."" The news spread like wildfire on Thursday ...…
 Permalink",https://www.tmz.com/2026/02/06/ski-federation-denies-penis-injecting-cheating-scandal-impacting-olympics/,https://imagez.tmz.com/image/32/16by9/2026/02/06/32466fce80ad4fc1907ab0aebdce17f2_xl.jpg,http://web.archive.org/web/20260206223748/https://www.tmz.com/2026/02/06/ski-federation-denies-penis-injecting-cheating-scandal-impacting-olympics/,"The biggest story out of the 2026 Olympics so far has been reports of a penis-injecting doping scandal rocking the ski jumping community ... but officials say so far, it's nothing but a ""wild rumor.""… [+1663 chars]",,"Skiverband bestreitet Betrugsskandal um Penisspritzen mit Auswirkungen auf die Olympischen Spiele. Die bisher größte Geschichte der Olympischen Spiele 2026 waren Berichte über einen Penis-Doping-Skandal, der die Skisprung-Gemeinschaft erschütterte … aber die Funktionäre sagen bisher, dass es sich nur um ein „wildes Gerücht“ handelt. Die Nachricht verbreitete sich am Donnerstag wie ein Lauffeuer …
 Permalink","Ski Federation Denies Penis-Injecting Cheating Scandal Impacting Olympics. The biggest story out of the 2026 Olympics so far has been reports of a penis-injecting doping scandal rocking the ski jumping community ... but officials say so far, it's nothing but a ""wild rumor."" The news spread like wildfire on Thursday ...…
 Permalink","Ski Foederatio Denies Penis-injecting CIRCUMDUCTIO scandala Olympia Impacting. Maxima narratio ex Olympia 2026 hucusque rumores coles-iniectio scandali iactando ski saliens communitas fuit ... sed magistratus huc usque dicunt, nihil est nisi ""ferus rumor"". Fama quasi ignem ferum in Iovis ......
 Permalink",2026-02-11 05:13:43+00:00
422774e397aaca6a555ab429c8633502,2026-02-04T20:55:03Z,'wildfire',gizmodo.com,en,0.9,The Western US Is in a Snow Drought. What Comes Next Is Even Scarier,Major snowpack deficits could set the stage for widespread water scarcity and heightened wildfire risk across the American West this summer.,https://gizmodo.com/the-western-us-is-in-a-snow-drought-what-comes-next-is-even-scarier-2000718095,https://gizmodo.com/app/uploads/2026/02/western-US-snow-drought-1200x675.jpg,http://web.archive.org/web/20260204210752/https://gizmodo.com/the-western-us-is-in-a-snow-drought-what-comes-next-is-even-scarier-2000718095,"The mountains of the western United States are looking remarkably brown this winter. The region is facing one of its worst snow droughts in decades, and while the snowsport industry is already feelin… [+3997 chars]",,"Der Westen der USA befindet sich in einer Schneedürre. Was als nächstes kommt, ist noch beängstigender. Große Defizite in der Schneedecke könnten in diesem Sommer die Voraussetzungen für eine weit verbreitete Wasserknappheit und ein erhöhtes Waldbrandrisiko im gesamten amerikanischen Westen schaffen.",The Western US Is in a Snow Drought. What Comes Next Is Even Scarier. Major snowpack deficits could set the stage for widespread water scarcity and heightened wildfire risk across the American West this summer.,US Occidentis in siccitate nix est. Quid sequitur etiam Scarier. Maior nixpack defectuum scaenam ad magnam inopiam aquarum diffusam constituere potuit et periculum ignem augebat per Americanos Occidentales hac aestate.,2026-02-11 20:57:06+00:00
