index,published,keyword,domain,language,valid,title,description,url,image,archive,content,quote
149cb223d2f074075505c75b19825187,2025-10-20T00:27:45Z,'wildfire area',www.cbc.ca,en,0,"Evacuation underway near Ompah, Ont., after wildfire breaks out","An evacuation is underway Sunday evening in the Ompah, Ont., area following reports of a spreading fire, provincial police say.",https://www.cbc.ca/news/canada/ottawa/evacuation-underway-near-ompah-ont-after-fire-breaks-out-9.6944710,"https://i.cbc.ca/ais/1.3662307,1754392686000/full/max/0/default.jpg?im=Crop%2Crect%3D%280%2C0%2C620%2C348%29%3BResize%3D620",,"An evacuation is underway Sunday evening in the Ompah, Ont., area following reports of a spreading wildfire, provincial police say.
OPP announced on social media at around 6 p.m. that they had close… [+601 chars]",
b277509ce5363bea6aebae52ce7f5b82,2025-10-20T00:27:45Z,'wildfire damage',www.cbc.ca,en,0,Wildfire evacuation underway north of Sharbot Lake,"People in the potential path of a wildfire near Ompah in North Frontenac were asked to leave their homes Sunday evening, according to the township and Ontario Provincial Police.",https://www.cbc.ca/news/canada/ottawa/ompah-fire-evecuation-news-updates-9.6944710,"https://i.cbc.ca/ais/5ab22de0-e0c1-4aae-acbd-8abf083e6713,1760965169552/full/max/0/default.jpg?im=Crop%2Crect%3D%2829%2C0%2C1109%2C623%29%3BResize%3D620",,"People in the potential path of a wildfire near Ompah in North Frontenac were asked to leave their homes Sunday evening, according to the township and Ontario Provincial Police.
The township said a … [+883 chars]",
0f85f698572b9e119cdbd5c17884a38d,2025-10-20T06:00:00Z,'wildfire',www.naturalnews.com,en,0,Toxic legacy: How wildfires poison drinking water for years,"Wildfires contaminate water supplies with toxic chemicals like benzene, arsenic and disinfection byproducts, posing long-term health risks. Plastic pipes damaged by heat can leach volatile organic compounds (VOCs) into drinking water, even years after fires. …",https://www.naturalnews.com/2025-10-20-how-wildfires-poison-drinking-water-for-years.html,https://www.naturalnews.com/wp-content/uploads/sites/91/2025/10/Wildfire-Fire-Trees-Smoke.jpg,,"<ul><li>Wildfires contaminate water supplies with toxic chemicals like benzene, arsenic and disinfection byproducts, posing long-term health risks.</li><li>Plastic pipes damaged by heat can leach vol… [+4537 chars]",
2d09b3feea13c833cb4ef5669fadb7f2,2025-10-20T08:53:14Z,'forest fire',www.resilience.org,en,0,The Trump Our Forests Act,"While the human fear of fire is understandable, the political fear of fire—playing it safe with the political winds on a bill that strips citizens of their ability to contest logging on millions of acres of maturing forest—isn’t. For Democrats in particular, …",https://www.resilience.org/stories/2025-10-20/the-trump-our-forests-act/,https://www.resilience.org/wp-content/uploads/2025/10/The_Rim_Fire_in_the_Stanislaus_National_Forest_near_in_California_began_on_Aug._17_2013-0004-1.jpg,,"Americas public forests are in increasing danger. The Fix Our Forest Act (FOFA), which essentially opens up millions of acres of forest to logging in the name of wildfire prevention, is scheduled for… [+5135 chars]",
47aa06b87326265c31fdc74916ba34e2,2025-10-20T08:53:15Z,'wildfire',www.breitbart.com,en,0,Newsom Hides Bailout for Utility Companies; Passes Billions in Costs to Consumers,"California Gov. Gavin Newsom (D) quietly signed legislation last month that will shield local utility companies from responsibility for wildfires and pass billions of dollars in costs to consumers and victims.
The post Newsom Hides Bailout for Utility Compani…",https://www.breitbart.com/politics/2025/10/20/newsom-hides-bailout-for-utility-companies-passes-billions-in-costs-to-consumers/,https://media.breitbart.com/media/2025/08/Gavin-Newsom-Associated-Press-3-640x335.jpg,,California Gov. Gavin Newsom (D) quietly signed legislation last month that will shield local utility companies from responsibility for wildfires and pass billions of dollars in costs to consumers an… [+2251 chars],
c3af3a4d9294108d57a63b6b588ebbe8,2025-10-21T04:00:00Z,'forest fire',www.americanthinker.com,en,0,Senate Bill 1462: Putting Alexa in the Woods,"Congress has already rammed the Fix Our Forests Act through the House. Now it moves to the Senate as Bill 1462 -- and if there were ever a bill that deserved to be doused in cold water, it’s this one.

The premise sounds noble: early wildfire...",https://www.americanthinker.com/articles/2025/10/senate_bill_1462_putting_alexa_in_the_woods.html,https://images.americanthinker.com/ks/ksheby6f4vlyo19dlu52_800.jpg,,"Congress has already rammed the Fix Our Forests Act through the House. Now it moves to the Senate as Bill 1462 -- and if there were ever a bill that deserved to be doused in cold water, it’s this one… [+5023 chars]",
591924e905ca030d4b2d9ee7afa7a4d1,2025-10-21T12:46:14Z,'wildfire insurance',biztoc.com,en,0,California Approves Grant for Homeowners—Find Out If You Qualify,A new legislative package signed into law by California Governor Gavin Newsom will attempt to stabilize the state’s shaky wildfire insurance market and help homeowners who have lost everything in a blaze—as thousands in Los Angeles County did back in January.…,https://biztoc.com/x/644a80c881041fd4,https://biztoc.com/cdn/644a80c881041fd4_s.webp,,A new legislative package signed into law by California Governor Gavin Newsom will attempt to stabilize the states shaky wildfire insurance market and help homeowners who have lost everything in a bl… [+140 chars],
febde6492df8cf00fa1a821e3fde8c14,2025-10-21T15:15:04Z,'wildfire residents',www.cbc.ca,en,0,"North Frontenac wildfire appears contained, road reopens","A wildfire that drove residents from their homes west of Ottawa appears to have stopped spreading, officials in North Frontenac Township said Monday night.",https://www.cbc.ca/news/canada/ottawa/north-frontenac-ompah-fire-closure-evacuate-9.6946736,"https://i.cbc.ca/ais/54ab9582-5d7d-4007-b985-779ef30b65b7,1760965150411/full/max/0/default.jpg?im=Crop%2Crect%3D%287%2C0%2C1157%2C650%29%3BResize%3D620",,"A wildfire that drove residents from their homes west of Ottawa appears to have stopped spreading, officials in North Frontenac Township said Monday night.
The wildfire broke out near Ompah, Ont., o… [+336 chars]",
7f60f439f409dbdb013961b0a8fa8f35,2025-10-22T01:56:56Z,'wildfire',www.cbc.ca,en,0,Longtime Pimicikamak Cree Nation fire chief remembered for 'unwavering courage' in wildfire fight,"Pimicikamak Cree Nation in northern Manitoba is mourning the sudden loss of Raymond McKay, its longtime fire chief, who officials say was a beloved member of the community and instrumental in keeping people safe during this summer’s devastating wildfires.",https://www.cbc.ca/news/canada/manitoba/pimicikamak-cree-nation-fire-chief-raymond-mckay-9.6947950,"https://i.cbc.ca/ais/8056199d-9c7e-4f96-8fe8-f0b6333d9a7f,1761093138175/full/max/0/default.jpg?im=Crop%2Crect%3D%283%2C53%2C1085%2C610%29%3BResize%3D620",,"A northern Manitoba First Nation is mourning the sudden loss of its longtime fire chief, a man officials say was a beloved member of the community and instrumental in keeping people safe during this … [+3028 chars]",
beb5b2b2bfc099a4eedb566dbde8fca4,2025-10-22T08:55:17Z,'wildfire',www.nationalobserver.com,en,0,"The surging price tag of wildfires, in one chart",Wildfires are getting worse — and recovering from them is becoming much more expensive.,https://www.nationalobserver.com/2025/10/22/news/wildfires-worsening-climate-change,https://www.nationalobserver.com/sites/default/files/img/2025/10/10/gettyimages-2192444674.jpeg,,"This story was originally published by Vox and appears here as part of the Climate Desk collaboration
The modern age of burning has been ignited by human hands.
Though wildfires are natural and nec… [+10778 chars]",
183a9b3bf11375d43f9d16ec214f1e1f,2025-10-22T09:40:00Z,'wildfire',www.thestar.com.my,en,0,"Fierce winds stoke fires, bring extreme heat to Australia and New Zealand","WELLINGTON/SYDNEY (Reuters) -Wild, hot winds swept across Australia and New Zealand on Wednesday, fuelling wildfires and sending spring temperatures soaring, breaking October heat records in parts of Sydney. Read full story",https://www.thestar.com.my/news/world/2025/10/22/fierce-winds-stoke-fires-bring-extreme-heat-to-australia-and-new-zealand,https://apicms.thestar.com.my/uploads/images/2025/10/22/3582440.jpg,,"WELLINGTON/SYDNEY (Reuters) -Wild, hot winds swept across Australia and New Zealand on Wednesday, fuelling wildfires and sending spring temperatures soaring, breaking October heat records in parts of… [+2686 chars]",
b72a15d3fa4c5da279405096176bee61,2025-10-22T10:31:00Z,'wildfire insurance',www.wired.com,en,0,Essential Gear for an Emergency Kit—for Cars or Go-Bags,"When disaster strikes, the stores often aren't open. We asked emergency preparedness experts for the essential gear in case of wildfires, earthquakes and lord knows what else.",https://www.wired.com/story/emergency-kit-disaster-preparedness-guide/,"https://media.wired.com/photos/68f8437597b55db8635d5b02/191:100/w_1280,c_limit/What%20Should%20Be%20in%20Your%20Emergency%20Kit%20Before%20Disaster%20Strikes_.png",,"This said, doesnt everyone always have an emergency crate of two dozen extra Maruchan ramen packets? I cannot be alone in this.
Dare we suggest the absolute best flashlight? One that you can drown i… [+6647 chars]",
1c1d277b405c63c7e3bb4f713471f16c,2025-10-22T12:13:02Z,'wildfire',www.nationalobserver.com,en,0,"Parks Canada releases two reports on Jasper fire that confirm cause, development","Two new reports on last year's devastating wildfire in Jasper, Alta., confirm the blaze was caused by lightning and accelerated by ""tornado-force fire-generated"" winds and dry conditions.",https://www.nationalobserver.com/2025/10/22/news/parks-canada-releases-two-reports-jasper-fire-confirm-cause-development,https://www.nationalobserver.com/sites/default/files/img/2025/10/22/7560f73df03cad67eacac08e275f6b3231e3d244feae439c320691d43ba920cb.jpg,,"Two new reports on last year's devastating wildfire in Jasper, Alta., confirm the blaze was caused by lightning and accelerated by ""tornado-force fire-generated"" winds and dry conditions.
The fire, … [+4092 chars]",
2e7ea7901445a2df9198d75c6eb50baa,2025-10-22T19:12:33Z,'wildfire',reason.com,en,0,The Clean Air Act Is Making Our Air Dirtier,Wildfire smoke is bad for your health. Environmental regulations make it worse.,https://reason.com/2025/10/22/the-clean-air-act-is-making-our-air-dirtier/,https://d2eehagpk5cl65.cloudfront.net/img/q60/uploads/2025/10/ahmer-kalam-Reuk1nmutFI-unsplash-scaled-e1761159867884.jpg,,"Ahmer Kalam on Unsplash""
/>



The sky turns a rusty orange. The sun dims behind a thick veil of smoke. For millions of Americans, even ones far from wildfire-prone lands, this eerie scene is no lon… [+5128 chars]",
4d1e075dbea03a804afe5441177469be,2025-10-23T06:44:47Z,'wildfire',www.insurancejournal.com,en,0,"Industry Groups Applaud Bill to Treat Forests, Mitigate Wildfire Risk","Insurance industry trades praised a Senate committee for the passage this week of the Fix Our Forests Act, a measure to address high-risk wildfire regions. “The risk of wildfire can no longer be ignored or underestimated. We need action to …",https://www.insurancejournal.com/news/national/2025/10/23/844812.htm,https://www.insurancejournal.com/app/uploads/2025/03/AdobeStock_940342092-scaled.jpeg,,"Insurance industry trades praised a Senate committee for the passage this week of the Fix Our Forests Act, a measure to address high-risk wildfire regions.
“The risk of wildfire can no longer be ign… [+1913 chars]",
15e4b83abde95e72bebd4e6ad2ac90c0,2025-10-23T17:34:13Z,'wildfire climate change',www.cbc.ca,en,0,Why is Toronto considering burning its waste?,"In this issue of our environmental newsletter, we check into why Toronto is looking into burning its waste; find out why AI is using so much fresh water; and look at a solution that saved dozens of homes from burning in Nova Scotia's wildfires.",https://www.cbc.ca/news/climate/what-on-earth-incineration-9.6950451,"https://i.cbc.ca/ais/1.7141268,1710258641000/full/max/0/default.jpg?im=Crop%2Crect%3D%280%2C0%2C4032%2C2268%29%3BResize%3D620",,"Welcome to our weekly newsletter where we highlight environmental trends and solutions that are moving us to a more sustainable world. 
Hi, its Inayat! Last week, I saw an Instagram post about Toron… [+13673 chars]",
30ce0e5e3efbaa97bc759bfc2f0c7299,2025-10-24T11:45:08Z,'wildfire heat',www.forbes.com,en,0,Building The Resilience Economy: How Seneca’s Firefighting Drones Signal A New Era Of Climate Adaptation,Seneca’s firefighting drones show how adaptation tech is shaping a resilience economy amid rising climate risks and billion-dollar wildfire disasters.,https://www.forbes.com/sites/christophermarquis/2025/10/24/building-the-resilience-economy-how-senecas-firefighting-drones-signal-a-new-era-of-climate-adaptation/,https://imageio.forbes.com/specials-images/imageserve/68fb10d50e46fd90050a2b2a/0x0.jpg?format=jpg&height=900&width=1600&fit=bounds,,"Seneca founder Stu Landesberg stands with the companys autonomous firefighting dronesdesigned to stop wildfires in their critical early minutes.
Seneca
Climate change is no longer a remote future t… [+4506 chars]",
6ade1f53ca527132792c6f04ab8ffa1f,2025-10-24T12:00:00Z,'wildfire residents',www.cbc.ca,en,0,Bamfield Main Road on Vancouver Island set to reopen months after wildfire closure,"The Bamfield Main Road was closed in August due to the Mount Underwood wildfire in August, effectively cutting off the small Vancouver Island community of Bamfield from its next closest city. Locals are now excited for the reopening of the main road.",https://www.cbc.ca/news/canada/british-columbia/bamfield-main-road-port-alberni-bc-reopening-9.6951294,"https://i.cbc.ca/ais/cded40c7-4c90-467d-b9c2-4b179f641b67,1761266261844/full/max/0/default.jpg?im=Crop%2Crect%3D%280%2C15%2C2041%2C1148%29%3BResize%3D620",,"Bamfield Main Road is set to reopen this Friday, after a months-long closure that left the small community of Bamfield on Vancouver Islands west coast effectively cut off from Port Alberni, the next … [+3257 chars]",
9754d80352b3219d7383775bc13db894,2025-10-24T14:36:45Z,'forest fire',scienceblog.com,en,0,Ancient Hunters Torched Europe’s Forests Millennia Before Farms,"Picture an elephant in Ice Age France. Now picture a Neanderthal taking it down with fire and spears. According to new research, those prehistoric hunters",https://scienceblog.com/ancient-hunters-torched-europes-forests-millennia-before-farms/,https://scienceblog.com/wp-content/uploads/2025/10/Quest-For-Fire-poster-2-589x330-1.jpg,,"Picture an elephant in Ice Age France. Now picture a Neanderthal taking it down with fire and spears. According to new research, those prehistoric hunters were not just surviving in Europe’s ancient … [+4526 chars]",
1a9b33b394aa216428b5d5b1fbb613d1,2025-10-24T23:10:11Z,'wildfire area',www.cbc.ca,en,0,Wildfire breaks out in Knox Mountain park near downtown Kelowna,RCMP say they are escorting hikers out of the area.,https://www.cbc.ca/news/canada/british-columbia/knox-mountain-fire-9.6953032,"https://i.cbc.ca/ais/efb8210f-73ee-4848-96e0-be9571f999e8,1750244537002/full/max/0/default.jpg?im=Crop%2Crect%3D%280%2C0%2C1920%2C1080%29%3BResize%3D620",,"Kelowna RCMP have blocked off access to Knox Mountain, a park in a residential area near the city's downtown core, after a wildfire was sparked Friday afternoon.
Police and the fire department are a… [+206 chars]",
6d3345ebb1706ae7cc4a3815a01561eb,2025-10-25T00:32:09Z,'wildfire',financialpost.com,en,0,"Police say one person arrested after wildfire sparked in Kelowna, B.C.","Police in Kelowna, B.C., say one person has been arrested in relation to a wildfire sparked on a mountain slope in the southern Interior city on Friday. RCMP say the person remained in custody as crews worked to douse the flames on Knox Mountain, but they rel…",https://financialpost.com/pmn/police-say-one-person-arrested-after-wildfire-sparked-in-kelowna-b-c,,,"Police in Kelowna, B.C., say one person has been arrested in relation to a wildfire sparked on a mountain slope in the southern Interior city on Friday.
THIS CONTENT IS RESERVED FOR SUBSCRIBERS ONLY… [+3872 chars]",
9dbb23db0499a5f9e155737d02fbede0,2025-10-25T16:28:24Z,'forest fire',indianexpress.com,en,0,"CIDCO land scam row: Shirsat under fire for clearing land deals worth Rs 5,000 crore during tenure as CIDCO chairman","Two forest department letters—dated October 20 and 23—have asked the Panvel and Rasayani police to register offences of cheating, forgery and conspiracy against members of the Bivalkar family and real estate developers.",https://indianexpress.com/article/cities/mumbai/cidco-land-scam-row-shirsat-under-fire-for-clearing-land-deals-worth-rs-5000-crore-during-tenure-as-cidco-chairman-10326960/,https://images.indianexpress.com/2025/10/Sanjay-Shirsat.png,,Maharashtra minister Sanjay Shirsat has found himself embroiled in yet another controversy after the state forest department wrote a letter to the Maharashtra Police to act against real estate develo… [+3741 chars],
713a971ab9b2c0151c86e1fe765d4fd1,2025-10-25T18:03:15Z,'forest fire',northern.starweekly.com.au,en,0,New recruits to increase country firefighting capacity,"Forest Fire Management Victoria’s (FFMVic) newest recruits are gearing up for the summer bushfire season, undertaking intensive training camps across the state. The training camps ensure seasonal forest and fire operations officers are well-prepared to respon…",https://northern.starweekly.com.au/news/new-recruits-to-increase-country-firefighting-capacity/,https://northern.starweekly.com.au/wp-content/uploads/sites/5/2025/10/FireGen_382764_01.jpg,,"Forest Fire Management Victorias (FFMVic) newest recruits are gearing up for the summer bushfire season, undertaking intensive training camps across the state.
The training camps ensure seasonal for… [+1737 chars]",
bfb8f999c5d317fc7d3c72c184445611,2025-10-26T04:04:57Z,'wildfire',www.juancole.com,en,0,How Wildfires and other Climate Disasters put Health Systems under extreme Pressure,"By Bhavini Gohel, University of Calgary (The Conversation) - Wildfires are no longer rare disasters in Canada. They are now an annual reality, and 2025 has already been one of the worst on record, with 3,582 fires burning 6.2 million hectares as of July 30 — …",https://www.juancole.com/2025/10/wildfires-disasters-pressure.html,https://media.juancole.com/images/2025/10/matt-howard-eAKDzK4lo4o-unsplash.jpg,,"By Bhavini Gohel, University of Calgary
(The Conversation) – Wildfires are no longer rare disasters in Canada. They are now an annual reality, and 2025 has already been one of the worst on record, w… [+6152 chars]",
d871eb0bf35a5814a44db19e6a3be9d8,2025-10-28T11:54:47Z,'wildfire',biztoc.com,en,0,Idaho man says he was turned down by nearly 20 insurance companies after his policy was abruptly canceled — here’s why,"Idaho man says he was turned down by nearly 20 insurance companies after his policy was abruptly canceled — here’s why
As wildfire risks intensify across the West, Idaho homeowners are facing an insurance crisis that’s leaving many residents without coverage …",https://biztoc.com/x/be582bfe85e90953,https://biztoc.com/cdn/be582bfe85e90953_s.webp,,"Idaho man says he was turned down by nearly 20 insurance companies after his policy was abruptly canceled heres whyAs wildfire risks intensify across the West, Idaho homeowners are facing an insuranc… [+140 chars]",
4b821c6f07f50f1844ae20fa4ca658ae,2025-10-28T13:08:01Z,'wildfire',www.forbes.com,en,0,Wildfires Spread Nationwide—How AI And Rapid Response Fight Back,"Wildfires are spreading nationwide. AI prediction, rapid-response aircraft, and collaborative land management help protect communities and the grid.",https://www.forbes.com/sites/kensilverstein/2025/10/28/wildfires-spread-nationwide-how-ai-and-rapid-response-fight-back/,https://imageio.forbes.com/specials-images/imageserve/68f55284adf5b1154bd3ccc8/0x0.jpg?format=jpg&height=900&width=1600&fit=bounds,,"388143 03: Part of the Smokejumper team walks toward their aircraft at the North Cascades Smokejumper base April 19, 2001 in the small, north-central Washinton town of Winthrop. This is the earliest … [+6815 chars]",
a6af588c93541a5014d781cec5440475,2025-10-28T15:51:26Z,'forest fire',en.antaranews.com,en,0,Riau deploys waterbombing helicopters to contain hilltop forest fires,Waterbombing helicopters from the Riau Province Regional Disaster Management Agency (BPBD) were deployed to extinguish three forest and land fires in the ...,https://en.antaranews.com/news/388561/riau-deploys-waterbombing-helicopters-to-contain-hilltop-forest-fires,https://cdn.antaranews.com/cache/1200x800/2025/10/28/IMG_20251028_193517.jpg,,"Pekanbaru, (ANTARA) - Waterbombing helicopters from the Riau Province Regional Disaster Management Agency (BPBD) were deployed to extinguish three forest and land fires in the Rambah area, Rokan Hulu… [+1936 chars]",
200d503d1024d09e16750a99434910e8,2025-10-28T16:55:24Z,'forest fire',financialpost.com,en,0,"Wawanesa increases funding to $200,000 for Community Wildfire Prevention Grants","WINNIPEG, Manitoba, Oct. 28, 2025 (GLOBE NEWSWIRE) — In response to escalating wildfire risks across Canada, Wawanesa is increasing the funding available through its Community Wildfire Prevention Grants to $200,000 as the next round of applications opens. Ten…",https://financialpost.com/globe-newswire/wawanesa-increases-funding-to-200000-for-community-wildfire-prevention-grants,,,"WINNIPEG, Manitoba, Oct. 28, 2025 (GLOBE NEWSWIRE) In response to escalating wildfire risks across Canada, Wawanesa is increasing the funding available through its Community Wildfire Prevention Grant… [+5629 chars]",
5e6d360184aa27cdd0414e75a93680b3,2025-10-28T20:38:48Z,'forest fire',environment.yale.edu,en,0,Fire fuels resilience in Florida’s subtropical forests,"Scientists from the Yale School of the Environment discovered that forests in the Everglades bounce back quickly after fires, often surpassing their previous levels of productivity. The research reaffirms the need to continue prescribed burns in the face of a…",https://environment.yale.edu/news/article/fire-fuels-resilience-floridas-subtropical-forests,https://environment.yale.edu/sites/default/files/styles/metatag_1200x630/public/2025-10/Malone-Lab_PineRockland_GM_r1.jpg?h=8555f670&itok=3kfOJucR,,"Listen to Article
In the Florida Everglades, as in other ecosystems, fires help maintain plant and wildlife biodiversity, regeneration of species, and structure, but climate change and shifting land… [+3587 chars]",
1f540491c33806fa95ff8b0d92c71ff0,2025-10-29T03:36:15Z,'wildfire',www.forbes.com,en,0,"Vogue World Holllywood: Kidman, Hamill, Garner, And Connelly Help Out","The great and the good showed for Vogue World Hollywood on October 26, for the magazine's benefit for the victims of California's wildfires.  A good time was had by all.",https://www.forbes.com/sites/guymartin/2025/10/28/vogue-world-holllywood-kidman-hamill-garner-and-connelly-help-out/,"https://imageio.forbes.com/specials-images/imageserve/68ff930fc057146d5801affa/0x0.jpg?format=jpg&crop=2508,1411,x0,y189,safe&height=900&width=1600&fit=bounds",,"LOS ANGELES, CALIFORNIA - OCTOBER 26: Nicole Kidman walks the runway during Vogue World: Hollywood 2025 at Paramount Studios on October 26, 2025 in Los Angeles, California. (Photo by Jerritt Clark/Ge… [+4572 chars]",
f7e6a4c9fa2587a14ed1d1ba1f48a219,2025-10-29T12:25:00Z,'forest fire',www.thestar.com.my,en,0,Fire engulfs 2.4ha of forest in Taman Perdana Heights,PETALING JAYA: A fire broke out inside a forest area within Taman Perdana Heights on Wednesday (Oct 29). Read full story,https://www.thestar.com.my/news/nation/2025/10/29/fire-engulfs-24ha-of-forest-in-taman-perdana-heights,https://apicms.thestar.com.my/uploads/images/2025/10/29/3595589.jpg,,"PETALING JAYA: A fire broke out inside a forest area within Taman Perdana Heights on Wednesday (Oct 29).
When contacted, Selangor Fire and Rescue Department assistant director Ahmad Mukhlis said tha… [+271 chars]",
51aa5b4dcef979ead6d0ac844e1666ee,2025-10-29T15:20:07Z,'forest fire',phys.org,en,0,Fire fuels resilience in Florida's subtropical forests,"Scientists from the Yale School of the Environment discovered that forests in the Everglades bounce back quickly after fires, often surpassing their previous levels of productivity. The research reaffirms the need to continue prescribed burns in the face of a…",https://phys.org/news/2025-10-fuels-resilience-florida-subtropical-forests.html,https://scx2.b-cdn.net/gfx/news/2025/fire-fuels-resilience.jpg,,"Scientists from the Yale School of the Environment discovered that forests in the Everglades bounce back quickly after fires, often surpassing their previous levels of productivity. The research reaf… [+4142 chars]",
