index,published,keyword,domain,language,valid,title,description,url,image,archive,content,quote,de,en,la,added
59a40ef65d0c1a792d030811cb2e6561,2026-03-19T13:00:00Z,'wildfire',www.cbc.ca,en,0.9,How far along is the Jasper rebuild?,"With 16 structures recovered from the 2024 Jasper wildfire so far, municipal officials say the rebuild is right on track. For the owners of the 374 destroyed properties, the rebuild process is diverse. As dozens of new homes go up, the town is using the rebui…",https://www.cbc.ca/news/canada/edmonton/jasper-rebuild-update-infrastructure-year-and-a-half-9.7133860,"https://i.cbc.ca/ais/21625a6d-c0cc-48b8-a646-322190effd6c,1773871299261/full/max/0/default.jpg?im=Crop%2Crect%3D%280%2C535%2C5712%2C3213%29%3BResize%3D620",,"Fourteen households have moved back to the Alberta mountain community of Jasper, about 1½ years since a wildfire destroyed a third of the townsite.
While the vast majority of displaced residents are… [+5786 chars]",,"Wie weit ist der Wiederaufbau von Jasper fortgeschritten? Da bisher 16 Gebäude nach dem Waldbrand in Jasper im Jahr 2024 wiederhergestellt wurden, sagen Gemeindebeamte, dass der Wiederaufbau auf dem richtigen Weg sei. Für die Eigentümer der 374 zerstörten Immobilien ist der Wiederaufbauprozess vielfältig. Während Dutzende neuer Häuser entstehen, nutzt die Stadt die Wiederaufbau…","How far along is the Jasper rebuild?. With 16 structures recovered from the 2024 Jasper wildfire so far, municipal officials say the rebuild is right on track. For the owners of the 374 destroyed properties, the rebuild process is diverse. As dozens of new homes go up, the town is using the rebui…","Quam longe est aedificata Jaspis? Cum 16 structurae ab anno 2024 Jaspis incendium incendium recuperarunt tantum, magistratus municipales in vestigio reficere dicunt. Nam possessores 374 possessiones destruentes, processus reaedificandi diversus est. Cum justo novarum domorum ascendunt, oppidum rebui utitur…",2026-03-23 09:14:18+00:00
2173abb2ef84f10991c1c4b6107185a8,2026-03-17T00:00:00Z,'wildfire',www.nature.com,en,0.9,The Kananaskis Wildfire Charter: a good start,"The Kananaskis Wildfire Charter marks an important step toward addressing increasingly extreme wildfires. Attending to complex drivers, supporting Indigenous and local fire stewardship, and shifting toward integrated fire management will help ensure equitable…",https://www.nature.com/articles/s41467-026-70040-y,,,"<li>Department of Geography, Royal Holloway, University of London, Egham, UK
Kapil Yadav, Adriana Ford, William Hayes, Jayalaxshmi Mistry &amp; Cathy Smith
</li><li>Department of Geography, Kings C… [+1051 chars]",,"Die Kananaskis Wildfire Charter: ein guter Anfang. Die Kananaskis-Wildfire-Charta ist ein wichtiger Schritt zur Bekämpfung der zunehmend extremen Waldbrände. Die Betreuung komplexer Treiber, die Unterstützung indigener und lokaler Brandschutzmaßnahmen und die Umstellung auf ein integriertes Brandmanagement werden dazu beitragen, eine gerechte… zu gewährleisten.","The Kananaskis Wildfire Charter: a good start. The Kananaskis Wildfire Charter marks an important step toward addressing increasingly extreme wildfires. Attending to complex drivers, supporting Indigenous and local fire stewardship, and shifting toward integrated fire management will help ensure equitable…","Kananaskis Wildfire Charter: bonum initium. Kananaskis Wildfire Chartam magni momenti notat gradus ad extremas flammas magis magisque compellans. Attendentes multiplicibus rectoribus, villicationem ignis indigenos et locales sustinentes, et ad incendia integrata mobilia procurationem adiuvabunt aequam…",2026-03-23 15:16:05+00:00
6c11f6fc667e6a03707a4f82f661dab3,2026-03-16T19:07:50Z,'wildfire buildings',theconversation.com,en,0.3,"In war-torn Iran, air pollution from burning oil depots and bombed buildings unleashes invisible health threats",The damage from military attacks on cities can fill the air with pollutants that harm the lungs and stress the heart.,https://theconversation.com/in-war-torn-iran-air-pollution-from-burning-oil-depots-and-bombed-buildings-unleashes-invisible-health-threats-278407,https://images.theconversation.com/files/724070/original/file-20260316-85-gqdjy2.jpg?ixlib=rb-4.1.0&rect=0%2C745%2C2298%2C1149&q=45&auto=format&w=1356&h=668&fit=crop,http://web.archive.org/web/20260317100703/https://theconversation.com/in-war-torn-iran-air-pollution-from-burning-oil-depots-and-bombed-buildings-unleashes-invisible-health-threats-278407,"A woman sifts through the rubble in her home after it was damaged by a missile on March 15, 2026, in Tehran. Majid Saeedi/Getty Images
The waves of U.S. and Israeli bomb strikes in Tehran and Beirut… [+7052 chars]",,"Im vom Krieg zerrissenen Iran setzt die Luftverschmutzung durch brennende Öldepots und bombardierte Gebäude unsichtbare Gesundheitsgefahren frei. Der Schaden durch militärische Angriffe auf Städte kann die Luft mit Schadstoffen füllen, die die Lunge schädigen und das Herz belasten.","In war-torn Iran, air pollution from burning oil depots and bombed buildings unleashes invisible health threats. The damage from military attacks on cities can fill the air with pollutants that harm the lungs and stress the heart.","In Irania bello scissa, aer pollutio ex vectibus olei ardentis et aedificia bombeda minas sanitatis invisibilis concitat. Damnum ab oppugnationibus militaribus in urbes aerem inquinantibus implere possunt, qui pulmoni nocent et cor inferunt.",2026-03-23 20:55:38+00:00
da336c9ef5d1a69d42372638fe2ed2ec,2026-03-17T11:20:00Z,'wildfire',www.newser.com,en,0.9,Nebraska Fighting Biggest Wildfires in State History,"Nebraska is grappling with the largest wildfire event in its recorded history, with four blazes scorching nearly 750,000 acres across the state and leaving one person dead, per USA Today . As of Monday, the Morrill, Cottonwood, Anderson Bridge, and Road 203 f…",https://www.newser.com/story/385542/nebraska-fighting-biggest-wildfires-in-state-history.html,https://img1-azrcdn.newser.com/image/1671650-12-20260317062002.jpeg,,"Nebraska is grappling with the largest wildfire event in its recorded history, with four blazes scorching nearly 750,000 acres across the state and leaving one person dead, per USA Today. As of Monda… [+1299 chars]",,"Nebraska kämpft gegen die größten Waldbrände in der Geschichte des Bundesstaates. Laut USA Today kämpft Nebraska mit dem größten Waldbrandereignis in seiner aufgezeichneten Geschichte. Vier Brände versengten fast 750.000 Hektar im ganzen Staat und forderten laut USA Today einen Todesfall. Ab Montag sind die Strecken Morrill, Cottonwood, Anderson Bridge und Road 203 …","Nebraska Fighting Biggest Wildfires in State History. Nebraska is grappling with the largest wildfire event in its recorded history, with four blazes scorching nearly 750,000 acres across the state and leaving one person dead, per USA Today . As of Monday, the Morrill, Cottonwood, Anderson Bridge, and Road 203 f…","Nebraska Fighting Maximus Wildfires in State History. Nebraska iniecta est cum maximo incendii ignivomo in historia sua scripta, cum quattuor ardoribus paene 750,000 iugerum per statum exurens et unum hominem mortuum relinquens, hodie per USA. Sicut Lunae, Morrill, Cottonwood, Anderson Bridge, et Road 203 f.",2026-03-24 05:04:46+00:00
68f8dc304afbc5c181cbbd1dcb07a677,2026-03-17T19:05:00Z,'wildfire',www.cbc.ca,en,0.9,Province was ‘challenged’ helping Lytton rebuild after destructive 2021 wildfire: auditor general,"In a report published Tuesday, the auditor general said the province has struggled to support Lytton's “complex and unprecedented” recovery needs, to oversee any provincially funded recovery activities and to ensure the Nlaka’pamux Nation was a partner in the…",https://www.cbc.ca/news/canada/british-columbia/auditor-general-report-province-lytton-rebuild-9.7132187,"https://i.cbc.ca/ais/1.7248118,1719782059000/full/max/0/default.jpg?im=Crop%2Crect%3D%280%2C375%2C4032%2C2268%29%3BResize%3D620",,"Nearly five years after the village of Lytton, B.C., was destroyed by wildfire, the province's auditor general says the province was challenged in several ways as it attempted to support the communit… [+1600 chars]",,"Provinz wurde „herausgefordert“, Lytton beim Wiederaufbau nach dem verheerenden Waldbrand 2021 zu unterstützen: Auditor General. In einem am Dienstag veröffentlichten Bericht sagte der Auditor General, die Provinz habe Mühe gehabt, Lyttons „komplexen und beispiellosen“ Sanierungsbedarf zu unterstützen, alle von der Provinz finanzierten Sanierungsaktivitäten zu überwachen und sicherzustellen, dass die Nlaka’pamux-Nation ein Partner in der… sei.","Province was ‘challenged’ helping Lytton rebuild after destructive 2021 wildfire: auditor general. In a report published Tuesday, the auditor general said the province has struggled to support Lytton's “complex and unprecedented” recovery needs, to oversee any provincially funded recovery activities and to ensure the Nlaka’pamux Nation was a partner in the…","Provincia provocata est adiutrix Lytton reaedificanda post perniciosam 2021 ignem ferum: auditor generalis. In relatione Martis publicata, auditor generalis provincia dixit subsidia ""complexa et inaudita"" necessitates recuperare Lytton, ut curarent quaslibet actiones recuperationis provincialis fundendae et ut Nlaka'pamux Natione particeps esset in ...",2026-03-24 05:04:46+00:00
c2dc6e13bd804f09c1719fb31c955f68,2026-03-17T20:04:23Z,'wildfire residents',financialpost.com,en,0.9,Report examines provincial role in Village of Lytton’s recovery from 2021 wildfire,"VICTORIA, British Columbia, March 17, 2026 (GLOBE NEWSWIRE) — The Office of the Auditor General has concluded its independent examination of the provincial government’s role in the Village of Lytton’s recovery from the wildfire that swept through the area on …",https://financialpost.com/globe-newswire/report-examines-provincial-role-in-village-of-lyttons-recovery-from-2021-wildfire,https://smartcdn.gprod.postmedia.digital/financialpost/wp-content/uploads/2026/03/bridget-parrish-auditor-general-press-conference-2.jpeg,,"VICTORIA, British Columbia, March 17, 2026 (GLOBE NEWSWIRE) The Office of the Auditor General has concluded its independent examination of the provincial governments role in the Village of Lyttons re… [+5229 chars]",,"Der Bericht untersucht die Rolle der Provinz bei der Erholung des Dorfes Lytton nach dem Waldbrand im Jahr 2021. VICTORIA, British Columbia, 17. März 2026 (GLOBE NEWSWIRE) – Das Büro des Auditor General hat seine unabhängige Prüfung der Rolle der Provinzregierung bei der Erholung des Dorfes Lytton nach dem Waldbrand abgeschlossen, der am …","Report examines provincial role in Village of Lytton’s recovery from 2021 wildfire. VICTORIA, British Columbia, March 17, 2026 (GLOBE NEWSWIRE) — The Office of the Auditor General has concluded its independent examination of the provincial government’s role in the Village of Lytton’s recovery from the wildfire that swept through the area on …","Relatio munus provinciarum in Village de Lytton de recuperatione 2021 ignis ferum examinat. VICTORIA, British Columbia, die 17 Martii 2026 (GLOBE NEWSWIRE) - Officium Auditoris Generalis suum independentem examen conclusit munus recuperationis provincialis in Villa de Lytton ab igne igneo per aream in …",2026-03-24 05:04:46+00:00
2ccbf2c52852260f1db609b04018f544,2026-03-19T23:58:37Z,'wildfire',www.cbc.ca,en,0.9,"Kamloops offers free home FireSmart assessments, rebates for homeowners","Kamloops Fire Rescue educator Josh Cowen said firefighters are “quite concerned” about the possibility of wildfire in the city, particularly if a blaze on the outskirts of town sparks embers that land in yards, starting spot fires.",https://www.cbc.ca/news/canada/british-columbia/kamloops-firesmart-assessments-9.7135555,"https://i.cbc.ca/ais/1.7572339,1750991091000/full/max/0/default.jpg?im=Crop%2Crect%3D%281%2C0%2C1810%2C1018%29%3BResize%3D620",,"In advance of what is expected to be a hot summer, the City of Kamloops is encouraging homeowners to request a free assessment of their properties to make sure they are resilient in the face of wildf… [+2281 chars]",,"Kamloops bietet kostenlose FireSmart-Bewertungen für Privathaushalte und Rabatte für Hausbesitzer. Josh Cowen, Ausbilder für Brandrettung in Kamloops, sagte, die Feuerwehrleute seien „ziemlich besorgt“ über die Möglichkeit eines Waldbrandes in der Stadt, insbesondere wenn ein Feuer am Rande der Stadt Glut entfacht, die in Höfen landet und punktuelle Brände auslöst.","Kamloops offers free home FireSmart assessments, rebates for homeowners. Kamloops Fire Rescue educator Josh Cowen said firefighters are “quite concerned” about the possibility of wildfire in the city, particularly if a blaze on the outskirts of town sparks embers that land in yards, starting spot fires.","Kamloops praebet liberum domum FireSmart censibus, adipisicing elit. Kamloops Ignis Eripe educator Josh Cowen dixit fire pugnatores ""satis solliciti esse"" de possibilitate incendii in urbe, praesertim si ignis in extrema parte urbis scintillae ardentes illam terram in bortis ardentibus incendiis maculam incipiant.",2026-03-24 05:04:46+00:00
9e543a84baeec13267b2be7649dcd0d7,2026-03-20T15:59:00Z,'wildfire donation',www.portlandmercury.com,en,0.3,"Good Morning, News: Chuck Norris Dies, City Councilor Sends Very Spicy Emails, Homeless Services Org Needs Support After Four Recent Fires, and Buzzfeed Let AI Prompt Its Downfall","by Jeremiah Hayden
 
 
 
 If you appreciate the Mercury's interesting and useful news & culture reporting, consider making a small monthly contribution to support our editorial team. Your donation is tax-deductible. You can also subscribe and have our papers …",https://www.portlandmercury.com/good-morning-news/2026/03/20/48391828/good-morning-news-chuck-norris-dies-city-councilor-sends-very-spicy-emails-homeless-services-org-needs-support-after-four-recent-fires-an,https://media1.fdncms.com/portmerc/imager/u/large/48391866/10876588874_f4bdeee110_o.webp,http://web.archive.org/web/20260321014753/https://www.portlandmercury.com/good-morning-news/2026/03/20/48391828/good-morning-news-chuck-norris-dies-city-councilor-sends-very-spicy-emails-homeless-services-org-needs-support-after-four-recent-fires-an,"If you appreciate the Mercury's interesting and useful news &amp; culture reporting, consider making a small monthly contribution to support our editorial team. Your donation is tax-deductible. You c… [+8886 chars]",,"Guten Morgen, Neuigkeiten: Chuck Norris ist gestorben, Stadtrat sendet sehr scharfsinnige E-Mails, Obdachlosenhilfeorganisation braucht Unterstützung nach vier jüngsten Bränden und Buzzfeed lässt KI ihren Untergang herbeiführen. von Jeremiah Hayden
 
 
 
 Wenn Sie die interessanten und nützlichen Nachrichten- und Kulturberichte von Mercury zu schätzen wissen, denken Sie darüber nach, einen kleinen monatlichen Beitrag zur Unterstützung unseres Redaktionsteams zu leisten. Ihre Spende ist steuerlich absetzbar. Sie können unsere Beiträge auch abonnieren …","Good Morning, News: Chuck Norris Dies, City Councilor Sends Very Spicy Emails, Homeless Services Org Needs Support After Four Recent Fires, and Buzzfeed Let AI Prompt Its Downfall. by Jeremiah Hayden
 
 
 
 If you appreciate the Mercury's interesting and useful news & culture reporting, consider making a small monthly contribution to support our editorial team. Your donation is tax-deductible. You can also subscribe and have our papers …","Salve, News: Chuck Norris Dies, urbs Consiliarius mittit CONDITUS Emails, profugo Services Org eget Support Post quattuor recentes ignes, et Buzzfeed AI promptum ruinam. Ieremias Hayden
 
 
 
 Si aestimas Mercurium studium et utilem nuntium & culturam renuntiationem, considera parvam menstruam contributionem ad nostram editoriam bigam sustinendam. Tua donatio publicani eleifend est. Scribere etiam potes et chartas nostras habere.",2026-03-24 09:09:45+00:00
b84a52976b3c53b2862028eb64ed04b7,2026-03-17T04:06:14Z,'wildfire health',www.juancole.com,en,0.2,The US-Israeli Strikes on Tehran Oil Depots unleash Invisible Health Threats,"These pollutants can harm the lungs, making breathing difficult, and worsen cardiovascular problems, contributing to heart attacks",https://www.juancole.com/2026/03/israeli-strikes-invisible.html,https://media.juancole.com/images/2026/03/nourieh-ferdosian-Pw-UzTYWDU-unsplash.jpg,http://web.archive.org/web/20260318150321/https://www.juancole.com/2026/03/israeli-strikes-invisible.html,"By Armin Sorooshian, University of Arizona
(The Conversation) – The waves of U.S. and Israeli bomb strikes in Tehranand Beirut, and Irans missile and drone attacks on neighboring countries in respon… [+6326 chars]",,"Die amerikanisch-israelischen Angriffe auf Teheraner Öldepots lösen unsichtbare Gesundheitsgefahren aus. Diese Schadstoffe können die Lunge schädigen, das Atmen erschweren, Herz-Kreislauf-Probleme verschlimmern und zu Herzinfarkten führen","The US-Israeli Strikes on Tehran Oil Depots unleash Invisible Health Threats. These pollutants can harm the lungs, making breathing difficult, and worsen cardiovascular problems, contributing to heart attacks","US-Israeli percutit Tehran Oleum Depots evellere Invisibiles Salutem Minas. Hae polluentes pulmoni nocere possunt, difficiles anhelantes, difficultates cardiovasculares peiorantes, cordis impetus adiuvantes",2026-03-25 05:04:59+00:00
7adf06fe141563d1b1d6fda061766fc8,2026-03-17T18:49:34Z,'wildfire health',www.insurancejournal.com,en,0.3,"Los Angeles, US West Brace for Second Bout of Record March Heat","Los Angeles and the U.S. Southwest are set for a second record heat wave in two weeks as temperatures soar, potentially straining electric grids, melting snowpack and raising health risks. Tuesday’s high in downtown Los Angeles is forecast to reach …",https://www.insurancejournal.com/news/west/2026/03/17/862309.htm,https://www.insurancejournal.com/img/social/opengraph/ij-social-default-1200x630.png,,"Los Angeles and the U.S. Southwest are set for a second record heat wave in two weeks as temperatures soar, potentially straining electric grids, melting snowpack and raising health risks.
Tuesday’s… [+2363 chars]",,"Los Angeles, US-West bereitet sich auf den zweiten Rekordkampf im März vor. Los Angeles und der Südwesten der USA stehen vor einer zweiten Rekordhitzewelle innerhalb von zwei Wochen, da die Temperaturen in die Höhe schnellen, die Stromnetze möglicherweise überlasten, die Schneedecke schmilzt und die Gesundheitsrisiken steigen. Das Hoch am Dienstag in der Innenstadt von Los Angeles wird voraussichtlich … erreichen.","Los Angeles, US West Brace for Second Bout of Record March Heat. Los Angeles and the U.S. Southwest are set for a second record heat wave in two weeks as temperatures soar, potentially straining electric grids, melting snowpack and raising health risks. Tuesday’s high in downtown Los Angeles is forecast to reach …","Los Angeles, US West Brace pro Secundo Bout Record Martii Caloris. Los Angeles et Americae Africus ponuntur pro secunda record unda caloris in duabus septimanis sicut temperaturas adsurgunt, potentia eliquationes electricas nitentes, snowpack et periculum salutis solvens. Martis celsus in urbe Los Angeles prospicere praevidet...",2026-03-25 05:04:59+00:00
abf9805ab67c15d43666ce4c1d051c51,2026-03-22T11:00:00Z,'wildfire area',www.cbc.ca,en,0.9,Wildfire evacuations can be stressful. Here's how Albertans can prepare,"In 2025, 44 per cent of people felt unprepared for emergencies, according to a provincial survey. As the snow starts to melt, Albertans are wondering how to prepare to evacuate this wildfire season.",https://www.cbc.ca/news/canada/edmonton/wildfire-disaster-preparedness-9.7135569,"https://i.cbc.ca/ais/591aa6ef-3259-4fa4-a38a-fb1b8d07a483,1773961541675/full/max/0/default.jpg?im=Crop%2Crect%3D%280%2C133%2C7008%2C3942%29%3BResize%3D620",,"Wildfire season has officially started in Alberta. As the snow starts to melt, people are starting to wonder: Will I have to evacuate this year? 
Over the last 10 years, there have been several larg… [+3768 chars]",,"Evakuierungen aufgrund von Waldbränden können stressig sein. So können sich Albertaner vorbereiten. Laut einer Provinzumfrage fühlten sich im Jahr 2025 44 Prozent der Menschen nicht auf Notfälle vorbereitet. Während der Schnee zu schmelzen beginnt, fragen sich die Albertaner, wie sie sich auf die Evakuierung in dieser Waldbrandsaison vorbereiten können.","Wildfire evacuations can be stressful. Here's how Albertans can prepare. In 2025, 44 per cent of people felt unprepared for emergencies, according to a provincial survey. As the snow starts to melt, Albertans are wondering how to prepare to evacuate this wildfire season.","INCAENDIUM purgationes esse stressful. Ecce quomodo Albertans parare potest. Anno 2025, 44 centesimae hominum ob casus imparatos senserunt, secundum circumspectionem provincialem. Sicut nix incipit tabescere, Albertans mirantur quomodo praeparant hanc ignem ferum evacuare.",2026-03-25 05:04:59+00:00
6e27ea88c9feda68d88adf058470a4b9,2026-03-15T16:11:01Z,'wildfire',financialpost.com,en,0.9,"Wild Weather Halts Flights, Dumps Snow and Knocks Out Power","Blizzards, wildfires and thunderstorms swirling toward the eastern US have knocked out power to thousands and grounded hundreds of flights across the Midwest.",https://financialpost.com/pmn/business-pmn/wild-weather-halts-flights-dumps-snow-and-knocks-out-power,,,"(Bloomberg) Blizzards, wildfires and thunderstorms swirling toward the eastern US have knocked out power to thousands and grounded hundreds of flights across the Midwest.
THIS CONTENT IS RESERVED FO… [+5162 chars]",,"Wildes Wetter stoppt Flüge, wirft Schnee ab und schaltet den Strom aus. Schneestürme, Waldbrände und Gewitter, die auf den Osten der USA zusteuern, haben im gesamten Mittleren Westen zu Tausenden Stromausfällen und Hunderten Flugverboten geführt.","Wild Weather Halts Flights, Dumps Snow and Knocks Out Power. Blizzards, wildfires and thunderstorms swirling toward the eastern US have knocked out power to thousands and grounded hundreds of flights across the Midwest.","Ferae Tempestas consistit Volatus, Dumps Nix et Pulsat Potentiam. Blizzards, incendia et tonitrua ad US orientalem inundans vim ad mille emiserunt et centenis volatibus per Midwest fundaverunt.",2026-04-08 15:44:17+00:00
9dbf99271e5a50867f71675bbbb79a3d,2026-03-19T19:58:43Z,'wildfire',financialpost.com,en,0.9,Alberta Utilities Collaborating to Reduce Wildfire Risk and Increase Resilience,"CALGARY, Alberta — With wildfire season underway, three Alberta electric utilities are working together to deliver the safe, reliable electricity that Albertans depend on. The Government of Alberta’s recently released Alberta Wildfire Mitigation Strategy high…",https://financialpost.com/pmn/business-wire-news-releases-pmn/alberta-utilities-collaborating-to-reduce-wildfire-risk-and-increase-resilience,,,"CALGARY, Alberta With wildfire season underway, three Alberta electric utilities are working together to deliver the safe, reliable electricity that Albertans depend on.
THIS CONTENT IS RESERVED FOR… [+7738 chars]",,"Alberta Utilities arbeitet zusammen, um das Risiko von Waldbränden zu verringern und die Widerstandsfähigkeit zu erhöhen. CALGARY, Alberta – Während die Waldbrandsaison im Gange ist, arbeiten drei Stromversorger in Alberta zusammen, um den Einwohnern Albertas den sicheren und zuverlässigen Strom zu liefern, auf den sie angewiesen sind. Die kürzlich von der Regierung von Alberta veröffentlichte „Alberta Wildfire Mitigation Strategy“ ist hoch…","Alberta Utilities Collaborating to Reduce Wildfire Risk and Increase Resilience. CALGARY, Alberta — With wildfire season underway, three Alberta electric utilities are working together to deliver the safe, reliable electricity that Albertans depend on. The Government of Alberta’s recently released Alberta Wildfire Mitigation Strategy high…","Alberta Utilitas Collaborating ad redigendum INCAENDIUM Risk et Resilience auge. CALGARY, Alberta — Ignis tempore comparato, tres Alberta utilitates electricas simul laborant ad liberandam electricitatem tutae, certae, quae ab Albertans dependet. Gubernatio Albertae nuper Alberta Wildfire Mitigationis Strategy altam dimisit...",2026-04-08 15:44:17+00:00
