index,published,keyword,domain,language,valid,title,description,url,image,archive,content,quote,de,en,la,added
763fd23c7315ae7e5abc4c79715c7127,2026-03-03T01:50:03Z,'wildfire',www.siskiyou.news,en,0.9,Urgent Call to Shift Wildfire Management Practices to Protect Public Health and Safety in Siskiyou County,"Post Views: 294 Public Letter for disclosure/publishing – March 1, 2026 Dear Members of the Board of Supervisors, Sheriff LaRue, and Concerned Officials: I am writing as a resident and advocate for wildfire prevention in Siskiyou County CA to bring attention …",https://www.siskiyou.news/2026/03/02/urgent-call-to-shift-wildfire-management-practices-to-protect-public-health-and-safety-in-siskiyou-county/,https://www.siskiyou.news/wp-content/uploads/2026/03/Bill-on-fire-line-3-1-e1772501315993.jpg,,"Public Letter for disclosure/publishing – March 1, 2026
Dear Members of the Board of Supervisors, Sheriff LaRue, and Concerned Officials:
I am writing as a resident and advocate for wildfire preven… [+4129 chars]",,"Dringender Aufruf zur Änderung der Waldbrandmanagementpraktiken zum Schutz der öffentlichen Gesundheit und Sicherheit im Kreis Siskiyou. Aufrufe des Beitrags: 294 Öffentlicher Brief zur Offenlegung/Veröffentlichung – 1. März 2026 Liebe Mitglieder des Aufsichtsrats, Sheriff LaRue und betroffene Beamte: Ich schreibe als Anwohner und Verfechter der Waldbrandprävention im Siskiyou County, Kalifornien, um Aufmerksamkeit zu erregen …","Urgent Call to Shift Wildfire Management Practices to Protect Public Health and Safety in Siskiyou County. Post Views: 294 Public Letter for disclosure/publishing – March 1, 2026 Dear Members of the Board of Supervisors, Sheriff LaRue, and Concerned Officials: I am writing as a resident and advocate for wildfire prevention in Siskiyou County CA to bring attention …","Urgente voca ad Shift INCAENDIUM Management Exercitia ad tuendam publicam salutem et incolumitatem in Siskiyou Comitatus. Post Sententias: 294 Litterae publicae aperiendae/enuntiandae - 1 Martii 2026 Dilecti Socii Tabulae Supervisores, Vicecomitis LaRue, ac Officiales versantes: incola et advocatus incendium introductum in Siskiyou comitatu CA scribo ne operam ...",2026-03-04 04:51:41+00:00
71d437e949a4e079ede4b14122af5993,2026-03-03T19:29:53Z,'bushfire',www.abc.net.au,en,0.9,"Aged care bushfire evacuation plans are unrealistic, union warns","The vast majority of aged care facilities would be unable to evacuate in the case of a bushfire, according to the Australian Workers Union.",https://www.abc.net.au/news/2026-03-04/fire-evacuation-aged-care-nursing-homes-united-workers-union/106346780,https://live-production.wcms.abc-cdn.net.au/77df892438a8d6e95a7dccdc24d13b58?impolicy=wcms_watermark_news&cropH=1080&cropW=1920&xPos=0&yPos=0&width=862&height=485&imformat=generic,,"Australian aged care homes are inadequately prepared to evacuate in a bushfire, according to a union representing aged care workers.
In January, more than 30 residents and staff at Natimuk Aged Care… [+6198 chars]",,"Pläne zur Evakuierung von Buschbränden in der Altenpflege sind unrealistisch, warnt die Gewerkschaft. Nach Angaben der Australian Workers Union wäre die überwiegende Mehrheit der Altenpflegeeinrichtungen im Falle eines Buschfeuers nicht in der Lage, ihre Häuser zu evakuieren.","Aged care bushfire evacuation plans are unrealistic, union warns. The vast majority of aged care facilities would be unable to evacuate in the case of a bushfire, according to the Australian Workers Union.","Anus cura decedere bushfire consilia unio unio unrealistica esse monet. Magna pars aetatis curarum facilitatum in casu fruticis decedere non posset, secundum Unionem operarios Australiae.",2026-03-05 09:01:19+00:00
e3a3d16125fe1f76d821f03cef1b6832,2026-03-03T04:57:02Z,'wildfire',cleantechnica.com,en,0.9,New Berkshire Hathaway CEO Ignores Financial Risks of Fossil Fuels in First Letter to Shareholders,"OMAHA, Nebraska — In his first letter to shareholders as Berkshire Hathaway CEO, Greg Abel acknowledged that rising electricity demand and more frequent wildfires will impact the delivery of affordable and reliable energy to customers. He also noted that “the…",https://cleantechnica.com/2026/03/02/new-berkshire-hathaway-ceo-ignores-financial-risks-of-fossil-fuels-in-first-letter-to-shareholders/,https://cleantechnica.com/wp-content/uploads/2023/04/Fossil-Fuels-Coal-CleanTechnica-Watermark.png,,"Support CleanTechnica's work through a Substack subscription or on Stripe.
OMAHA, Nebraska  In his first letter to shareholders as Berkshire Hathaway CEO, Greg Abel acknowledged that rising electric… [+2402 chars]",,"Der CEO von New Berkshire Hathaway ignoriert im ersten Brief an die Aktionäre die finanziellen Risiken fossiler Brennstoffe. OMAHA, Nebraska – In seinem ersten Brief an die Aktionäre als CEO von Berkshire Hathaway räumte Greg Abel ein, dass der steigende Strombedarf und häufigere Waldbrände die Versorgung der Kunden mit erschwinglicher und zuverlässiger Energie beeinträchtigen werden. Er bemerkte auch, dass „die…“","New Berkshire Hathaway CEO Ignores Financial Risks of Fossil Fuels in First Letter to Shareholders. OMAHA, Nebraska — In his first letter to shareholders as Berkshire Hathaway CEO, Greg Abel acknowledged that rising electricity demand and more frequent wildfires will impact the delivery of affordable and reliable energy to customers. He also noted that “the…","Novi Berk Hathaway CEO Neglecta Financial Pericula Fossilia Fuels in Prima Epistula ad Socios. OMAHA, Nebraska – In prima epistula ad socios Berk Hathaway CEO, Greg Abel agnovit electricitatem ortu exigere ac frequentiores incendia incussurum esse traditio parabilis ac certa industria clientibus. Etiam notandum est quod “…",2026-03-06 04:52:39+00:00
0a4db9a08fdf0ba395844291998584ec,2026-03-02T14:38:41Z,'wildfire',environment.yale.edu,en,0.9,Mapping the future of wildfires in a warming world,YSE Senior Research Scientist Jennifer Marlon was part of an international team that combined global fire data and climate models to identify gaps in wildfire risk projections and outline a framework to better inform long-term planning.,https://environment.yale.edu/news/article/mapping-future-wildfires-warming-world,https://environment.yale.edu/sites/default/files/styles/metatag_1200x630/public/2026-02/Wildfire_California_is1282423120.jpg?h=8f9cfe54&itok=poSoUX_w,http://web.archive.org/web/20260303192344/https://environment.yale.edu/news/article/mapping-future-wildfires-warming-world,"Listen to Article
How can scientists better assess the effects of a warming climate on wildfire behavior, fire risk, and long-term fire trends? A new review co-authored by Yale School of the Environ… [+5182 chars]",,"Kartierung der Zukunft von Waldbränden in einer sich erwärmenden Welt. Jennifer Marlon, leitende Forschungswissenschaftlerin am YSE, war Teil eines internationalen Teams, das globale Branddaten und Klimamodelle kombinierte, um Lücken in Prognosen zum Waldbrandrisiko zu identifizieren und einen Rahmen für eine bessere langfristige Planung zu entwerfen.",Mapping the future of wildfires in a warming world. YSE Senior Research Scientist Jennifer Marlon was part of an international team that combined global fire data and climate models to identify gaps in wildfire risk projections and outline a framework to better inform long-term planning.,destinata futura incendia in calefactione mundi. YSE Senior Research Scientist Jennifer Marlon pertinebat turmae internationalis quae globalem ignem datam et exempla climatis coniunxit ad recognoscendas lacunas in periculo proiecturae incendii et compagem ad melius informando consilio diuturno informando.,2026-03-07 14:42:06+00:00
0fe2db1474f66eff24238cba1635be59,2026-03-06T20:23:49Z,'wildfire',nypost.com,en,0.9,California’s a regulation inferno — and wildfire victims are STILL getting burned,It sounded like bureaucrats would get out of the way and let fire victims rebuild quickly. But not when the government is in control.,https://nypost.com/2026/03/06/opinion/californias-a-regulation-inferno-and-wildfire-victims-get-burned/,https://nypost.com/wp-content/uploads/sites/2/2026/03/crop-38698878_5dee89.jpg?quality=75&strip=all&w=1200,,"Last year, California wildfires destroyed 13,000 homes.
Los Angeles Mayor Karen Bass announced: “We are 100% committed to getting this neighborhood rebuilt again.”
Gov. Gavin Newsom echoed that, sa… [+3869 chars]",,"Kalifornien ist ein Regulierungsinferno – und Opfer von Waldbränden erleiden IMMER NOCH Verbrennungen. Es klang, als würden die Bürokraten aus dem Weg gehen und den Brandopfern den schnellen Wiederaufbau ermöglichen. Aber nicht, wenn die Regierung die Kontrolle hat.",California’s a regulation inferno — and wildfire victims are STILL getting burned. It sounded like bureaucrats would get out of the way and let fire victims rebuild quickly. But not when the government is in control.,California institutum est inferno — et victimae igneae adhuc incenduntur. Auditum est ut officiales e medio exirent et victimae ignis celeriter aedificent. Sed non quando imperium est in potestate.,2026-03-07 20:40:30+00:00
3e77019ea07b50f9afddac8c3876fb27,2026-03-01T21:04:07Z,'wildfire',alltoc.com,en,0.9,Why might Arctic wildfires emit more carbon? #science,Smouldering peat and old soils hide extra emissions New reconstructions of wildfire emissions indicate that northern fires—especially those burning boreal and peatland regions—release far more carbon than commonly accounted for. When wildfires ignite organic‑…,https://alltoc.com/science/why-might-arctic-wildfires-emit-more-carbon,https://alltoc.com/cdn/1046/og.png,http://web.archive.org/web/20260301235214/https://alltoc.com/science/why-might-arctic-wildfires-emit-more-carbon,"Smouldering peat and old soils hide extra emissions
New reconstructions of wildfire emissions indicate that northern firesespecially those burning boreal and peatland regionsrelease far more carbon … [+1743 chars]",,"Warum könnten Waldbrände in der Arktis mehr Kohlenstoff ausstoßen? #Wissenschaft. Schwelender Torf und alte Böden verbergen zusätzliche Emissionen. Neue Rekonstruktionen der Waldbrandemissionen deuten darauf hin, dass Brände im Norden – insbesondere solche, die in borealen Regionen und Torfgebieten verbrennen – weit mehr Kohlenstoff freisetzen, als allgemein angenommen wird. Wenn Waldbrände organisches Material entzünden…",Why might Arctic wildfires emit more carbon? #science. Smouldering peat and old soils hide extra emissions New reconstructions of wildfire emissions indicate that northern fires—especially those burning boreal and peatland regions—release far more carbon than commonly accounted for. When wildfires ignite organic‑…,"Cur ignes arctici magis carbonem emittunt? #scientia. Petulantes gliscant et terrae veteres extra emissiones occultant Novae reconstructiones emissiones ignis feralis indicant ignes septentrionales, praesertim illas regiones boreales et peatlandas ardentes - longe carbo emittere quam vulgo aestimari. Cum wildfires organicum ...",2026-03-08 08:49:29+00:00
c500709fb2d07a8e9d820b9b060b8fdc,2026-03-03T13:30:00Z,'wildfire',www.technologyreview.com,en,0.9,"The Download: The startup that says it can stop lightning, and inside OpenAI’s Pentagon deal","This is today’s edition of The Download, our weekday newsletter that provides a daily dose of what’s going on in the world of technology. This startup claims it can stop lightning and prevent catastrophic wildfires Startup Skyward Wildfire says it can prevent…",https://www.technologyreview.com/2026/03/03/1133900/the-download-the-startup-that-says-it-can-stop-lightning-and-inside-openais-pentagon-deal/,"https://wp.technologyreview.com/wp-content/uploads/2026/02/GettyImages-144817694.jpg?resize=1200,600",,"Startup Skyward Wildfire says it can prevent catastrophic fires by stopping the lightning strikes that ignite them. So far, it hasnt publicly revealed how it does so, but online documents suggest the… [+1613 chars]",,"Der Download: Das Startup, das behauptet, Blitze stoppen zu können, und das im Pentagon-Deal von OpenAI steckt. Dies ist die heutige Ausgabe von The Download, unserem Wochentags-Newsletter, der täglich einen Überblick über die aktuellen Entwicklungen in der Welt der Technologie bietet. Dieses Startup behauptet, es könne Blitze stoppen und katastrophale Waldbrände verhindern. Das Startup Skyward Wildfire behauptet, es könne verhindern…","The Download: The startup that says it can stop lightning, and inside OpenAI’s Pentagon deal. This is today’s edition of The Download, our weekday newsletter that provides a daily dose of what’s going on in the world of technology. This startup claims it can stop lightning and prevent catastrophic wildfires Startup Skyward Wildfire says it can prevent…","Download: The startup qui dicit fulgura prohibere posse et insidire OpenAI's Pentagonum fac. Haec est hodie editio de The Download, nuntii nostri hebdomadis qui praebet cotidianum dose eorum quae in mundo technologiae agatur. Hoc initium affirmat fulgura prohibere posse et incendia feras calamitosas Satum in Skyward INCAENDIUM facit prohibere potest.",2026-03-08 08:49:29+00:00
8b445d0d195f51454066804c559bef9a,2026-03-03T17:55:08Z,'wildfire',deadline.com,en,0.9,‘The Legend Of Vox Machina’ Sets Season 4 Release Date At Prime Video,"We have a return date for The Legend of Vox Machina. Prime Video has set June 3 for the Season 4 release of the animated series, which will roll out three episodes weekly. Season 3 saw the Chroma Conclave’s path of destruction spread like wildfire as the Cind…",http://deadline.com/2026/03/the-legend-of-vox-machina-season-4-release-date-prime-video-1236742621/,https://deadline.com/wp-content/uploads/2026/03/Legend-of-Vox-Machina-s4.jpg?w=1024,,"We have a return date forThe Legend of Vox Machina. Prime Video has set June 3 for the Season 4 release of the animated series, which will roll out three episodes weekly.
Season 3 saw the Chroma Con… [+1308 chars]",,"„The Legend Of Vox Machina“ legt Veröffentlichungsdatum für Staffel 4 bei Prime Video fest. Wir haben einen Rückkehrtermin für The Legend of Vox Machina. Prime Video hat den 3. Juni für die Veröffentlichung der vierten Staffel der Zeichentrickserie festgelegt, die wöchentlich drei Episoden herausbringen wird. In Staffel 3 verbreitete sich der Weg der Zerstörung der Chroma-Konklave wie ein Lauffeuer, als die Cind…","‘The Legend Of Vox Machina’ Sets Season 4 Release Date At Prime Video. We have a return date for The Legend of Vox Machina. Prime Video has set June 3 for the Season 4 release of the animated series, which will roll out three episodes weekly. Season 3 saw the Chroma Conclave’s path of destruction spread like wildfire as the Cind…","' Legenda Vox Machina' Sets Season 4 Release Date Ad Primam Video . Habemus diem reditus ad Legenda Vox Machina. Primus Videos Iunii 3 pro Tempore 4 posuit seriem animatae emissione, quae tres episodias septimanatim evolvebit. Season 3 Conclavis viam perditionis vidit Chroma ignis ferum sicut Cind…",2026-03-08 08:49:29+00:00
69c2ede25c5bffe8019125c79ad9c9bd,2026-03-04T13:12:00Z,'wildfire',www.technologyreview.com,en,0.9,"The Download: Earth’s rumblings, and AI for strikes on Iran","This is today’s edition of The Download, our weekday newsletter that provides a daily dose of what’s going on in the world of technology. Listen to Earth’s rumbling, secret soundtrack The boom of a calving glacier. The crackling rumble of a wildfire. The roar…",https://www.technologyreview.com/2026/03/04/1133942/the-download-earths-rumblings-and-ai-for-strikes-on-iran/,"https://wp.technologyreview.com/wp-content/uploads/2026/02/ei_overhead-sc.jpg?resize=1200,600",,"The must-reads
Ive combed the internet to find you todays most fun/important/scary/fascinating stories about technology.
1 How Anthropics AI tool Claude is being used for US strikes on IranIts help… [+2539 chars]",,"Der Download: Das Grollen der Erde und KI für Angriffe auf den Iran. Dies ist die heutige Ausgabe von The Download, unserem Wochentags-Newsletter, der täglich einen Überblick über die aktuellen Entwicklungen in der Welt der Technologie bietet. Hören Sie sich den grollenden, geheimen Soundtrack der Erde an. Das Knallen eines kalbenden Gletschers. Das knisternde Grollen eines Lauffeuers. Das Gebrüll…","The Download: Earth’s rumblings, and AI for strikes on Iran. This is today’s edition of The Download, our weekday newsletter that provides a daily dose of what’s going on in the world of technology. Listen to Earth’s rumbling, secret soundtrack The boom of a calving glacier. The crackling rumble of a wildfire. The roar…","Download: terrae mugitus, AI enim in Irania percutit. Haec est hodie editio de The Download, nuntii nostri hebdomadis qui praebet cotidianum dose eorum quae in mundo technologiae agatur. Audi sonum Telluris, sonum secretum The boom of the fetus glacieris. Ignis crepitus crepitus. Rugitus…",2026-03-08 08:49:29+00:00
d21283014a158fe77df183525422934e,2026-03-06T22:44:45Z,'wildfire wind',nypost.com,en,0.9,Santa Ana wind gusts could top 70 MPH in SoCal as wildfire risk revealed,An urgent warning has been issued as the Santa Ana winds are forecast to bring gusts of up to 70 mph to some areas of Southern California.,https://nypost.com/2026/03/06/us-news/santa-ana-winds-today-gusts-could-top-70-mph-through-saturday/,https://nypost.com/wp-content/uploads/sites/2/2026/03/newspress-collage-m6adweneu-1772836273306.jpg?quality=75&strip=all&1772818292&w=1200,,"An urgent warning has been issued as the Santa Ana winds are forecast to bring gusts of up to 70 mph to some areas of Southern California this weekend. 
The National Weather Service issues advisorie… [+1559 chars]",,"In Südkalifornien könnten die Windböen in Santa Ana Geschwindigkeiten von über 70 MPH erreichen, da die Waldbrandgefahr deutlich wurde. Es wurde eine dringende Warnung herausgegeben, da die Santa Ana-Winde voraussichtlich Böen von bis zu 70 Meilen pro Stunde in einige Gebiete Südkaliforniens bringen werden.",Santa Ana wind gusts could top 70 MPH in SoCal as wildfire risk revealed. An urgent warning has been issued as the Santa Ana winds are forecast to bring gusts of up to 70 mph to some areas of Southern California.,Santa Ana ventorum procellae summo 70 MPH in SoCal ut periculum incendium patefactum est. Monitum urgente divulgatum est ut venti Santa Ana praesagiant ut procellis usque ad 70 mph ad aliquas areas Californiae Australis.,2026-03-08 08:49:29+00:00
4d4ba1796632933b7c1a72237b6652d7,2026-03-03T03:05:22Z,'wildfire health',alltoc.com,en,0.9,How would limiting warming cut US wildfire smoke deaths? #science,"Less warming means fewer deadly smoke episodes Scientists have linked future increases in wildfire activity to rising temperatures and drier conditions, and they used climate and health models to estimate the human cost. When greenhouse‑gas emissions and warm…",https://alltoc.com/science/how-would-limiting-warming-cut-us-wildfire-smoke-deaths,https://alltoc.com/cdn/1046/og.png,http://web.archive.org/web/20260303042223/https://alltoc.com/science/how-would-limiting-warming-cut-us-wildfire-smoke-deaths,"Scientists have linked future increases in wildfire activity to rising temperatures and drier conditions, and they used climate and health models to estimate the human cost. When greenhousegas emissi… [+1765 chars]",,"Wie würde eine Begrenzung der Erwärmung die Zahl der Rauchtoten durch Waldbrände in den USA senken? #Wissenschaft. Weniger Erwärmung bedeutet weniger tödliche Rauchepisoden. Wissenschaftler haben einen künftigen Anstieg der Waldbrandaktivität mit steigenden Temperaturen und trockeneren Bedingungen in Verbindung gebracht und sie verwendeten Klima- und Gesundheitsmodelle, um die menschlichen Kosten abzuschätzen. Wenn Treibhausgasemissionen und Wärme…","How would limiting warming cut US wildfire smoke deaths? #science. Less warming means fewer deadly smoke episodes Scientists have linked future increases in wildfire activity to rising temperatures and drier conditions, and they used climate and health models to estimate the human cost. When greenhouse‑gas emissions and warm…","Quo modo recisis calefaciens cussis US ignem ferum fumum mortes? #scientia. Minus calefactio significat pauciores fumi mortiferi episodii Scientistae conexi sunt futura incrementa in ignem ferum ut condiciones ascendant et temperaturas sicciores, et exempla climatis et sanitatis ad sumptus humanos aestimandos usi sunt. Cum emissiones gas CONSERVATORIUM et calidum…",2026-03-08 20:43:05+00:00
7ae572ddb340982433295f7291ef9e8f,2026-03-03T15:53:36Z,'wildfire house',www.nerdwallet.com,en,0.3,Is Your Home Underinsured? Here’s How to Tell.,Many homeowners don't have enough insurance to rebuild if disaster strikes. Use a rebuilding costs calculator to estimate what you'd need to replace your home.,https://www.nerdwallet.com/insurance/homeowners/news/rebuilding-costs#article,https://www.nerdwallet.com/assets/blog/wp-content/uploads/2022/03/GettyImages-200389757-001-1440x864.jpg,,Your house isnt just a place to hang your hat its also one of your most valuable financial assets. Thats why homeowners without enough insurance can face financial ruin when disaster strikes and they… [+5758 chars],,"Ist Ihr Haus unterversichert? Hier erfahren Sie, wie Sie es erkennen können. Viele Hausbesitzer sind nicht ausreichend versichert, um im Katastrophenfall den Wiederaufbau zu ermöglichen. Nutzen Sie einen Umbaukostenrechner, um abzuschätzen, wie viel Sie für den Ersatz Ihres Hauses benötigen würden.",Is Your Home Underinsured? Here’s How to Tell.. Many homeowners don't have enough insurance to rebuild if disaster strikes. Use a rebuilding costs calculator to estimate what you'd need to replace your home.,Domus tua est Underinsured? Hic est Quomodo nuntiare. Sumptibus calculatoris reaedificandis utere ad aestimandum quod opus est domum tuam reponere.,2026-03-11 04:54:09+00:00
72d711258129969a663ddb9485ef1969,2026-03-02T13:46:31Z,'wildfire',www.insurancejournal.com,en,0.7,Deep Freeze and Drought Fueled a Massive Florida Wildfire,"Firefighters in southwest Florida on Friday continued battling an expansive blaze on a federal nature preserve as an unusually intense winter drought grips the state. The National Fire has burned more than 25,700 acres — an area larger than Manhattan …",https://www.insurancejournal.com/news/southeast/2026/03/02/860074.htm,https://www.insurancejournal.com/app/uploads/2026/03/Fla-fire-map-Bloomberg.jpg,,"Firefighters in southwest Florida on Friday continued battling an expansive blaze on a federal nature preserve as an unusually intense winter drought grips the state.
The National Fire has burned mo… [+3133 chars]",,"Tiefer Frost und Dürre führten zu einem gewaltigen Waldbrand in Florida. Feuerwehrleute im Südwesten Floridas kämpften am Freitag weiter gegen einen Großbrand in einem Bundesnaturschutzgebiet, während der Staat von einer ungewöhnlich intensiven Winterdürre heimgesucht wird. Der Nationalbrand hat mehr als 25.700 Acres niedergebrannt – eine Fläche größer als Manhattan …","Deep Freeze and Drought Fueled a Massive Florida Wildfire. Firefighters in southwest Florida on Friday continued battling an expansive blaze on a federal nature preserve as an unusually intense winter drought grips the state. The National Fire has burned more than 25,700 acres — an area larger than Manhattan …","Alta Congelo et siccitas fueled ingens Florida INCAENDIUM. Firefighters in meridiem et occidentem Florida die Veneris continuata flamma expansivum in natura foederati conservat, sicut intensa siccitas hiemis statum tenet. In National Ignis plus quam 25,700 acras succendit - an area maior quam Manhattan ...",2026-03-11 04:54:09+00:00
c3eccb4a0993bf56148bed13f8f581fd,2026-03-06T23:51:49Z,'wildfire area',www.insurancejournal.com,en,0.7,Attorneys for Suspect in LA Wildfire Seek Release Based on New Evidence,Defense attorneys for the man accused of sparking the deadly Palisades Fire in Los Angeles held a news conference Thursday to call for his release from jail in light of new evidence they say shows he is not responsible for …,https://www.insurancejournal.com/news/west/2026/03/06/860926.htm,https://www.insurancejournal.com/app/uploads/2025/01/2024-Pacific-Palisades-Fire-by-CalFire-scaled.jpg,,Defense attorneys for the man accused of sparking the deadly Palisades Fire in Los Angeles held a news conference Thursday to call for his release from jail in light of new evidence they say shows he… [+2920 chars],,"Anwälte des Verdächtigen in LA Wildfire streben Freilassung auf der Grundlage neuer Beweise an. Die Verteidiger des Mannes, der beschuldigt wird, das tödliche Palisades-Feuer in Los Angeles ausgelöst zu haben, hielten am Donnerstag eine Pressekonferenz ab, um seine Freilassung aus dem Gefängnis zu fordern, da neue Beweise zeigen, dass er nicht verantwortlich ist für …",Attorneys for Suspect in LA Wildfire Seek Release Based on New Evidence. Defense attorneys for the man accused of sparking the deadly Palisades Fire in Los Angeles held a news conference Thursday to call for his release from jail in light of new evidence they say shows he is not responsible for …,Attornatos pro Suspectus in LA Wildfire quaerite Release Fundatur in Novum testimonium. Procuratores defensionis pro reo Palisades Fire in Los Angeles funestos scintillandos in Los Angeles nuntium colloquii Iovis tenuit ut vocaret suam emissionem e carcere in luce novis testimoniis quae dicunt ostendit se non esse auctorem ...,2026-03-11 04:54:09+00:00
