index,url,valid,domain,title,description,image,published,archive,content,quote,language,keyword
https://www.esri.com/arcgis-blog/products/arcgis-pro/mapping/how-to-create-a-3d-map-of-a-wildfire/,https://www.esri.com/arcgis-blog/products/arcgis-pro/mapping/how-to-create-a-3d-map-of-a-wildfire/,0,www.esri.com,How to Create a 3D Map of a Wildfire,How to create a 3d map of a wildfire using ArcGIS Pro and other Esri mapping resources,https://www.esri.com/arcgis-blog/wp-content/uploads/2025/03/fire-map-CARD-1.jpg,2025-03-06T13:23:53Z,https://web.archive.org/web/20250307065932/https://www.esri.com/arcgis-blog/products/arcgis-pro/mapping/how-to-create-a-3d-map-of-a-wildfire/,"Wildfires continue to make headline news, most recently the fires surrounding the greater Los Angeles area. When I worked as a journalist mapping the news, we were tasked with locating fires, communi… [+3277 chars]",,en,'wildfire area'
https://www.nbcnews.com/pop-culture/pop-culture-news/steve-carell-surprises-students-free-prom-tickets-rcna194742,https://www.nbcnews.com/pop-culture/pop-culture-news/steve-carell-surprises-students-free-prom-tickets-rcna194742,0,www.nbcnews.com,Steve Carell surprises students affected by Los Angeles wildfires with free prom tickets,Actor Steve Carell found a way to bring smiles to 800 high school students whose live have been turned upside down in recent months because of the Los Angeles wildfires.,"https://media-cldnry.s-nbcnews.com/image/upload/t_nbcnews-fp-1200-630,f_auto,q_auto:best/rockcms/2025-03/250306-steve-carell-vl-910a-f52887.jpg",2025-03-06T14:38:22Z,http://archive.md/20250306150441/https://www.nbcnews.com/pop-culture/pop-culture-news/steve-carell-surprises-students-free-prom-tickets-rcna194742,"Actor Steve Carell found a way to bring smiles to 800 high school students whose live have been turned upside down in recent months because of the Los Angeles wildfires. 
Their prom tickets were on … [+2770 chars]",,en,'wildfire'
https://subscriber.politicopro.com/article/eenews/2025/03/06/nonprofits-in-limbo-as-grants-disappear-00206202,https://subscriber.politicopro.com/article/eenews/2025/03/06/nonprofits-in-limbo-as-grants-disappear-00206202,0,subscriber.politicopro.com,"As Trump and DOGE Block Federal Grants, Wildfire Prevention Projects Are at Risk",Efforts to limit wildfires in a conservative swath of northern Colorado are the latest casualty of the Trump administration’s on-and-off federal spending freeze,https://static.scientificamerican.com/dam/m/654b0ad9216dda60/original/Cache-La-Poudre-Canyon-fire.jpg?m=1741277282.138&w=1200,2025-03-06T16:00:00Z,,"CLIMATEWIRE | Efforts to limit wildfires in a conservative swath of northern Colorado are the latest casualty of the Trump administration’s on-and-off federal spending freeze.
The Coalition for the … [+7243 chars]",,en,'wildfire'
https://www.gadgets360.com/science/news/nasa-tests-advanced-infrared-technology-to-improve-wildfire-monitoring-7845670,https://www.gadgets360.com/science/news/nasa-tests-advanced-infrared-technology-to-improve-wildfire-monitoring-7845670,0,www.gadgets360.com,NASA Tests Advanced Infrared Technology to Improve Wildfire Monitoring,"NASA tested its Compact Fire Infrared Radiance Spectral Tracker (c-FIRST) over California wildfires to improve real-time fire tracking. Managed by NASA’s Jet Propulsion Laboratory, the instrument captures high-resolution thermal infrared data, identifying tem…",https://i.gadgets360cdn.com/large/ART_4_2_1741085366414.jpg,2025-03-06T16:25:48Z,,"Wildfires in California during January caused widespread destruction, affecting communities and ecosystems. To improve wildfire monitoring and response, NASA deployed a new scientific instrument capa… [+2317 chars]",,en,'wildfire wind'
https://pcper.com/2025/03/an-rtx-5090-rumour-likely-to-spread-like-wildfire/,https://pcper.com/2025/03/an-rtx-5090-rumour-likely-to-spread-like-wildfire/,0,pcper.com,An RTX 5090 Rumour Likely To Spread Like Wildfire,"Grab the salt, because you should take a grain of it before reading on.  KitGuru got hold of a copy of an email sent by a retailer in the Netherlands called Your…",https://pcper.com/wp-content/uploads/2025/03/12vhpwr-cable-prod001.jpg,2025-03-06T18:41:32Z,https://web.archive.org/web/20250306200552/https://pcper.com/2025/03/an-rtx-5090-rumour-likely-to-spread-like-wildfire/,"Grab the salt, because you should take a grain of it before reading on.  KitGuru got hold of a copy of an email sent by a retailer in the Netherlands called Your Game Specialist, which suggests that … [+1375 chars]",,en,'wildfire'
https://www.forbes.com/sites/andywang/2025/03/06/star-studded-chefs-love-la-event-raises-850000-for-wildfire-relief/,https://www.forbes.com/sites/andywang/2025/03/06/star-studded-chefs-love-la-event-raises-850000-for-wildfire-relief/,0,www.forbes.com,"Star-Studded Chefs Love LA Event Raises $850,000 For Wildfire Relief",The goal of this event was raising funds to help people when disasters strike and also to aid food-and-beverage workers affected by the recent Los Angeles wildfires.,https://imageio.forbes.com/specials-images/imageserve/67c9efa73f319be16bfe52b6/0x0.jpg?format=jpg&height=900&width=1600&fit=bounds,2025-03-06T19:17:14Z,,"Daniel Boulud flew in to cook for Chefs Love LA.
Nicholas Gingold/Craft Media Solutions
The hospitality industry, with its unwavering desire to take care of people, always rises up in times of cris… [+3529 chars]",,en,'wildfire relief'
https://www.marca.com/en/nfl/los-angeles-rams/2025/03/06/67ca15b4ca474129178b45ba.html,https://www.marca.com/en/nfl/los-angeles-rams/2025/03/06/67ca15b4ca474129178b45ba.html,0,www.marca.com,Matthew Stafford has made a significant contribution to the California wildfire relief effort,"Matthew Stafford, quarterback for the Los Angeles Rams, started 2025 facing a personal challenge after his family was deeply affected by the wildfires that ravaged California. 

Wh",https://phantom-marca.uecdn.es/1cfcdcfa829e6cd6981705c08dbb6c9b/resize/1200/f/webp/assets/multimedia/imagenes/2025/03/06/17412924394426.jpg,2025-03-06T21:54:10Z,,"Matthew Stafford, quarterback for the Los Angeles Rams, started 2025 facing a personal challenge after his family was deeply affected by the wildfires that ravaged California. 
While Stafford was fo… [+2368 chars]",,en,'wildfire relief'
https://www.soundonsound.com/news/midium-sell-signed-melbourne-instruments-nina,https://www.soundonsound.com/news/midium-sell-signed-melbourne-instruments-nina,0,www.soundonsound.com,The Midium sell signed Melbourne Instruments Nina,The Midium have announced that they are donating 55% of the profit from the sale of a collectable Melborne Instruments Nina to the relief efforts that are supporting those affected by the recent wildfires in Los Angeles.,,2025-03-06T22:00:00Z,https://web.archive.org/web/20250306164001/http://www.soundonsound.com/news/midium-sell-signed-melbourne-instruments-nina,"The Midium, a family-run synth shop based in Southern California have announced that they are donating 55% of the profit from the sale of a collectable Melborne Instruments Nina to the relief efforts… [+1846 chars]",,en,'wildfire area'
https://nypost.com/2025/03/06/us-news/hunter-bidens-house-looks-untouched-after-he-claimed-la-wildfires-made-it-unlivable/,https://nypost.com/2025/03/06/us-news/hunter-bidens-house-looks-untouched-after-he-claimed-la-wildfires-made-it-unlivable/,0,nypost.com,Hunter Biden’s $3M house appears untouched — while every neighboring home was burned to ash — after he called it ‘unlivable’ due to LA wildfires,"The former first son, 55, was living in the four-bedroom home with his wife, Melissa, and their son, Beau, when the raging Palisades Fire tore through his neighborhood in January, sources confirmed to The Post.",https://nypost.com/wp-content/uploads/sites/2/2025/03/99898415-1.jpg?quality=75&strip=all&w=1024,2025-03-06T23:38:58Z,https://web.archive.org/web/20250307013645/https://nypost.com/2025/03/06/us-news/hunter-bidens-house-looks-untouched-after-he-claimed-la-wildfires-made-it-unlivable/,The $3 million rental home Hunter Biden claims is now “unlivable” after the California wildfires — leaving him broke and unable to continue a 2023 lawsuit he filed — appears unscathed even as all the… [+4130 chars],,en,'wildfire house'
https://www.cbc.ca/news/canada/edmonton/federal-alberta-governments-offer-more-aid-to-fire-ravaged-jasper-1.7477114,https://www.cbc.ca/news/canada/edmonton/federal-alberta-governments-offer-more-aid-to-fire-ravaged-jasper-1.7477114,0,www.cbc.ca,"Federal, Alberta governments offer more aid to fire-ravaged Jasper","The federal and Alberta governments are ushering in new support for Jasper, Alta., as the mountain town continues to rebuild from last summer's devastating wildfires.",https://i.cbc.ca/1.7439835.1737665924!/fileImage/httpImage/image.jpg_gen/derivatives/16x9_1180/burned-trees-in-jasper-national-park.jpg?im=Resize%3D620,2025-03-06T23:41:31Z,,"The federal and Alberta governments are ushering in new support for Jasper as the mountain town continues to rebuild from last summer's devastating wildfires.
The federal government says $2 million … [+3130 chars]",,en,'wildfire residents'
https://www.cbsnews.com/news/wood-federal-forests-native-american-heat-wildfires/,https://www.cbsnews.com/news/wood-federal-forests-native-american-heat-wildfires/,0,www.cbsnews.com,Wood thinned from forests prevents wildfires and heats Native American homes,"Families living on tribal lands are 1,200 times more likely to live in homes with heating issues.",https://assets2.cbsnewsstatic.com/hub/i/r/2025/03/06/0d504d26-6d67-4bb4-86d3-351224508527/thumbnail/1200x630/e26716d88032d54a6da95dbd750de361/c6-shamlian-eoa-wood-for-life-030525-transfer-frame-918.jpg?v=63a2b43e2ef8917aa6bd547ca29dd4fa,2025-03-07T01:37:27Z,https://web.archive.org/web/20250307035404/https://www.cbsnews.com/news/wood-federal-forests-native-american-heat-wildfires/,"Growing up on the Washoe tribal land spread across Nevada and California known as Hung-A-Lel-Ti territory, Kenneth Cruz started splitting wood when he was around 12. The youngest of eight — seven boy… [+6534 chars]",,en,'wildfire'
https://www.insurancejournal.com/news/west/2025/03/07/814528.htm,https://www.insurancejournal.com/news/west/2025/03/07/814528.htm,0,www.insurancejournal.com,Report: More Insurers in California Paying Wildfire Victims Without Itemized List,"More insurers are paying contents coverage to California wildfire victims without requiring a detailed inventory, according to the California Department of Insurance. The CDI reported on responses from carriers following a notice issued by California Insuranc…",https://www.insurancejournal.com/img/social/opengraph/ij-social-wildfire-1200x630.png,2025-03-07T06:00:38Z,,"More insurers are paying contents coverage to California wildfire victims without requiring a detailed inventory, according to the California Department of Insurance.
The CDI reported on responses f… [+1517 chars]",,en,'wildfire victims'
https://www.insurancejournal.com/news/east/2025/03/07/814619.htm,https://www.insurancejournal.com/news/east/2025/03/07/814619.htm,0,www.insurancejournal.com,Maryland Wildfire Damage Less Extensive in 2024 Despite Severe Fall Fire Weather,"The number of wildfires in Maryland during 2024 was much higher than the ten-year average, but acreage burned was significantly lower. In Maryland, 165 fires burned 953.4 acres during 2024, compared to 199 wildfires in 2023 that burned approximately 4,483 …",https://www.insurancejournal.com/app/uploads/2024/11/wildfires.jpg,2025-03-07T06:00:58Z,,"The number of wildfires in Maryland during 2024 was much higher than the ten-year average, but acreage burned was significantly lower. In Maryland, 165 fires burned 953.4 acres during 2024, compared … [+2386 chars]",,en,'wildfire damage'
https://www.channelnewsasia.com/east-asia/japan-wildfire-evacuation-order-partially-lifted-4984786,https://www.channelnewsasia.com/east-asia/japan-wildfire-evacuation-order-partially-lifted-4984786,0,www.channelnewsasia.com,Japan wildfire evacution orders partially lifted,TOKYO: Japan partially lifted wildfire evacuation orders on Friday (Mar 7) after rain helped stop the country's worst blaze in more than half a century from spreading. The fir,"https://dam.mediacorp.sg/image/upload/s--zs-ccNMW--/fl_relative,g_south_east,l_mediacorp:cna:watermark:2023-11:afp_watermark_14112023,w_0.1/f_auto,q_auto/c_fill,g_auto,h_676,w_1200/v1/mediacorp/cna/image/2025/03/07/000_36zd3bp_1.jpg?itok=Hnf2CCVY",2025-03-07T07:45:00Z,,"TOKYO: Japan partially lifted wildfire evacuation orders on Friday (Mar 7) after rain helped stop the country's worst blaze in more than half a century from spreading.
The fire had raged in the moun… [+804 chars]",,en,'wildfire'
https://japantoday.com/category/national/japan-wildfire-evacution-orders-partially-lifted,https://japantoday.com/category/national/japan-wildfire-evacution-orders-partially-lifted,0,japantoday.com,Japan wildfire evacution orders partially lifted,"Japan partially lifted wildfire evacuation orders on Friday after rain helped stop the country's worst blaze in more than half a century from spreading. The fire had raged in the mountains around the Iwate Prefecture city of Ofunato for over a week, killing o…",,2025-03-07T07:53:12Z,,"Japan partially lifted wildfire evacuation orders on Friday after rain helped stop the country's worst blaze in more than half a century from spreading.
The fire had raged in the mountains around th… [+1489 chars]",,en,'wildfire'
https://www.japantimes.co.jp/news/2025/03/07/japan/wildfire-evacuation-orders-partially-lifted/,https://www.japantimes.co.jp/news/2025/03/07/japan/wildfire-evacuation-orders-partially-lifted/,0,www.japantimes.co.jp,Japan partially lifts wildfire evacuation orders,"Wet weather, which began Wednesday following a record dry period, is helping firefighting efforts.",https://www.japantimes.co.jp/japantimes/uploads/images/2025/03/07/456072.jpg?v=3.1,2025-03-07T08:40:00Z,,"Japan partially lifted wildfire evacuation orders on Friday after rain helped stop the country's worst blaze in more than half a century from spreading.
The fire had raged in the mountains around th… [+1470 chars]",,en,'wildfire weather'
https://lithub.com/the-best-story-collection-about-california-wildfires-isnt-a-book-its-a-brand-new-record/,https://lithub.com/the-best-story-collection-about-california-wildfires-isnt-a-book-its-a-brand-new-record/,0,lithub.com,The Best Story Collection About California Wildfires Isn’t a Book—It’s a Brand-New Record,"On a summer afternoon early in the pandemic, the songwriter Will Stratton was riding his bike near where he lives in the Hudson Valley when he had an experience that felt strange at the time but has become increasingly common. Wildfires were burning on the We…",https://s26162.pcdn.co/wp-content/uploads/2025/03/stratton.jpg,2025-03-07T09:58:32Z,https://web.archive.org/web/20250309000906/https://lithub.com/the-best-story-collection-about-california-wildfires-isnt-a-book-its-a-brand-new-record/,"On a summer afternoon early in the pandemic, the songwriter Will Stratton was riding his bike near where he lives in the Hudson Valley when he had an experience that felt strange at the time but has … [+15328 chars]",,en,'wildfire smoke'
https://consent.yahoo.com/v2/collectConsent?sessionId=1_cc-session_3b5bf8a9-310e-409c-b8a2-9c5d0e4b23f4,https://consent.yahoo.com/v2/collectConsent?sessionId=1_cc-session_3b5bf8a9-310e-409c-b8a2-9c5d0e4b23f4,0,consent.yahoo.com,Update: Carolina Forest woman arrested for causing 2K+ acre wildfire in Myrtle Beach area,,,2025-03-07T13:45:14Z,,"If you click 'Accept all', we and our partners, including 238 who are part of the IAB Transparency &amp; Consent Framework, will also store and/or access information on a device (in other words, use … [+702 chars]",,en,'wildfire'
https://economictimes.indiatimes.com/news/international/us/hunter-biden-files-bombshell-lawsuit-says-hes-broke-and-lost-his-house-in-los-angeles-wildfires-photos-show-his-home-untouched-while-others-burned-down/articleshow/118791088.cms,https://economictimes.indiatimes.com/news/international/us/hunter-biden-files-bombshell-lawsuit-says-hes-broke-and-lost-his-house-in-los-angeles-wildfires-photos-show-his-home-untouched-while-others-burned-down/articleshow/118791088.cms,0,economictimes.indiatimes.com,"Hunter Biden files bombshell lawsuit, says he's broke and lost his house in Los Angeles wildfires; photos show his home untouched while others burned down","Hunter Biden claims he is ""millions in debt"" after wildfires rendered his home ""unlivable,"" prompting him to drop a lawsuit. However, recent images show his house intact, while others have burned down. His financial difficulties, previous rental issues, and l…","https://img.etimg.com/thumb/msid-118791389,width-1200,height-630,imgsize-1428537,overlay-economictimes/articleshow.jpg",2025-03-07T16:48:03Z,https://web.archive.org/web/20250307174723/https://economictimes.indiatimes.com/news/international/us/hunter-biden-files-bombshell-lawsuit-says-hes-broke-and-lost-his-house-in-los-angeles-wildfires-photos-show-his-home-untouched-while-others-burned-down/articleshow/118791088.cms,"Hunter Biden claims he is ""millions in debt"" after wildfires rendered his home ""unlivable,"" prompting him to drop a lawsuit. However, recent images show his house intact, while others have burned dow… [+2682 chars]",,en,'wildfire'
https://www.newsweek.com/florida-wildfire-map-every-fire-burning-2041237,https://www.newsweek.com/florida-wildfire-map-every-fire-burning-2041237,0,www.newsweek.com,Florida Wildfire Map Shows Every Fire Burning,"At least 12 fires are currently burning across the Sunshine State, totaling more than 400 acres. Fire conditions will persist on Friday.",https://d.newsweek.com/en/full/2602587/florida-wildfire-map-shows-every-fire-burning.jpg,2025-03-07T17:37:09Z,,"There are 12 active fires burning in Florida amid alerts from meteorologists warning of fire weather conditions on Friday.
Why It Matters
Wildfire season runs year-round in the Sunshine State, thou… [+3376 chars]",,en,'wildfire'
https://www.breitbart.com/local/2025/03/07/hud-extends-foreclosure-moratorium-la-fire-victims/,https://www.breitbart.com/local/2025/03/07/hud-extends-foreclosure-moratorium-la-fire-victims/,0,www.breitbart.com,HUD Extends Foreclosure Moratorium for L.A. Fire Victims,"The Department of Housing and Urban Development has announced an extension of its foreclosure moratorium for homes in the areas impacted by the Los Angeles wildfires. 
The post HUD Extends Foreclosure Moratorium for L.A. Fire Victims appeared first on Breitba…",https://media.breitbart.com/media/2025/03/Home-destroyed-in-Altadena-wildfire-640x335.jpg,2025-03-07T19:06:16Z,,The Department of Housing and Urban Development (HUD) has announced an extension of its foreclosure moratorium on Federal Housing Administration (FHA) single family homes in the areas impacted by the… [+1737 chars],,en,'wildfire residents'
http://footwearnews.com/shoes/sneaker-news/snibbs-hedley-bennett-los-angeles-wildfire-victims-1234778941/,http://footwearnews.com/shoes/sneaker-news/snibbs-hedley-bennett-los-angeles-wildfire-victims-1234778941/,0,footwearnews.com,Snibbs’ Collaboration With Hedley & Bennett Benefits Food and Beverage Workers Impacted by Los Angeles Wildfires,A percentage of the proceeds of the Snibbs x Hedley & Bennett Orbit SE sneaker will be donated to the nonprofit Restaurants Care.,https://footwearnews.com/wp-content/uploads/2025/03/snibbs-hedley-bennett.jpg?w=650,2025-03-07T20:48:47Z,https://web.archive.org/web/20250312191123/https://footwearnews.com/shoes/sneaker-news/snibbs-hedley-bennett-los-angeles-wildfire-victims-1234778941/,"Continuing its efforts to help Los Angeles wildfire victims, Snibbs is offering a percentage of the proceeds from its collaboration with kitchen and lifestyle brand Hedley &amp; Bennett to charity. … [+2197 chars]",,en,'wildfire'
https://www.msnbc.com/top-stories/latest/christian-extremist-trump-hud-la-wildfires-rcna195351,https://www.msnbc.com/top-stories/latest/christian-extremist-trump-hud-la-wildfires-rcna195351,0,www.msnbc.com,Christian extremist joins Trump's HUD secretary to survey L.A. wildfire damage,"Sean Feucht, who has called his opponents ""literally Satan,"" gushed about the opportunity to give Trump's Cabinet ""advice"" on how to rebuild Los Angeles.","https://media-cldnry.s-nbcnews.com/image/upload/t_nbcnews-fp-1200-630,f_auto,q_auto:best/rockcms/2025-03/250307-Sean-Feucht-lm-1200-0802ca.jpg",2025-03-07T20:49:56Z,https://web.archive.org/web/20250307210943/https://www.msnbc.com/top-stories/latest/christian-extremist-trump-hud-la-wildfires-rcna195351,"A Christian extremist joined Donald Trump's Department of Housing and Urban Development Secretary Scott Turner this week, as Turner and his staff toured the damage wrought by the recent wildfires in … [+2753 chars]",,en,'wildfire'
https://biztoc.com/x/6640a04923247352,https://biztoc.com/x/6640a04923247352,0,biztoc.com,Christian extremist joins Trump's HUD secretary to survey L.A. wildfire damage,"Sean Feucht, who has called his opponents ""literally Satan,"" gushed about the opportunity to give Trump's Cabinet ""advice"" on how to rebuild Los Angeles.",https://biztoc.com/cdn/6640a04923247352_s.webp,2025-03-07T21:10:50Z,,"Discover leading experts on 50,000+ topicsConnect for media, speaking, expert witness inquiries &amp; more.
Experts on 50,000+ topicsClick to connect for media &amp; more.",,en,'wildfire damage'
https://www.newsweek.com/florida-wildfire-risk-map-shows-threat-mar-lago-donald-trump-2041539,https://www.newsweek.com/florida-wildfire-risk-map-shows-threat-mar-lago-donald-trump-2041539,0,www.newsweek.com,Florida Wildfire Risk Map Shows Threat to Mar-a-Lago,"Sensitive fire weather conditions were in place across Florida on Friday, including at Mar-a-Lago in Palm Beach County.",https://d.newsweek.com/en/full/2602966/wildfire-risk-map-mar-lago.png,2025-03-07T23:34:51Z,,"There is a high threat for wildfires at President Donald Trump's resort residence at Mar-a-Lago as well as all of Palm Beach County, according to a wildfire risk map from Florida Department of Agricu… [+2970 chars]",,en,'wildfire smoke'
https://nypost.com/2025/03/08/us-news/south-carolina-woman-alexandra-bialousow-arrested-for-igniting-massive-wildfire-in-myrtle-beach-area/,https://nypost.com/2025/03/08/us-news/south-carolina-woman-alexandra-bialousow-arrested-for-igniting-massive-wildfire-in-myrtle-beach-area/,0,nypost.com,"South Carolina woman arrested for igniting massive 2,059-acre wildfire in Myrtle Beach area","Alexandra Bialousow, 40, was busted on Thursday after several neighbors reported seeing the kindler intentionally start a fire in a backyard fire pit.",https://nypost.com/wp-content/uploads/sites/2/2025/03/newspress-collage-934h15b3q-1741413654376.jpg?quality=75&strip=all&1741395696&w=1024,2025-03-08T06:11:13Z,https://web.archive.org/web/20250308152242/https://nypost.com/2025/03/08/us-news/south-carolina-woman-alexandra-bialousow-arrested-for-igniting-massive-wildfire-in-myrtle-beach-area/,"A South Carolina woman was arrested for allegedly sparking a massive 2,059-acre wildfire that caused evacuations and threatened hundreds of homes in the Myrtle Beach area last week.
Alexandra Bialou… [+2322 chars]",,en,'wildfire area'
https://www.businessinsider.com/leaving-california-boomer-moved-arizona-wildfires-rising-costs-retirement-savings-2025-3,https://www.businessinsider.com/leaving-california-boomer-moved-arizona-wildfires-rising-costs-retirement-savings-2025-3,0,www.businessinsider.com,"A California boomer who moved to a 'Hallmark' town in Arizona is saving over $1,700 a month on bills","Brenda Duncan Cusick moved to Arizona from wildfire-prone California, citing lower wildfire risks and retirement costs.",https://i.insider.com/67c9cb29b8b41a9673f9deb8?width=1200&format=jpeg,2025-03-08T09:04:02Z,http://archive.md/20250308221653/https://www.businessinsider.com/leaving-california-boomer-moved-arizona-wildfires-rising-costs-retirement-savings-2025-3,"After living in Moorpark, California, for nearly two decades, Brenda Duncan Cusick had become an expert in wildfire evacuations.
Cusick, 61, told Business Insider that she's had to flee the home she… [+3986 chars]",,en,'wildfire residents'
https://www.wired.com/story/the-extreme-weather-conditions-that-drove-the-carolina-wildfires/,https://www.wired.com/story/the-extreme-weather-conditions-that-drove-the-carolina-wildfires/,0,www.wired.com,The Extreme Weather Conditions That Drove the Carolina Wildfires,"The wildifires in the Carolinas have followed months of whiplash weather—drought, followed by hurricane-fueled floods, and then more drought.","https://media.wired.com/photos/67cb3c5e7864c6b4449a6168/191:100/w_1280,c_limit/Science_Carolinas_wildfire_GettyImages-2202662290.jpg",2025-03-08T13:00:00Z,https://web.archive.org/web/20250308130823/https://www.wired.com/story/the-extreme-weather-conditions-that-drove-the-carolina-wildfires/,"THIS ARTICLE IS republished fromThe Conversationunder aCreative Commons license.
Scores of wildfires broke out across North Carolina, South Carolina, and Georgia in early March 2025 as strong winds,… [+2316 chars]",,en,'wildfire wind'
