index,published,keyword,domain,language,valid,title,description,url,image,archive,content,quote,de,en,la,added
c9e80804d4506b8a4428f51c33e2d808,2026-05-03T02:49:42Z,'wildfire disaster',economictimes.indiatimes.com,en,0.9,Japan contains one of its biggest wildfires in decades after 11-day battle,"Japan forest fire: After a grueling 11-day fight, firefighters and military forces in Japan's Iwate region have finally brought wildfires under control. The flames ravaged 1,600 hectares, leading to the evacuation of thousands and causing damage to eight stru…",https://economictimes.indiatimes.com/news/international/world-news/japan-contains-one-of-its-biggest-wildfires-in-decades-after-11-day-battle/articleshow/130726739.cms,"https://img.etimg.com/thumb/msid-130726755,width-1200,height-630,imgsize-94014,overlay-economictimes/articleshow.jpg",,"Tokyo: Wildfires that scorched forests in northern Japan, reportedly the second biggest in over 30 years, have been brought under control after 11 days, officials have said.Hundreds of firefighters a… [+1548 chars]",,"In Japan kommt es nach elftägigem Kampf zu einem der größten Waldbrände seit Jahrzehnten. Waldbrand in Japan: Nach einem zermürbenden elftägigen Kampf haben Feuerwehrleute und Militärkräfte in der japanischen Region Iwate die Waldbrände endlich unter Kontrolle gebracht. Die Flammen verwüsteten 1.600 Hektar, führten zur Evakuierung Tausender und verursachten Schäden an acht Gebäuden.","Japan contains one of its biggest wildfires in decades after 11-day battle. Japan forest fire: After a grueling 11-day fight, firefighters and military forces in Japan's Iwate region have finally brought wildfires under control. The flames ravaged 1,600 hectares, leading to the evacuation of thousands and causing damage to eight stru…","Iaponia unam ex suis maximis incendiis in decenniis post XI dies proelium continet. Iaponia incendium silvestre: Post grueling XI-die pugna, pugnatores et copiae militares in regione Iwate Iaponiae tandem incendia in potestatem redacta sunt. In flammae mille hectares depopulati sunt, ducentes ad euacuationem milia et detrimentum octo instrumentorum ...",2026-05-05 21:14:50+00:00
65eb2c413ae34829b058a99e55af3daa,2026-05-04T07:30:00Z,'wildfire',www.esa.int,en,0.9,Hellenic Fire System satellites launched for Greece,"A constellation of four new satellites has been launched for Greece, marking a world first for a national satellite capability dedicated to wildfire detection and tracking. The mission is the result of cooperation between the Greek government, private satelli…",https://www.esa.int/Applications/Observing_the_Earth/Hellenic_Fire_System_satellites_launched_for_Greece,https://www.esa.int/var/esa/storage/images/esa_multimedia/images/2026/05/one_of_hellenic_fire_system_satellites/27254942-1-eng-GB/One_of_Hellenic_Fire_System_satellites_pillars.jpg,,"Applications
A constellation of four new satellites has been launched for Greece, marking a world first for a national satellite capability dedicated to wildfire detection and tracking. The mission … [+3607 chars]",,"Satelliten des Hellenic Fire System für Griechenland gestartet. Für Griechenland wurde eine Konstellation von vier neuen Satelliten gestartet, was eine Weltneuheit für eine nationale Satellitenfähigkeit zur Erkennung und Verfolgung von Waldbränden darstellt. Die Mission ist das Ergebnis einer Zusammenarbeit zwischen der griechischen Regierung, privaten Satelliten…","Hellenic Fire System satellites launched for Greece. A constellation of four new satellites has been launched for Greece, marking a world first for a national satellite capability dedicated to wildfire detection and tracking. The mission is the result of cooperation between the Greek government, private satelli…","satellites ignis Systematis Hellenic in Graeciam deducti sunt. Constellatio quattuor novorum satellitum in Graeciam deducta est, mundum primum designatum ad facultatem satellitem nationalem detectionis et semitae ignivomo dicatam. Missio effectus est cooperationis inter regimen Graeciae, satelli privati…",2026-05-05 21:14:50+00:00
e2dd692a85030246e222d4d8944e1363,2026-05-04T18:44:25Z,'wildfire',nypost.com,en,0.9,State Farm in crisis mode as watchdog threatens biggest ever penalty over wildfires,The state is now seeking millions of dollars in penalties — potentially the largest ever pursued after a wildfire disaster this century.,https://nypost.com/2026/05/04/real-estate/state-farm-in-crisis-mode-as-watchdog-threatens-biggest-ever-penalty-over-wildfires/,https://nypost.com/wp-content/uploads/sites/2/2026/05/126981030.jpg?quality=75&strip=all&w=1200,,"California officials have taken legal action against State Farm, accusing the insurance giant of widespread mishandling of claims from survivors of the devastating 2025 Los Angeles wildfires.
The Ca… [+2349 chars]",,"State Farm im Krisenmodus, da Wachhund wegen Waldbränden mit der höchsten Strafe aller Zeiten droht. Der Staat fordert nun Strafen in Millionenhöhe – möglicherweise die höchsten, die jemals nach einer Waldbrandkatastrophe in diesem Jahrhundert verhängt wurden.",State Farm in crisis mode as watchdog threatens biggest ever penalty over wildfires. The state is now seeking millions of dollars in penalties — potentially the largest ever pursued after a wildfire disaster this century.,"Publica Farm in crisi modo ac vigiles minatur maximam poenam semper in wildfires. Civitas nunc decies centena milia dollariorum poenarum quaerimus, potentia maxima umquam post calamitatem incendii huius saeculi persecuta est.",2026-05-05 21:14:50+00:00
0cca515d4c13c360901dcb5a460a7b0d,2026-05-04T20:44:33Z,'wildfire',nypost.com,en,0.9,State Farm launches all out war on California in blistering statement after bombshell wildfire exposé,"The lengthy, strongly worded response came within hours of the state of California issuing a damning verdict following an investigation into the company’s handling of customer claims after the 2025 wildfires.",https://nypost.com/2026/05/04/real-estate/state-farm-launches-all-out-war-on-california-in-blistering-statement-after-bombshell-wildfire-expose/,https://nypost.com/wp-content/uploads/sites/2/2026/05/126986780.jpg?quality=75&strip=all&w=1200,,"Californias largest home insurance company tore into state regulators Monday as it faces potential multi-million dollar fines and a suspension of its license.
Wildfire survivors deserve real solutio… [+3658 chars]",,"State Farm beginnt mit einer scharfen Stellungnahme nach der explodierenden Enthüllung von Waldbränden den totalen Krieg gegen Kalifornien. Die lange, stark formulierte Antwort kam nur wenige Stunden, nachdem der Bundesstaat Kalifornien nach einer Untersuchung zum Umgang des Unternehmens mit Kundenansprüchen nach den Waldbränden im Jahr 2025 ein vernichtendes Urteil gefällt hatte.","State Farm launches all out war on California in blistering statement after bombshell wildfire exposé. The lengthy, strongly worded response came within hours of the state of California issuing a damning verdict following an investigation into the company’s handling of customer claims after the 2025 wildfires.","Res publica Farm omnia bella in California in duro enuntiatione post bombshell ignem ferum exposé movet. Longa, fortiter concepta responsio intra horas de statu Californiae sententiam damnabilem ferendo venit in investigatione in societate tractandarum de petitionibus emptorum post 2025 incendia.",2026-05-05 21:14:50+00:00
fe6d6100c15483e720c542314f9af219,2026-05-05T14:19:18Z,'wildfire climate change',crooksandliars.com,en,0.9,"Climate Change Wrecks Cattle Industry, But Ag Sec Blames Biden","Agriculture Sec. Brooke Rollins claimed the reason for outrageous prices on groceries and beef is because President Biden eviscerated the cattle industry over the ""hoax"" that is climate change.
Rollins even blamed a Nebraska wildfire for price increases witho…",https://crooksandliars.com/2026/05/agriculture-sec-rollins-climate-change,https://crooksandliars.com/files/primary_image/26/05/vlcsnap-2026-05-04-12h34m16s210.png,,"Agriculture Sec. Brooke Rollins claimed the reason for outrageous prices on groceries and beef is because President Biden eviscerated the cattle industry over the ""hoax"" that is climate change.
Roll… [+1897 chars]",,"Der Klimawandel ruiniert die Viehwirtschaft, aber der Agrarminister gibt Biden die Schuld. Landwirtschaftssek. Brooke Rollins behauptete, der Grund für die unverschämten Preise für Lebensmittel und Rindfleisch sei, dass Präsident Biden die Viehwirtschaft wegen des „Scherzes“ Klimawandel ausgelöscht habe.
Rollins machte sogar einen Waldbrand in Nebraska für Preiserhöhungen verantwortlich, ohne…","Climate Change Wrecks Cattle Industry, But Ag Sec Blames Biden. Agriculture Sec. Brooke Rollins claimed the reason for outrageous prices on groceries and beef is because President Biden eviscerated the cattle industry over the ""hoax"" that is climate change.
Rollins even blamed a Nebraska wildfire for price increases witho…","Climate Change Wrecks Cattle Industry, But Ag Sec Blames Biden. Rei Rusticae Scriptores &c. Brooke Rollins causam vindicavit pretia in groceria et bubula immania esse, quod Praeses Biden industriam pecudum super ""ludibrium"", id est mutationem climatis, evisceravit.
Rollins etiam culpavit Nebraska ignem ferum pro pretio augetur witho ...",2026-05-06 16:11:13+00:00
6b900a302ef3484a3379cc9e538774a4,2026-05-03T11:00:00Z,'wildfire buildings',www.cbc.ca,en,0.3,She fled the Fort McMurray fire 10 years ago. Now she's training as a B.C. firefighter,"Rachelle Briscoe was among the 80,000 people forced to flee as flames swept through Fort McMurray in May 2016. A decade later, she's training as a volunteer firefighter on Mayne Island in B.C.",https://www.cbc.ca/news/canada/british-columbia/fort-mcmurray-survivor-volunteer-firefigher-9.7184629,"https://i.cbc.ca/ais/1.3565836,1462369628000/full/max/0/default.jpg?im=Crop%2Crect%3D%280%2C65%2C600%2C337%29%3BResize%3D620",,"It has been 10 years since a devastating wildfire tore through Fort McMurray, Alta., destroying some 2,400 structures and causing nearly $9 billion in damage. 
The fire, known simply as ""The Beast,""… [+4450 chars]",,"Sie floh vor zehn Jahren vor dem Feuer in Fort McMurray. Jetzt macht sie eine Ausbildung zur B.C. Feuerwehrmann. Rachelle Briscoe gehörte zu den 80.000 Menschen, die fliehen mussten, als die Flammen im Mai 2016 über Fort McMurray fegten. Ein Jahrzehnt später absolviert sie eine Ausbildung zur freiwilligen Feuerwehrfrau auf Mayne Island in B.C.","She fled the Fort McMurray fire 10 years ago. Now she's training as a B.C. firefighter. Rachelle Briscoe was among the 80,000 people forced to flee as flames swept through Fort McMurray in May 2016. A decade later, she's training as a volunteer firefighter on Mayne Island in B.C.","Illa ante X annos incendium Fort McMurray aufugit. Nunc exercet ut B.C. firefighter. Rachelle Briscoe inter LXXX milia hominum fugere coactus est ut flammae per Fort McMurray mense Maio 2016. Post decennium, educator in Mayne Island in B.C.",2026-05-06 21:21:28+00:00
110f592758f9e48a76cfa124cd050372,2026-05-04T14:00:00Z,'wildfire insurance',www.globenewswire.com,en,0.9,Westland Insurance releases wildfire guide to help Canadian businesses prepare for the 2026 season,Westland’s guide provides practical risk guidance and recovery support for Canadian businesses Westland’s guide provides practical risk guidance and recovery support for Canadian businesses,https://www.globenewswire.com/news-release/2026/05/04/3286845/0/en/Westland-Insurance-releases-wildfire-guide-to-help-Canadian-businesses-prepare-for-the-2026-season.html,https://ml.globenewswire.com/Resource/Download/59a04099-9342-4b41-9930-e67d902fb594,,"Surrey, BC/Territories of the Coast Salish (Kwantlen, Katzie, Semiahmoo, Tsawwassen First Nations), May 04, 2026 (GLOBE NEWSWIRE) -- Westland Insurance, Canadas fourth-largest insurance brokerage, ha… [+2332 chars]",,"Westland Insurance veröffentlicht einen Leitfaden zu Waldbränden, um kanadischen Unternehmen bei der Vorbereitung auf die Saison 2026 zu helfen. Der Leitfaden von Westland bietet praktische Risikoberatung und Sanierungsunterstützung für kanadische Unternehmen. Der Leitfaden von Westland bietet praktische Risikoberatung und Sanierungsunterstützung für kanadische Unternehmen",Westland Insurance releases wildfire guide to help Canadian businesses prepare for the 2026 season. Westland’s guide provides practical risk guidance and recovery support for Canadian businesses Westland’s guide provides practical risk guidance and recovery support for Canadian businesses,Westland Insurance ducem ignem ferum dimittit ut negotiis Canadian auxilium parat 2026 tempore. Gubernator Westland practicum periculum directionis et recuperationis subsidia praebet auxilium pro Canadian negotiis Westland's dux praebet auxilium practicum periculum directionis et recuperationis pro negotiis Canadensis,2026-05-06 21:21:28+00:00
acdb5a231e45e133073e5aa9709b5d60,2026-05-04T14:04:45Z,'wildfire damage',financialpost.com,en,0.9,Westland Insurance releases wildfire guide to help Canadian businesses prepare for the 2026 season,"Westland’s guide provides practical risk guidance and recovery support for Canadian businesses Surrey, BC/Territories of the Coast Salish (Kwantlen, Katzie, Semiahmoo, Tsawwassen First Nations), May 04, 2026 (GLOBE NEWSWIRE) — Westland Insurance, Canada’s fou…",https://financialpost.com/globe-newswire/westland-insurance-releases-wildfire-guide-to-help-canadian-businesses-prepare-for-the-2026-season,,,"Westlands guide provides practical risk guidance and recovery support for Canadian businesses
THIS CONTENT IS RESERVED FOR SUBSCRIBERS ONLY
Subscribe now to read the latest news in your city and ac… [+4701 chars]",,"Westland Insurance veröffentlicht einen Leitfaden zu Waldbränden, um kanadischen Unternehmen bei der Vorbereitung auf die Saison 2026 zu helfen. Der Leitfaden von Westland bietet praktische Risikoberatung und Sanierungsunterstützung für kanadische Unternehmen. Surrey, BC/Territories of the Coast Salish (Kwantlen, Katzie, Semiahmoo, Tsawwassen First Nations), 4. Mai 2026 (GLOBE NEWSWIRE) – Westland Insurance, Kanadas vierter …","Westland Insurance releases wildfire guide to help Canadian businesses prepare for the 2026 season. Westland’s guide provides practical risk guidance and recovery support for Canadian businesses Surrey, BC/Territories of the Coast Salish (Kwantlen, Katzie, Semiahmoo, Tsawwassen First Nations), May 04, 2026 (GLOBE NEWSWIRE) — Westland Insurance, Canada’s fou…","Westland Insurance ducem ignem ferum dimittit ut negotiis Canadian auxilium parat 2026 tempore. Gubernator Westland periculum practicum regimen et recuperationem subsidii praebet pro negotiis Canadian Surrey, BC/Territorii Coast Salish (Kwantlen, Katzie, Semiahmoo, Tsawwassen Primae Nationes), 04, 2026 (GLOBE NEWSWIRE) - Westland Insurance, Canada in fou…",2026-05-06 21:21:28+00:00
022848200982f0d39017a2f5bbcaa613,2026-05-04T16:14:14Z,'wildfire wind',www.cbc.ca,en,0.9,"Spring wildfire risk in Alberta escalates with windy, dry conditions",The wildfire risk across central and southern parts of the province has begun to escalate as the dry conditions of early spring trigger the season’s first evacuation notices.,https://www.cbc.ca/news/canada/edmonton/wildfire-alta-9.7186697,"https://i.cbc.ca/ais/b936b9f4-9e9f-45b0-91f4-1b7328d5e063,1777845526891/full/max/0/default.jpg?im=Crop%2Crect%3D%2895%2C284%2C1358%2C763%29%3BResize%3D620",,"The wildfire risk across central and southern parts of the province has begun to escalate as the dry conditions of early spring trigger the seasons first evacuation notices. 
The wildfire risk in th… [+3471 chars]",,"Die Waldbrandgefahr im Frühjahr in Alberta steigt mit windigen und trockenen Bedingungen. Die Waldbrandgefahr in den zentralen und südlichen Teilen der Provinz hat begonnen zu eskalieren, da die trockenen Bedingungen zu Beginn des Frühlings die ersten Evakuierungsmeldungen der Saison auslösen.","Spring wildfire risk in Alberta escalates with windy, dry conditions. The wildfire risk across central and southern parts of the province has begun to escalate as the dry conditions of early spring trigger the season’s first evacuation notices.","Fons incendium incendium in Alberta periculum ventosum, siccum condiciones escalat. Periculum ignis igneum per partes centrales et meridionales provinciae escalate sicut condiciones aridas primi veris felis temporis primi animadversiones evacuationis incepit.",2026-05-06 21:21:28+00:00
1dbe26a08f8568d3859dd46c6c142c34,2026-05-01T10:47:59Z,'wildfire residents',www.nationalobserver.com,en,0.9,'Who we are': Albertans remember the Fort McMurray wildfire 10 years later,"Rob Rice says many residents of Fort McMurray, Alta., still can't stand the smell of campfire.",https://www.nationalobserver.com/2026/05/01/news/who-we-are-albertans-remember-fort-mcmurray-wildfire-10-years-later,https://www.nationalobserver.com/sites/default/files/img/2026/05/01/277c1448e7d994a028de8bb28d76391c9a780b36676dbd8c480bc4164184ec55_0.jpg,,"Rob Rice says many residents of Fort McMurray, Alta., still can't stand the smell of campfire.
It reminds them of the treacherous drive a decade ago through a tunnel of flames as, in their rear-view… [+7664 chars]",,"„Wer wir sind“: Die Albertaner erinnern sich zehn Jahre später an den Waldbrand in Fort McMurray. Rob Rice sagt, dass viele Bewohner von Fort McMurray, Alta, den Geruch von Lagerfeuer immer noch nicht ertragen können.","'Who we are': Albertans remember the Fort McMurray wildfire 10 years later. Rob Rice says many residents of Fort McMurray, Alta., still can't stand the smell of campfire.","""Qui sumus"": Albertans memento Fort McMurray ignem ferum post 10 annos. Rob Rice dicit multos incolas Fort McMurray, Alta., odorem campfire stare non potest.",2026-05-07 06:18:54+00:00
30a6aa94afe13fe6faf55773aef07fca,2026-05-01T16:32:49Z,'wildfire',www.local10.com,en,0.9,States across the wildfire-prone Western US are using AI for early detection,States across the wildfire-prone Western US are using AI for early detectionlocal10.com,https://www.local10.com/tech/2026/05/01/states-across-the-wildfire-prone-western-us-are-using-ai-for-early-detection/,https://www.local10.com/resizer/v2/FKBRE47F4RGEWFUHGZNL6SBR7U.jpg?auth=f27cbd11bc676565505b6a96f5479448f29975ab2b0faa4d93d42fc6fc0ef312&width=700,,"On a March afternoon, artificial intelligence detected something resembling smoke on a camera feed from Arizonas Coconino National Forest. Human analysts verified it wasn't a cloud or dust, then aler… [+6478 chars]",,"Staaten im gesamten Westen der USA, der anfällig für Waldbrände ist, nutzen KI zur Früherkennung. Staaten im gesamten Westen der USA, der von Waldbränden gefährdet ist, nutzen KI zur Früherkennunglocal10.com",States across the wildfire-prone Western US are using AI for early detection. States across the wildfire-prone Western US are using AI for early detectionlocal10.com,Civitates per ignem ferum prona US occidentales AI ad primam deprehensionem utuntur. Civitates per ignem ferum prone US Occidentis utuntur AI ad mane detectionlocal10.com,2026-05-07 06:18:54+00:00
3400229694d71607f64a27d65b8276a6,2026-05-06T00:58:43Z,'wildfire',www.kpbs.org,en,0.9,States across the wildfire-prone Western US are using AI for early detection,Another severe wildfire season is forecast for the Western U.S. due to record-breaking heat and an abysmal snowpack. Some states and utilities are trying to get ahead of that threat using AI.,https://www.kpbs.org/news/science-technology/2026/05/05/states-across-the-wildfire-prone-western-us-are-using-ai-for-early-detection,https://cdn.kpbs.org/dims4/default/4cce804/2147483647/strip/true/crop/1024x538+0+33/resize/1200x630!/quality/90/?url=http%3A%2F%2Fkpbs-brightspot.s3.us-west-2.amazonaws.com%2F7a%2Fb6%2F5509c19c49f3ab3ea85e4ba1f304%2Fap26121560196769.jpg,,"On a March afternoon, artificial intelligence detected something resembling smoke on a camera feed from Arizonas Coconino National Forest. Human analysts verified it wasn't a cloud or dust, then aler… [+6312 chars]",,"Staaten im gesamten Westen der USA, der anfällig für Waldbrände ist, nutzen KI zur Früherkennung. Für den Westen der USA wird aufgrund rekordverdächtiger Hitze und einer miserablen Schneedecke eine weitere schwere Waldbrandsaison prognostiziert. Einige Bundesstaaten und Versorgungsunternehmen versuchen, dieser Bedrohung mithilfe von KI zuvorzukommen.",States across the wildfire-prone Western US are using AI for early detection. Another severe wildfire season is forecast for the Western U.S. due to record-breaking heat and an abysmal snowpack. Some states and utilities are trying to get ahead of that threat using AI.,Civitates per ignem ferum prona US occidentales AI ad primam deprehensionem utuntur. Aliud tempus acerbum ignem ferum praecognoscet pro US occidentis ob recordum-fracti caloris et abysmal SnowPack. Nonnullae civitates et utilitates istius minae AI utentes praevenire conantur.,2026-05-07 06:18:54+00:00
